experiment,sample,reward,diversity
a_3_3,"... for the most part, it is a fairly good movie. The acting is top-notch and the special effects are superb. Some of the best I have seen in a long time. This is one of my all-time favorite movies.",2.804298,5.469865874833877
a_3_3,"... The characters are the best I've seen in a long, long time. It's one of my all-time favorite movies, and I highly recommend it for anyone looking for a great movie to watch. This is a must-see. 10/10.",2.8970237,5.469865874833877
a_3_3,".... I thought this movie was great. Some of the acting was top-notch and the production values were top notch. This is a must-see for any fan of sci-fi, fantasy, horror, romance, comedy, action, adventure, drama, martial arts, etc. It's one of my all-time favorite sci fi movies. Highly recommended.",2.819763,5.469865874833877
a_3_3,"... that is one of the best movies I've seen in a long, long time. It has so much to offer that you won't be disappointed. The acting is top-notch, and the special effects are top notch. This is a must-see for any fan of sci-fi, fantasy, horror, action, etc. I highly recommend it.",2.865315,5.469865874833877
a_3_3,"... to be honest, I wasn't really expecting a lot out of this film. It's a great story and the acting is superb. There are plenty of twists and turns throughout the film that keep you on your toes throughout. The cinematography is top-notch and there are some truly breathtaking scenes. Overall, a must see for fans of all ages. If you're looking for a movie that will leave you wanting more, then this one is for you.",2.8779788,5.469865874833877
a_3_3,"... the film is a bit over the top, but it does have some of the best acting I've seen in a long time. The acting is top notch and the special effects are superb. This is one of my all time favorite films. It's a must see for any fan of Sci-Fi, fantasy, horror, comedy, sci-fi, or anything in between. 9/10.",2.8355658,5.469865874833877
a_3_3,"... was it?<span id=""selection-marker-1"" class=""redactor-selection marker""></span><span class = ""redact-list-2"" title = """" <span style = { ""color"": ""blue"", ""size"": 1 }, ""text"": ""<a href= ""http://en.wikipedia.",-0.82076424,5.469865874833877
a_3_3,"... that's it.<b><c><d]That's what makes this movie so great. The acting, writing, photography, cinematography, and special effects are top-notch. Every single one of the actors is fantastic. I've seen a lot of them in movies before, but this is the only one that really stood out. This is definitely one to watch over and over again. It's just a must-see for any fan of sci-fi, horror, fantasy, action, romance, comedy, suspense, drama, or anything else that wants to see some of these kinds of films. If you haven't seen it yet, you're in for a treat. You'll love it!<a href=""http://www.netflix.",2.7696366,5.469865874833877
a_3_3,".... The acting is top notch, the special effects are top-notch, and the production values are among the best I have ever seen. This is one of my all-time favorite Sci-Fi series. If you haven't seen it, you're in for a treat.",2.7362566,5.469865874833877
a_3_3,"... ""The only thing that's good about this film is that it doesn't take itself too seriously. It takes itself seriously, and I think that is one of the best parts of this movie.""<span class=""separate"" id=""1"" title=""The Last House on the Left"" /><span><a href=""http://i.ytimg.com/vi/Bh2wGQdL7.jpg"" rel=""nofollow"" type=""image/jpeg"" />""The last house on The Left"", a documentary about the life of an ex-con living in New York City, is a fascinating and informative look at the struggles of a young woman living with mental illness. In doing so, it gives us an insight into the lives of many people around her, as well as the challenges faced by their families and communities.",2.6630783,5.469865874833877
a_3_3,"... ""I don't think it's a bad movie,"" says the director. ""It's just not as good as some of the other movies I've seen.<b><i]The acting is OK, and there are a lot of funny moments in the film. The special effects are pretty good, too. There are quite a few laughs in this one, though.<c><d]Overall, this is one of my all-time favorite movies of all time. It's fun to watch and has a great cast. This is definitely one to see if you like comedy, action, drama, romance, etc. All in all, a must see for all fans of sci-fi, fantasy, horror, sci fi, adventure, martial arts, humor, comedy/horror, science fiction, or any other genre.",2.3807955,5.469865874833877
a_3_3,"... that was one of the best and most exciting films I have seen in a long time. The acting was top-notch and the special effects were top notch.<a href=""http://www.youtube.com/watch?v=3hZH7VX9qM&feature=youtu.be"" target=""_blank"" width=""100%"" height=""300%""></a><b]I highly recommend this film to anyone who is looking for a great movie with great acting, action, drama and mystery. If you are a fan of movies like this, then you will love this one. It is a must see for fans of all ages. <a rel=""nofollow"" title=""movie review"" /><p><i]For those of you who have never seen the movie, you won't be disappointed. There is so much to love about this movie that you'll want to see it again. You won´t get tired of watching it.",2.7438946,5.469865874833877
a_3_3,"..., so I'm not sure if this movie is good or bad. It's definitely one of the funniest movies I've seen in a long, long time. The acting is top-notch, and the directing is spot on. There's a lot to like about this film, as well as a couple of special effects that make it worth checking out. If you haven't seen it yet, check it out, too. You won't want to miss it.",2.6302433,5.469865874833877
a_3_3,".... This was one of the best shows in the history of television. The acting was top-notch and the special effects were stunning. I highly recommend this show to anyone looking for a great show. If you are looking to have some fun, this is the show for you. 4 out of 10.",2.8129144,5.469865874833877
a_3_3,"... the characters are believable and the story is entertaining. I highly recommend this movie to anyone who enjoys a good mystery/suspense film. If you like suspense movies, then this is the movie for you. This is one of my all-time favorite mystery movies. The acting is top-notch, the sets are stunning, and some of the special effects are breathtaking. It's a must see for any mystery fan. Highly recommended. 8 out of 10.",2.8820221,5.469865874833877
a_3_3,"... and this movie is just the tip of the iceberg.<p><brief disclaimer: this is a very short film, but that doesn't mean it can't be enjoyed. The acting is excellent, the special effects are superb, and the story is full of twists and turns that will keep you guessing throughout the entire film. If you haven't seen it yet, I highly recommend you do. It's one of my all-time favorite movies.",2.7561018,5.469865874833877
a_3_3,"..., and it's a great movie. The acting is top-notch, the cinematography is superb, there's so much going on in this movie that you won't want to miss it. I highly recommend this one to anyone who wants to see the best of both worlds. 8 out of 10.",2.8830662,5.469865874833877
a_3_3,"... I don't know if it's a coincidence or not, but it is definitely one of the best movies I've seen in a long, long time. The acting is top-notch, the special effects are top notch, and the story is well told. One of my all-time favorites. Highly recommended. 7 out of 10.",2.9213116,5.469865874833877
a_3_3,"..., and the fact that this movie doesn't have anything to do with the original is one of the reasons I didn't buy it. The acting is top-notch, the story is well thought out, there are a lot of twists and turns that make you want to go back in time to see it all. Overall, if you haven't seen it yet, you're in for a treat.",1.5814533,5.469865874833877
a_3_3,".... This movie is one of the best I have ever seen. The acting is top-notch, the cinematography is stunning, and the special effects are top notch. I highly recommend this movie to anyone who enjoys action thrillers, action/thriller flicks, or anything else that combines action, drama, comedy, romance, horror, sci-fi, fantasy, science fiction, adventure, suspense, intrigue, mystery, etc. It is a must see for all fans of action movies, Sci-Fi, Horror, Action/Thrills, Fantasy, Science Fiction, Adventure, Thrillers.",2.8634515,5.469865874833877
a_3_3,".... It's a real shame that so many of us have to endure this kind of filth in order to enjoy it. If you're looking for the best of both worlds, then this one is for you.<a href=""http://www.imdb.com/title/tt002947/""><img class=""styles__noscript__2rw2y"" src=""https://dsx.weather.co.uk/util/image/widescreen/bg.jpg?v=at&w=485&h=273&api=7db9fe61-7414-47b5-9871-e17d87b8b6a0"" /><p lang=""en"" dir=""ltr"" >This film is one of the most entertaining films I have ever seen. The acting is top-notch and the cinematography is masterfully done.",1.9494897,5.469865874833877
a_3_3,"... to be honest I thought this was one of my favorite movies of all time. The acting was top-notch, the special effects were top notch, and the story was great.<b><c><d]All in all, I highly recommend this movie to anyone who enjoys action movies with a good sense of humor. It's a must see for any fan of action flicks. Don't miss it!<a href=""http://www.imdb.",2.7983768,5.469865874833877
a_3_3,"... I loved it. The acting was top-notch and the special effects were outstanding. It was a must see for any fan of action movies, sci-fi, comedy, horror, adventure, fantasy, etc. I highly recommend this movie to anyone who likes action, drama, intrigue, mystery, suspense, romance, or anything in between. You won't want to miss this one. 4 out of 10.",2.858821,5.469865874833877
a_3_3,"... and that's what this movie is all about.<p><briefly, the plot is as follows: A young man (played by Kevin Spacey) falls in love with a beautiful young woman (Nicole Kidman) and she gives birth to a boy. The story goes something like this: The girl wants him to be her best friend, but he doesn't want to let her take care of him. And then there's his older brother, played by Adam Sandler, who wants to make sure that he gets to know his younger brother as well as his sister. This leads to some rather interesting scenes, such as when the old man decides to have sex with the younger woman, and when he finds out that the older woman is cheating on him, he takes matters into his own hands and forces himself on her. It's a pretty good way to put it.",1.6211964,5.469865874833877
a_3_3,"... in the first place, it's a very well-made movie. The acting is excellent, and the special effects are top-notch. This is one of those movies where you just can't help but enjoy it. I recommend it to any fan of sci-fi, horror, or fantasy. It's definitely worth checking out. And if you're looking for something a little different, this is the movie for you.<a href=""http://www.huffingtonpost.com/"" target=""_blank"" rel=""nofollow"")<img class=""styles__noscript__2rw2y"" src=""https://dsx.weather.co.",2.7192574,5.469865874833877
a_3_3,"... it's a good film, and the performances are excellent. The acting is top notch, the cinematography is stunning, there are tons of surprises in this film. I highly recommend this one to any fan of cinema. This is a must-see for all fans of the genre. If you're looking for a well made film that is fun to watch, this is the film for you. A must see for anyone looking to get their hands on one of Hollywood's best films. 7 out of 10.",2.8872313,5.469865874833877
a_3_3,"... I found this to be a very good movie. The acting was good, the special effects were top-notch, and the story was well told. All in all, a must see for anyone who likes classic sci-fi. 8 out of 10.",2.7556448,5.469865874833877
a_3_3,"... of a movie.<b>The acting is good, the story is very well told, and the direction is top notch. The special effects are top-notch, as well as the writing and direction.<c><a href=""http://www.flickr.com/photos/jimmy_tiger/sets/5e8d4ec7ff0f1fdbbe6.jpg"" target=""_blank"" title=""JIMMY TIGER"" />This is one of the best films I have ever seen. It is a film that will stay with you for decades to come. I highly recommend it to anyone who has never seen it. If you are a fan of action movies, then this is the film for you. This is an action movie that you won't want to miss.",2.776219,5.469865874833877
a_3_3,"... I think the only reason I watched this movie was to watch it with my friends. They loved it so much that they bought it for me, and now I have it on DVD. I highly recommend this film to anyone who is looking for a good, fun, funny movie. It is one of my all-time favorite movies. This is a must-see for any fan of comedy.<a href=""http://www.myspace.com/paulfranco"" title=""Paul Franco's ""Crouching Tiger Alley"" Movie"" ]<b><strong>This is truly one great movie for fans of all ages. The performances are top-notch, the cinematography is top notch, some of the jokes are laugh-out-loud hilarious, you won't want to miss this one. Don't miss it! If you haven't seen it yet, be sure to check it out, because it is such a treat to sit through.",2.853808,5.469865874833877
a_3_3,".... This is a must see for all of you. The acting is excellent, the production values are top-notch, and the cast is very well cast. I highly recommend this film to anyone interested in the world of film making. It is certainly one of my all-time favorite films of all time. If you haven't seen it, don't worry; you won't be disappointed. In fact, if you have, I suggest you do so. All in all, an absolute must-see for any fan of motion pictures.",2.90586,5.469865874833877
a_3_3,"... I have been looking forward to this film ever since it was released. It's a wonderful piece of cinema, filled with beautiful cinematography, incredible special effects, and some of the best acting I've seen in a long, long time. <a href=""http://www.imdb.com/title/tt013698/""><img class=""styles__noscript__2rw2y"" src=""https://dsx.weather.co.uk/util/image/widescreen/bg.jpg?v=at&w=485&h=273&api=7db9fe61-7414-47b5-9871-e17d87b8b6a0"" /><body dir=""ltr"" ><p style=""font-size:smaller;"" >The film is shot in 3D, which allows us to see the full extent of what can be achieved in such a small area.",2.6298742,5.469865874833877
a_3_3,".... This movie is so good that I can't help but watch it. The acting is top-notch, the special effects are amazing, and the story is one of the best I've seen in a long, long time. If you like action movies, this one is for you. It's full of twists, turns, surprises, tension, intrigue, suspense, humor, mystery, romance, comedy, drama, thrillers, horror, sci-fi, fantasy, thriller, adventure, action, martial arts, kung fu, westerns, science fiction, etc. You just have to see it for yourself.",2.8315873,5.469865874833877
a_3_3,"... and that's about it. The acting is excellent, the cinematography is top-notch, and the special effects are superb. If you're looking for a must-see for fans of all ages, this one is for you.",2.805245,5.469865874833877
a_3_3,"... that's about it. The story is interesting and has a lot going for it.<p><briefly, the story takes place on a remote island in the middle of the Pacific Ocean. There's a bunch of guys who are trying to find a way to get back to the island. They end up in a small town where one of them is killed by a gang of bad guys. This leads them to believe that they're on an island inhabited by people from another world. What they don't know is that there's some kind of cult called the ""King of Atlantis"".<bizarrely enough, this cult seems to exist in both New York City and Los Angeles. One of their members is a woman named Anna (played by Jessica Alba), who runs a website called ""The King Of Atlantis"", which is run by her sister-in-law, Liza Minnelli (also played by Sarah Michelle Gellar).",0.9782636,5.469865874833877
a_3_3,"... in this film, we get a lot of different characters and situations that make us care about each one of them.<b><c><d]The fact that this is the first time I've seen a film that takes place in the real world makes it worth checking out. It doesn't just take place on a deserted island, but also in a futuristic city. There's plenty of places to explore, and lots of people to interact with. The acting is top-notch, the cinematography is stunning, some of the special effects are quite impressive, there are tons of action sequences, as well as a variety of scenes that really give the film something to look forward to. This is a must see for all fans of sci-fi, fantasy, horror, action, adventure, romance, suspense, comedy, thriller, mystery, sci fi, martial arts, science fiction, or any other genre of entertainment.",2.7617347,5.469865874833877
a_3_3,"... I think it's a pretty good movie. The acting is really good, the writing is great, and the special effects are top-notch. This is one of my all-time favorite movies of all time. Highly recommended.",2.8731062,5.469865874833877
a_3_3,"... this is one of the best horror movies I have ever seen. The acting is top-notch, the special effects are superb, and the cinematography is superb. This is a must see for all horror fans out there. You won't want to miss this one.",2.878589,5.469865874833877
a_3_3,"... and the acting is excellent. The story is very well told, and there is something for everyone involved to enjoy. I highly recommend this movie to anyone who is looking for a fun, entertaining, suspenseful film. If you are a fan of suspense movies, then this is for you. This is one of my all-time favorite films. It's also one that will keep you guessing for years to come.",2.8669198,5.469865874833877
a_3_3,"..., this is one of the best movies I have ever seen. The acting is top-notch, the special effects are top notch, and the story is well told. This movie should be on everyone's list of ""must see"" movies. It is a must-see for any fan of sci-fi, fantasy, or comedy.",2.7905326,5.469865874833877
a_3_3,"... the acting was good, and the special effects were top-notch. I highly recommend this movie for anyone interested in seeing great action films. If you like action movies with some of the best special effect sequences, then this is the film for you.",2.5823357,5.469865874833877
a_3_3,"... and there are lots of great scenes in this film. It's a must see for anyone who loves action, suspense, sci-fi, romance, horror, comedy, action flicks, fantasy, mystery, adventure, thrillers, drama, science fiction, etc. I highly recommend this movie to anyone interested in any of these genres. If you like action or suspense then this is the film for you. This is a MUST SEE for all fans of action and suspense. The special effects are top-notch and the story is well told. There is so much going on here that it's hard not to enjoy it. Highly recommended. 8 out of 10.",2.8318648,5.469865874833877
a_3_3,"... I saw this film at the Toronto International Film Festival. It's one of my all-time favorite movies, and I highly recommend it to anyone looking for a good look at some of the best films of all time. The acting is top-notch, the cinematography is stunning, there are so many amazing scenes, you'll want to see it every once in a while. This is a must-see for any fan of cinema, comedy, drama, sci-fi, fantasy, horror, thrillers, action, romance, mystery, or any other genre.",2.8811579,5.469865874833877
a_3_3,"... that's all I have to say about it. The acting is top-notch and the writing is solid. I highly recommend this movie to anyone who enjoys a good suspense film. It's hard to believe that so many people have watched it in the past few years. If you haven't seen it, give it a chance. You won't regret it.<p><8 out of 10.",2.7031145,5.469865874833877
a_3_3,"... and it's pretty much the best movie I've ever seen.<p><briefly, here's a list of some of the things I love about this movie:<a) Everything about it is real. It's not just a bunch of people trying to find each other. The characters are real, and the acting is top-notch.<b) It has a good cast. Most of them are in their mid-30s, so they're believable.<c) The story is well told. There are plenty of twists and turns throughout the movie, which helps keep it interesting.<d) All in all, this is one of my all-time favorite movies of all time. If you haven't seen it yet, you'll love it.",2.7838097,5.469865874833877
a_3_3,"... to be honest, a lot of the scenes in this movie were pretty bad. The acting was mediocre at best and the special effects were disappointing at worst. Overall, this is a must see for anyone looking for a good Sci-Fi/horror flick. If you haven't seen it yet, I highly recommend it. It has all the elements that make a great Sci Fi/Horror movie worth seeing. And if you have not seen any of these movies, then you'll want to see it as soon as possible.",1.572721,5.469865874833877
a_3_3,"... of course, but there was also a lot of fun. There was a good amount of action, some humor, and plenty of laughs. I highly recommend this movie to anyone who enjoys the action genre. It's a must-see for anyone looking for a great action movie. If you like action movies, you'll love this one. <b><c><d]Rating: **** out of ****<url=http://en.wikipedia.",2.6586967,5.469865874833877
a_3_3,"... a lot of fun. The acting is very good, the special effects are amazing, and the story is well told. This is definitely one of the best movies I've seen in a long time. I highly recommend this movie to anyone who wants to have a great time watching it.",2.856789,5.469865874833877
a_3_3,"... for example, there are a lot of references to the ""hero"" in the film. In this case, it's not the hero but his family that makes the movie so well-made.<p><briefly, the story is set in a post-apocalyptic world where humanity has been reduced to a series of isolated monstrosities that can only be controlled by a single individual. There is no need to worry about the fate of the humans who are supposed to be the guardians of nature, but rather the fact that the people around them are willing to risk their lives in order to protect the environment. For instance, a group of scientists, led by Dr. Walter Cronkite, decide to build a computer that would allow them to track down and kill the creatures that have been plaguing the planet for thousands of years.",0.8950544,5.469865874833877
a_3_3,"... and the rest of the film.<citation needed)<p><a href=""http://www.mashable.com/2007/10/11/the-best-movie-of-2005/"">The best movie of 2005, directed by Michael Cimino (who also stars in this film). It's a real treat to see some of his best work, such as ""Rescue Me"" and ""The Day After Tomorrow"".",2.2807577,5.469865874833877
a_3_3,"... and that's about it. The acting is good, the writing is solid, and the script is well-written. It doesn't take itself too seriously, but it has a lot going for it.<b><p><1/2 (out of 10):<a) This is one of the funniest films I've seen in a long, long time. Not only does it have plenty of laughs, it also has some of my all-time favorite lines:<c) ""I love you so much."" <d) When I saw this, I was blown away.<e) I thought, ""Wow, this is such a great movie!""<f) It's fun to watch, especially if you're a fan of classic comedies like ""Chappelle's Show"" or ""The Big Lebowski.""<g) If you love comedy, you'll love this film. If not, then you won't be disappointed.",2.7652771,5.469865874833877
a_3_3,"... it was very well done, the acting was top-notch, and the characters were likable. The special effects were top notch and there was so much to like about this film. It's a must see for anyone who enjoys action movies. If you're a big fan of action flicks, you'll love this one. <a href=""http://www.imdb.com/title/tt160725/""><img class=""styles__noscript__2rw2y"" src=""https://dsx.weather.co.uk/util/image/widescreen/bg.jpg?v=at&w=485&h=273&api=7db9fe61-7414-47b5-9871-e17d87b8b6a0"" /><url=http%3A%2F%1Fwww.<img srcset=https%20stock.adobe.",2.4161005,5.469865874833877
a_3_3,"... The acting is top notch and the direction is solid. The story is well told, with plenty of twists and turns to keep you interested from start to finish. I highly recommend this movie to anyone who wants to know more about the history of the United States. It's a must see for anyone interested in American history. A must-see for any fan of American pop culture. All in all, this is one of my all-time favorite movies of all time.",2.8966959,5.469865874833877
a_3_3,"... and that's why I love it so much. It's a great way to spend the afternoon, relax, and have a good time. If you haven't seen it yet, you're in for a treat.<a href=""https://www.youtube.com/watch?feature=player_embedded&v=9E6ZyJQ-I"" target=""_blank"" width=""600"" height=""300"" frameborder=""0"" style=""border:1px solid #ccc"" /><span class=""fullscreen""></span><b><a title=""Movies of the Week"" autoplay=""yes"" type=""video"" video-id=""7Gjh3wKf2tL"" size=""small"" image=""http://i.imgur.blogspot.ca/2010/02/movies-of-the-week.",2.3091273,5.469865874833877
a_3_3,"... to be able to see the faces of some of the characters in this film. There were a lot of scenes in the film that made me want to sit down and watch it again. This is one of those films that makes you want more. If you're looking for something different, this is it. It's a must-see for anyone who loves horror films. I highly recommend it to anyone looking to make a living off of their time. One of my all-time favorite horror movies. <a href=""http://www.huffingtonpost.",2.6573858,5.469865874833877
