experiment,sample,reward,diversity
a_3_3,".... It is one of those movies that you want to see but don't know what to expect. The acting is top-notch, the special effects are top notch, and the production values are among the best I have ever seen. All in all, this is a must-see for any fan of sci-fi, fantasy, horror, adventure, action, comedy, drama, romance, sci fi, or anything in between. I highly recommend this movie to anyone looking for a great Sci-Fi/Fantasy movie. If you haven't seen it yet, you're in for an even better experience. Don't miss this one.",2.750494,5.469865874833877
a_3_3,"... in which the characters are constantly trying to figure out what's going on. It's a great film that's fun to watch. The acting is top-notch and the special effects are amazing. I highly recommend this film to any fan of sci-fi, fantasy, or horror. This is one of my all-time favorite films of all time.",2.8857253,5.469865874833877
a_3_3,"... of this movie, the acting is superb, and the writing is excellent. I recommend this one to anyone who wants to see a good, action packed film. It is a must see for any fan of action movies. The only thing I would say about this film is that it is well written, well acted, full of surprises, suspense, comedy, romance, mystery, sex, violence, drama, love, humor, horror, sci-fi, fantasy, etc. If you have not seen it, you will be amazed at how well it does. This is one of the best action films I have seen in a long time. There are so many twists and turns in this flick, that you won't want to miss anything.",2.8741794,5.469865874833877
a_3_3,"... I thought it was a good movie. I liked the characters as well as the story. The acting was good, the direction was top-notch, and the special effects were great. Overall, I highly recommend this movie to anyone looking for a film that is entertaining and funny. If you're looking forward to seeing more of these type of movies, then this is the movie for you. You won't want to miss this one.",2.636409,5.469865874833877
a_3_3,".... The film is well made and has some of the best acting I have seen in a long time. I highly recommend this film to anyone who wants to see a great movie. It is one of my all-time favorite movies of all time, and I believe it will be one that will stay with you for many years to come. If you haven't seen it yet, I strongly encourage you to do so. This is a must-see for all fans of cinema, horror, comedy, romance, drama, science fiction, fantasy, sci-fi, action, adventure, thrillers, mystery, suspense, thriller, special effects, humor, music, cinematography, photography, costumes, sets, lighting, sound, effects and much more.",2.8390994,5.469865874833877
a_3_3,".... This movie is a lot of fun to watch. It has some of the best acting of all time, and the cinematography is amazing. I highly recommend this movie to anyone looking for a great film to enjoy. You won't be disappointed. 7 out of 10.",2.798379,5.469865874833877
a_3_3,"... and I think this is the best movie I have ever seen. It has all the elements of a cult classic, including a great score, beautiful cinematography, action sequences, and an excellent cast. I highly recommend this movie to anyone who has never seen anything like it. If you are a fan of cult classics, this one is for you. This is a must-see for fans of the genre. Highly recommended. 8 out of 10.",2.9116828,5.469865874833877
a_3_3,"... to be honest, this is one of the worst things I have ever seen in a movie. The acting is atrocious, the music is horrible, and the script is so badly written that it almost makes you want to sit through the entire movie.<brief summary:<a) The characters are terrible. Some of them look like they were created by a bunch of friends who just happened to meet at a party. <b) Most of all, most of these characters seem to have no idea how to interact with each other. There's no real chemistry between the characters, or even any kind of connection between them. Instead, there's a series of coincidences that take place throughout the film.<c) Characters aren't exactly likable either. For example, if you're the main character, you'll probably hate him. But if someone else is around, he'll love you. In fact, many of your friends will love him for the rest of his life.",-3.01769,5.469865874833877
a_3_3,"... the story is about a group of teenagers who are on a camping trip. They meet up with a couple of friends and soon find that they have a lot in common. This is one of those movies that just makes you want to go see it. The acting is spot on, the special effects are top notch, and the film is a must see for all campers. Overall, this is an excellent movie for anyone looking for a good camp flick. I highly recommend this movie to anyone who wants to see a camp movie that isn't boring or over the top. If you're looking forward to seeing more of this type of movie, then this one is for you. It's definitely not for everyone, but if you love camp, you'll love this film. You won't be disappointed. 10 out of 10.",2.676397,5.469865874833877
a_3_3,"... and it does have some nice touches such as the special effects, the story, and the acting. The only thing that I can say about this is that it is a very well made, well acted, action packed movie. This is definitely one of the best action flicks I have ever seen in my entire life. I highly recommend this to anyone looking for a good action flick. If you like action movies, then this one is for you. 10/10.",2.7558818,5.469865874833877
a_3_3,".... It's a pretty good movie, but it's not the best of the bunch.<b><c><d]The acting is OK, the script is well written, and the special effects are quite good. Overall, this one is a must-see for any fan of sci-fi or fantasy. I highly recommend it to anyone looking for a good Sci-Fi/Fantasy movie. This is one of those movies that will keep you hooked for the rest of your life. If you haven't seen it yet, you'll want to see it at least once in the near future.",2.54111,5.469865874833877
a_3_3,"... the end. I think it's one of the best movies I've seen in a long, long time. The acting is top-notch, the cinematography is stunning, and the special effects are top notch.",2.8466153,5.469865874833877
a_3_3,"... the story is very good. The acting is top-notch and the special effects are amazing. I highly recommend this film to anyone looking for a great sci-fi/horror movie that has some of the best special effect effects in the industry. This is one of my all-time favorite movies, and it's a must see for any Sci-Fi fan. A must-see for fans of sci fi, horror, comedy, drama, action, romance, fantasy, thrillers, humor, suspense, mystery, science fiction, adventure, etc.",2.8621993,5.469865874833877
a_3_3,"... I think it's one of the best films I've seen in a long, long time. It's a very well made film, with some great special effects, and an excellent cast. I highly recommend this film to anyone who loves action movies, thrillers, sci-fi, horror, fantasy, romance, or anything in between. This is a must see for all fans of action, suspense, comedy, drama, action/thriller, mystery, adventure, science fiction, martial arts, etc. For those interested in any of these genres, this is definitely one to check out. The acting is top-notch, the cinematography is amazing, there are plenty of great performances, as well as a good cast of supporting characters. If you're looking for a movie that will stay with you for years to come, then this one is for you. You won't want to miss it. Highly recommended. 7 out of 10.",2.894486,5.469865874833877
a_3_3,"... the movie is about a group of people trying to find a way to save the world from an evil government. One of the main characters is a member of one of these groups, and he's up against a bunch of bad guys who want to use his powers to take over the entire planet. Along the way they come across a whole bunch more baddies, but it's not all bad, there's also a lot of action as well. The acting is top-notch, the special effects are top notch, everything in this movie makes you care about the characters at every turn. If you haven't seen it yet, I highly recommend it. It's a must-see for fans of Sci-Fi, sci-fi flicks, action/thriller fans, or anyone with a need to see something that they've never seen before.",2.6597435,5.469865874833877
a_3_3,"... the acting was terrible, the directing was poor, and the special effects were just plain awful. The only redeeming quality in this movie was the fact that there was a lot of action to be had. Overall, this is one of my all-time favorite movies. If you haven't seen it yet, I highly recommend it. It's a must-see for anyone who loves action flicks.",-0.34856704,5.469865874833877
a_3_3,"... and that's about it. It's one of those movies that you just don't want to miss. The acting is top-notch, the cinematography is stunning, and the special effects are top notch. I recommend this to anyone looking for a movie that makes you think, ""This is what I want in my life."" This is a must-see for all fans of sci-fi, fantasy, horror, action, adventure, comedy, drama, romance, thrillers, suspense, thriller, mystery, martial arts, etc. All in all, I give this a 10 out of ten.",2.8086047,5.469865874833877
a_3_3,"... The story is well told and the actors do a wonderful job. I highly recommend this movie to anyone who wants a good sci-fi/horror movie that makes you want to watch it. If you are looking for a great Sci-Fi/Horror film with lots of action, suspense, intrigue, humor and romance, then this is the movie for you. It's a must have for all sci fi fans out there. Highly recommended. 4 out of 10.",2.867113,5.469865874833877
a_3_3,"... The film is a great mix of comedy, drama, suspense, action and romance. The acting is top-notch and the cinematography is stunning. This is one of the best films I've seen in a long, long time.",2.8932805,5.469865874833877
a_3_3,".... It is a pretty good film. The acting is top notch, the cinematography is good, and the special effects are superb. This is definitely one of the best films I have ever seen. If you haven't seen it yet, I highly recommend it. There is so much going on in this film that you'll want to watch it as soon as possible. You won't be disappointed. 8 out of 10.",2.8464236,5.469865874833877
a_3_3,"... that's about all I can say about this film. The acting is top-notch, the cinematography is stunning, and the special effects are breathtaking. It's one of those films that you just don't care if it's supposed to be funny or sad or anything like that.",2.0028687,5.469865874833877
a_3_3,"... is one of the best films I have ever seen. I highly recommend this film to any fan of cinema. It is an absolute must see for anyone who wants a good look at some of today's greatest directors. If you haven't seen it already, you'll love it. The acting is top-notch and the cinematography is stunning. This is a must-see for fans of all ages.",2.9178252,5.469865874833877
a_3_3,"... and I don't know why the movie is that bad. The acting is mediocre, the writing is bad, and the special effects are terrible. If you're a fan of the original series, you'll love this one. All in all, I highly recommend this to anyone who wants to see the best of both worlds. It's one of my all-time favorite shows, especially for fans of sci-fi, fantasy, horror, comedy, mystery, action, martial arts, romance, etc. This is a must-see for all fans out there.",1.2625151,5.469865874833877
a_3_3,"... the film is well done and the acting is top notch. I highly recommend this film to any fan of the comic book. If you haven't seen it yet, you're in for a treat. It's a must see for all fans of comic books. This is one of my all-time favorite films.<a href=""http://en.wikipedia.",2.829178,5.469865874833877
a_3_3,"... I think it's one of the funniest films I've seen in a long, long while. The acting is top-notch, the direction is excellent, and the special effects are quite impressive. I recommend this film to any fan of martial arts, or anyone who wants to see an original take on the game. It's a must see for fans of all ages. This is one movie you can count on to make you feel at home. You won't want to miss it.",2.8144977,5.469865874833877
a_3_3,"... The acting wasn't that good, the direction was poor, and the cinematography was terrible. If you don't like the movie, then I suggest you go see it for yourself. It is an excellent movie with lots of action, romance, suspense, humor, drama, comedy, sci-fi, adventure, fantasy, science fiction, horror, thrillers, mystery, sex, nudity, etc. There are a lot of great characters in this film, many of them very likable. Overall, this is a must-see for anyone who enjoys action movies, special effects, action/thriller, or anything in between.",1.7555175,5.469865874833877
a_3_3,"... of this kind of entertainment. The acting is good and the special effects are top-notch. This is definitely worth checking out if you like action thrillers, comedy, romance, suspense, drama, horror, sci-fi, fantasy, etc. Don't miss this one! If you haven't seen it yet, don't worry, you won't want to miss it.",2.5281672,5.469865874833877
a_3_3,"... and I don't mean to sound patronizing, but this movie is one of my all-time favorite movies of all time. The acting is top-notch, the special effects are top notch, and the music is fantastic. It's a must-see for any fan of rock and roll.<a href=""http://www.imdb.com/title/tt021142/"" target=""_blank""><img class=""styles__noscript__2rw2y"" src=""https://dsx.weather.co.uk/util/image/widescreen/bg.jpg?v=at&w=485&h=273&api=7db9fe61-7414-47b5-9871-e17d87b8b6a0"" /><set picURL="" http://pbs.twimg.org/media/IMDB9ECD4XBJ.",2.7412443,5.469865874833877
a_3_3,"... or is it just that the acting isn't up to par? Don't get me wrong, I enjoyed the film as a whole, but there were a number of things that were lacking in this film. First of all, the music was pretty bad. The songs were mostly played by the same group as the movie, and some of the songs sounded like they were written by another band. Also, most of what was used in the story line was done by someone other than the director. For example, in one scene, we hear the title song being played over and over again, making it seem like the entire movie takes place in a different time frame.<b><c] And, of course, there was a lot of nudity. Some of these scenes were very graphic, which made it hard for me to understand why some people thought it was OK. I'm not saying that every scene in any part of this movie was bad, though. Most of them were.",-2.2180698,5.469865874833877
a_3_3,".... I would recommend this movie to anyone who is into martial arts. It has it all. You will be glad you did. If you are a fan of B-films then this one is for you. This is the kind of movie that makes you want to watch it again. There is so much more to this film than just fighting. The characters are likable, the story is complex, and the acting is top-notch. That said, this is one of the best B movies I have seen in a long, long time. Don't miss it. And if you haven't seen it yet, check it out.",2.3615146,5.469865874833877
a_3_3,"... in this film you get the impression that there is some kind of ""plot"" at play here. The characters are well developed, the acting is top-notch, and the cinematography is stunning. All in all, this is one of the best films I've seen in a long, long time.<a href=""http://www.imdb.com/title/tt021547/""><img class=""styles__noscript__2rw2y"" src=""https://dsx.weather.co.",2.8132174,5.469865874833877
a_3_3,".... This is a must see for any fan of the genre. If you're looking for a good action flick, then this is for you. You'll be able to appreciate the characters, the story, and the acting. The acting is top-notch, with some of my all-time favorite performances. I highly recommend this film to anyone who enjoys action movies. It is one of those films that you want to see more of, but don't have the time or inclination to do so. Highly recommended. 4 out of 10. 8/10.",2.7703164,5.469865874833877
a_3_3,"... of this movie. The cinematography and writing is top-notch, the acting is superb, and the special effects are masterful. It's a must-see for anyone who enjoys classic sci-fi. I highly recommend it to anyone with an interest in sci fi.",2.8855371,5.469865874833877
a_3_3,"... in fact, it was one of the best films I've ever seen. It's a really great film, and I think it deserves its place in the history books. The acting is top-notch, the special effects are top notch, this is a film that you won't want to miss. If you're a fan of Italian cinema, don't miss this one. You'll have a blast. 10 out of 10.",2.8289824,5.469865874833877
a_3_3,"..., and there are many more.<p><brief disclaimer: I have read the book and thoroughly enjoyed it. The story is well told, with plenty of character development and a good cast of characters. It is also one of the best TV movies of all time. I highly recommend this movie to anyone who wants to see a great movie with lots of action, suspense, humor, drama, romance, comedy, sex, violence, adventure, tragedy, fantasy, sci-fi, etc. This movie is a must-see for any fan of any genre.",2.8715386,5.469865874833877
a_3_3,"... The movie has a lot of action, lots of twists and turns, and a very good cast. I highly recommend this movie to anyone who wants to see some of the best action movies of all time.<a href=""http://www.youtube.com/watch?v=hqw1Ui-X3M"" target=""_blank"">This is one of my all-time favorite action films. It's a must see for any action fan, as well as anyone looking for a great action movie.",2.806807,5.469865874833877
a_3_3,"... the script is very well done, and there are a number of scenes that are well choreographed. The acting is top-notch, as is the special effects. Overall, this is one of my all-time favorite TV shows. If you're looking for a good night's sleep, don't miss this one. It's a must-see for any fan of the genre. I highly recommend it.",2.8324835,5.469865874833877
a_3_3,"... the only thing I really liked about this film was that it had a good story line, and a lot of fun to be had with some of the supporting cast. There was also a nice mix of comedy, drama, suspense, romance, adventure, sci-fi, fantasy, horror, mystery, action, etc. Overall, this is one of my all-time favorite movies of all time. I highly recommend it to anyone looking for a great movie. If you have not seen it, I strongly suggest you do so. It's a must-see for any fan of Sci-Fi, Fantasy, Thriller, Adventure, Horror, Mystery, Action, Sci fi, or anything in between. Even if you haven't seen the film, you will still enjoy it. This is definitely one to keep an eye out for.",2.8140895,5.469865874833877
a_3_3,"..., but if you're the type of person who wants to know more about this film than I do, you might want to check it out. It's a fascinating look into the lives of people who were hard-working, well-dressed, and committed to giving back to the community.<citation needed]The acting is very good, particularly in the lead role, played by John Goodman. His character is likable throughout the film, as he does his best to keep up with the situation at hand. He is also very convincing in his portrayal of one of the main characters on the show. Overall, this is a must-see for anyone looking for a real-life example of what it takes to be a successful actor. I highly recommend this movie to anyone who doesn't have a clue as to what goes on in their lives. If you haven't watched it yet, then you may want some time to see it.",2.822928,5.469865874833877
a_3_3,"... the acting was great, the special effects were excellent, and the story was well told. I highly recommend this movie to anyone looking for a good action/sci-fi/horror movie. If you like action movies, then this is the movie for you. You won't be disappointed. This is one of the best action films I've seen in a long, long time. A must see for any Sci-Fi/Horror fan. Highly recommended. 7 out of 10.",2.8548837,5.469865874833877
a_3_3,"... and a lot of the acting is top-notch.<p><briefly, this film is about a group of college students who decide to take a trip to the mountains in order to find a place to live. The story is simple: the group decides to go on a camping trip for a couple of days, but when they arrive, they find out that there isn't much to do. This means that they don't know where to spend the rest of their time. It doesn't help that one of them is a member of a cult that worships the spirits of dead people, and it's up to them to figure out how to deal with the situation.<citation needed)<p>As far as I know, none of this has been done before or since, so I can safely say that this is the best movie I've seen in a long time.<imdb rating: 1.5 out of 10 (out of 5 stars).",1.6852133,5.469865874833877
a_3_3,".... The acting is very good and the script is well written. I highly recommend this movie to anyone looking for a good excuse to watch a movie. It has everything you would want in a great movie, including a wonderful cast of actors who have made a difference in the lives of so many people around the world. You won't want to miss this one.",2.769029,5.469865874833877
a_3_3,"... the story is very well told and the characters are very likable. This film was one of the best I've seen in a long, long time. It's also one that will probably stay with you for many years to come. The acting is top-notch, the cinematography is superb, and there's so much more to this film than meets the eye. All in all, a must see for any fan of sci-fi, fantasy, or horror.",2.8839324,5.469865874833877
a_3_3,"... I think this is a must-see for any fan of the genre. The action, the special effects, and the cinematography are top-notch. This is one of my all-time favorites. If you like action movies, you'll love this one.",2.8430905,5.469865874833877
a_3_3,"... and I don't know why.<citation needed)<cite web]The plot revolves around a group of high school students who are sent to a mental institution by the government to see if they can get out of prison. Unfortunately, there isn't enough time for them to get off the island so they're forced to stay in a halfway house until the end of the film. It doesn't take long for things to go awry as the cast and crew try to keep things under control.",-1.6103545,5.469865874833877
a_3_3,"... in a good way. The special effects are great and the acting is top-notch. I would highly recommend this film to any fan of sci-fi, fantasy, horror, or anything in between. It's a must see if you're into Sci-Fi, Fantasy, Horror, Thriller, Sci fi, Action, Adventure, D&D, RPG, etc.",2.6943624,5.469865874833877
