experiment,sample,reward,diversity
a_5_5,"... to say nothing of the fact that this movie is a complete waste of time and money. The acting is atrocious, the direction is horrible, and the special effects are laughable. All in all, this is one of those movies that you want to watch at least once a week, but can't. If you're looking for a good low-budget horror movie, go ahead and skip this one. You won't regret it. 4 out of 10.",-2.9264476,5.213238623544596
a_5_5,"... I love this film. I think it is one of the best movies I have ever seen. The acting is excellent and the direction is top notch. It is a must see for any fan of Sci-Fi, Horror, Fantasy, Sci fi, Thriller, Mystery, Suspense, Action, Adventure, Comedy, Romance, Drama, Science Fiction, etc. If you are looking for a Sci Fi/Horror movie with great action, suspense, mystery, romance, sci-fi, horror, science fiction, adventure, comedy, drama, steampunk, action thrillers, fantasy, or sci fi then this is the movie for you. Highly recommended. 7 out of 10 stars.",2.897178,5.213238623544596
a_5_5,"... and then the film ends. I have not seen a movie like this in a long time, and I am surprised that many people didn't like it. The acting was excellent, the direction was good, there was an interesting story, characters were likable, as well as the special effects were great. All in all, a must see for fans of sci-fi and fantasy.",2.7165482,5.213238623544596
a_5_5,... I really liked the movie. It was well paced and the acting was very good. A must see for anyone who likes action movies or sci-fi/horror fans. Highly recommended! 7 out of 10 stars.,2.8684254,5.213238623544596
a_5_5,... the story is very well told and the characters are believable. The acting is top-notch and I highly recommend it to anyone interested in film-making. Highly recommended. 9 out of 10.,2.8993516,5.213238623544596
a_5_5,"..., and it's a shame that this movie didn't make it to theaters. The acting is top-notch, the special effects are superb, as well as the story is well told. If you haven't seen this film yet, I highly recommend it. It's an absolute must see for all fans of Sci-Fi, sci-fi, horror/thriller fans, or anyone who likes a good Sci Fi/Horror movie.",2.8101234,5.213238623544596
a_5_5,"... and the special effects are excellent. The script is well written, the acting is top notch, and it is a must see for any fan of sci-fi. I highly recommend this movie to fans of Sci-Fi, horror, action, comedy, sci fi, fantasy, adventure, science fiction, romance, mystery, martial arts, or anything in between.",2.8346088,5.213238623544596
a_5_5,"... that's for sure. The acting is good and the cinematography is top-notch. I highly recommend this movie to anyone looking for a great look at the life and times of some of the greatest filmmakers of all time. If you haven't seen it yet, be sure to rent it as soon as it comes out on DVD.",2.6950085,5.213238623544596
a_5_5,"... The acting is good, and the special effects are well done. The story is well told, but the characters are believable and likable. This movie is a must see for all fans of sci-fi/horror movies. A must-see for Sci-Fi fans. 9/10.",2.815631,5.213238623544596
a_5_5,... the ending is very good and the acting is superb. A must see for fans of Sci-Fi/horror fans as well as Sci Fi fans.,2.8545508,5.213238623544596
a_5_5,".... This film is a must see for fans of horror, sci-fi, and fantasy. I highly recommend this film to any fan of Sci-Fi, Fantasy, or Horror.",2.784196,5.213238623544596
a_5_5,"... and the acting is top-notch.<span style=""vertical""; font-family:""Arial, Helvetica, sans serif"", text-indentation:underline); background-color:transparent; -webkit-border-bottom:1px solid #ccccc; border-top:3pxsolid #ddddd; box-shadow:0 1px 2px 1p rgba(0,0 0,1,2.5); border:none!important; background:url(%%spritesheet%%); -moz-box-sizing:linear; float:left; color:rgba((0.,0.4, 0.3, 1.0)%24.6), rgBA(1.7, 2.8, 3.",-1.8743131,5.213238623544596
a_5_5,"... the characters are so engaging and the script is so well thought out that it's easy to understand what's going on in the film. I highly recommend this movie to anyone interested in seeing a good sci-fi/horror flick. It's definitely a must see for fans of Sci-Fi, as well as Sci fi fans looking for a great sci fi/fantasy movie.",2.808938,5.213238623544596
a_5_5,"... and it's a must-see for fans of the genre. A must see for any fan of science fiction, sci-fi, fantasy, horror, action, comedy, romance, thrillers, mystery, adventure, or sci fi fans.",2.8277984,5.213238623544596
a_5_5,"... The music is great and the acting is good. I highly recommend this movie to anyone who likes a good sci-fi/horror movie. If you haven't seen it yet, don't miss it. Highly recommended. 8 out of 10.",2.836761,5.213238623544596
a_5_5,"... in my humble opinion it is the best movie I've ever seen. It has so much going for it that you just can't help but feel like you are watching something special. The acting is top-notch and the special effects are mind-blowing. This movie is perfect for any fan of sci-fi, horror, fantasy, action, comedy, adventure, romance, drama, mystery, or sci fi. I highly recommend this movie to anyone looking for a great Sci-Fi/horror movie. If you haven't seen it yet, check it out and see what you have missed. You won't regret it! <a href=""http://www.imdb.com/title/tt0027074/""><img class=""styles__noscript__2rw2y"" src=""https://dsx.weather.co.uk/util/image/widescreen/bg900x300.",2.6195464,5.213238623544596
a_5_5,".... This movie is a lot of fun to watch and I highly recommend it to anyone who enjoys the Sci-Fi genre. If you're looking for a good Sci Fi/Fantasy movie, don't miss out on this one. It's a must see for fans of Sci fi, fantasy and sci-fi. 4 out of 10.",2.8120968,5.213238623544596
a_5_5,"... for the most part. It's a nice little movie. The acting is very good and the story is interesting. I highly recommend this movie to anyone looking for a good sci-fi action movie with lots of action, mystery and suspense. Highly Recommended. 4 out of 10 stars. 8/10.",2.7840056,5.213238623544596
a_5_5,"... to be honest I didn't care that much for this movie. The acting, the direction, and the cinematography were top-notch in my book. A must see for fans of Sci-Fi, as well as sci-fi fans. 7 out of 10 stars.",1.5766507,5.213238623544596
a_5_5,"..., this film is definitely worth seeing. It has a good feel to it and the acting is top-notch. A must see for all fans of Sci-Fi, sci-fi, and fantasy. Highly recommended. 7 out of 10 stars.",2.9074094,5.213238623544596
a_5_5,"..., I found this film to be very engaging and interesting. It is a must see for all fans of science fiction, fantasy, sci-fi, horror, comedy, action, romance, suspense, thriller, thrillers, adventure, drama, mystery, humor, and so much more. Highly recommended. 4 out of 10.",2.8520849,5.213238623544596
a_5_5,"... and a lot of the rest of this movie is just crap. I don't know why, but it's so bad that it makes you want to vomit. The acting is terrible, the cinematography is awful, and the special effects are really bad. All in all, if you're looking for a horror movie that doesn't take itself too seriously, look elsewhere. If you like scary movies, you'll love this one. It's definitely worth checking out, especially if your a fan of horror movies. A must-see for fans of Sci-Fi/Horror fans. 7 out of 10.",-1.6248719,5.213238623544596
a_5_5,"... the acting is top notch and the script is well thought out. I highly recommend this movie to anyone looking for a serious sci-fi/horror movie with a great atmosphere. It's a must see for fans of Sci-Fi, Horror, Sci fi, Fantasy, Thriller, Action, Suspense, Drama, Comedy, Romance, Science Fiction, Mystery, Supernatural, & Sci Fi.",2.823863,5.213238623544596
a_5_5,"... (3/25/16) 8 out of 10. I highly recommend this movie to any fan of Sci-Fi, fantasy, horror, and sci-fi. It is well paced, has plenty of action, a great storyline, good acting, an interesting ending, cool special effects, lots of humor, tons of fun, characters, stories, music, cinematography, sets, costumes, props, special features, etc. If you are looking for a Sci Fi, Fantasy, Horror, or Sci Thrillers movie that will keep you entertained for the rest of your life, then this is the movie for you. This is one of my all time favorite Sci fi movies. Highly recommended for anyone looking to get into Sci Fiction, Adventure, Thriller, Sci Filmmaking, Mystery Science Theater 3000, Action, Comedy, Drama, Romance, Suspense, Humor, Spoilers, Special Features, & much more.",2.8451016,5.213238623544596
a_5_5,"... in this movie it's really hard not to love the characters and the story. The acting is good, the special effects are top notch, and some of the plot twists are just right. I highly recommend this film to anyone who enjoys Sci-Fi, sci-fi/horror, fantasy, horror, or any genre. A must see for fans of Sci Fi, Sci fi/Horror fanatics, Horror fans, Fantasy fans etc.",2.5706632,5.213238623544596
a_5_5,"... and they are really good. It's just a shame it didn't make it into the big screen in the 1980's, because it does have some of the best performances I've ever seen. There are a lot of funny moments, but overall, it's a very well made film. A must see for fans of Sci-Fi, sci-fi, horror, action, comedy, drama, fantasy, romance, mystery, science fiction, etc. If you're looking for a Sci Fi/Horror film, stay away from this one. You'll be amazed at just how good it is. I highly recommend this movie to any Sci fi fan.",2.8367503,5.213238623544596
a_5_5,"... The acting is solid and the direction is top notch. The special effects are well done, the cinematography is good, and there is a lot of fun to be had. I highly recommend this movie to anyone who enjoys action or sci-fi movies. It's a must see for any Sci-Fi fan.",2.8025594,5.213238623544596
a_5_5,"... in this film, there's a lot of emotion and tension that you can't get out of the movie. The acting is superb, the story is well told, and the cinematography is top-notch. I highly recommend this movie to anyone who is looking for a romantic comedy with lots of twists and turns. All in all, a must see for fans of all genres. Highly recommended.",2.9200852,5.213238623544596
a_5_5,.... I am not a fan of the show so I thought this would be a good movie for fans of sci-fi and fantasy. The acting was very good and the story was told in a very interesting manner. A must see for Sci-Fi fans. Highly recommended. 5 out of 10. 9/10.,2.7171383,5.213238623544596
a_5_5,"... the story line is very well done. The special effects are good and the characters are likable. Overall, a must see for all fans of sci-fi, fantasy, action, horror, sci fi, adventure, mystery, thrillers, etc. Fans of Sci-Fi, Fantasy, Horror, Sci Fi, Adventure, Mystery, Thriller, Action, Comedy, Drama, Science Fiction, Supernatural, Stargate SG-1, Star Trek, TNG, The X-Files, Buffy the Vampire Slayer, and many more. Highly recommended.",2.8505578,5.213238623544596
a_5_5,"... the only good thing about this movie was the acting. The characters were believable and interesting, but the story didn't seem to be set in stone. I don't know if it was due to the lack of depth, or because the script was too much for me to handle. Overall, a must see for any fan of Sci-Fi/Horror fans. 7 out of 10 stars.",0.70982426,5.213238623544596
a_5_5,"... the acting was very good, and the special effects were very well done. The story line was well told, the characters were well developed, some of the situations were believable, even the ending was suspenseful. I highly recommend this movie to anyone who is interested in a great sci-fi/fantasy movie with lots of action, intrigue, mystery, humor, adventure, drama, romance, etc. This is a must have for any Sci-Fi fan. Highly recommended! 7 out of 10 stars.",2.8243265,5.213238623544596
a_5_5,"... the whole thing is very entertaining. I highly recommend this movie to anyone who likes horror movies. It's a must-see for any horror fan. If you're looking for a good horror movie, check it out. This is one of my all-time favorite horror films. The acting is top-notch and the plot is suspenseful. A must see for all horror fans. 4 out of 10.",2.8437295,5.213238623544596
a_5_5,"... and this is not one of them. The acting is good, the story is interesting, and the direction is excellent. If you haven't seen it yet, don't miss it. It's a must see for all fans of horror/sci-fi as well as sci-fantasy fans.",2.6793656,5.213238623544596
a_5_5,"... a lot of fun!<span style=""font-weight:bold; font-size:1.5em; line-height:0.4em;"" />I recommend this movie to anyone looking for a good laugh and a great night's sleep. This is one of those movies that makes you want to take a nap. It's funny, it's smart, and it even has some cool things going for it. If you haven't seen the movie yet, do yourself a favor and give it a try. You won't regret it! I highly recommend it to any fan of Sci-Fi, Fantasy, Horror, or anything else SciFi/Horror.",2.5450106,5.213238623544596
a_5_5,"... that's about it. It's a good story, and the acting is top notch.<span class=""2"" id=""selection-marker-1"" style=""background-image: url(""http://media-dominaria.com/avatars/thumbnails/1/200x200/images/people/Voyager%20Criminals%22.jpg"") width=""100%"" height=""300"" />This movie is one of my all-time favorites. I highly recommend this movie to anyone who enjoys action thrillers, sci-fi, horror, comedy, romance, science fiction, fantasy, or anything in between.",2.682314,5.213238623544596
a_5_5,"... I must warn you, this movie is terrible. The acting is atrocious and the special effects are awful. All in all, if you haven't seen it yet, check it out. If you don't like horror films, then you won't be disappointed. It's a must see for any horror fan.",-2.0452518,5.213238623544596
a_5_5,"... I don't know if this is a ""film"" or a TV movie, but this movie made me feel like I was in the middle of an epic. The acting was top-notch and the special effects were impressive. All in all, a must see for fans of sci-fi, fantasy, horror, action, sci fi, comedy, romance, drama, suspense, mystery, thriller, science fiction, adventure, and sci Fi fans. I highly recommend this to any Sci Fi fan looking for a good SciFi/Fantasy/Horror movie. 8 out of 10.",2.805046,5.213238623544596
