experiment,sample,reward,diversity
a_7_7,"... to be honest, I wasn't expecting much from this film. It was a bit of a letdown, but overall, it was entertaining enough for me to give it a chance. The acting was top-notch and the special effects were top notch. Overall, a great film to watch over and over again. 5 out of 10.",2.6663415,5.314292337640365
a_7_7,"... and I loved it! I highly recommend this movie to anyone interested in any kind of science fiction or fantasy, sci-fi, adventure, horror, martial arts, steampunk etc. This movie has everything you would expect from a Sci-Fi/Fantasy movie, but the special effects are top-notch, the acting is top notch, and the story is very well told. It is truly a must-see for all Sci Fi fans out there!! If you like Sci fi movies, thrillers, action/thriller, suspense, comedy, romance, mystery, drama, thriller, etc.",2.868108,5.314292337640365
a_7_7,"... to be a huge fan of the book. The acting was good, the special effects were very well done, and the soundtrack was very nice. All in all, a must see for anyone interested in the history of science fiction. 4 out of 10. 8/10.",2.6750016,5.314292337640365
a_7_7,... and it's a good movie. The acting is great and the cinematography is top notch. This movie is one of the best movies i have ever seen.,2.8419018,5.314292337640365
a_7_7,"... and the film is one of the best movies I've ever seen. The acting is top notch, the cinematography is stunning, and it's a shame that this film wasn't available on DVD. I highly recommend this movie to anyone interested in horror, suspense, sci-fi, thrillers, action, adventure, mystery, or any other type of entertainment. 9 out of 10.",2.7859,5.314292337640365
a_7_7,"... a great film to watch and I recommend it to anyone looking for a good horror/sci-fi flick. I highly recommend this film if you are looking to have a fun time and enjoy some of the action sequences. The acting is top notch, the cinematography is excellent, and the special effects are breathtaking.",2.852305,5.314292337640365
a_7_7,"... to me. This is a great movie. The acting is outstanding, the direction is top notch, and the special effects are top-notch. I highly recommend this movie to anyone looking for a fun, action packed movie that will keep you coming back for more. If you haven't seen it yet, check it out. It's one of my all time favorites. 8/10.",2.8783188,5.314292337640365
a_7_7,... The acting is top notch and the special effects are superb. I highly recommend this movie! 10 out of 10.,2.8444872,5.314292337640365
a_7_7,"... I've seen this movie a few times, and have never seen anything like it.<BR /><B />This is one of the best movies I have ever seen. It has so many twists and turns that make you want to watch it over and over again. The music is amazing, the acting is great, as well as the special effects are fantastic. This is definitely one for anyone who likes to see a great mix of fantasy and sci-fi action. I highly recommend this film to anyone looking for a good fantasy/sci-fantasy action flick. 9 out of 10.",2.8460534,5.314292337640365
a_7_7,"... and I don't want to get too carried away with this movie, but it is a very good movie. The acting is top notch, the special effects are top-notch, and the cinematography is fantastic. Highly recommended! 7/10.",2.862455,5.314292337640365
a_7_7,"... a great movie with lots of action and comedy in it. I highly recommend this movie to anyone interested in film making, martial arts, or anything else martial art related.",2.8175054,5.314292337640365
a_7_7,"... to be honest, I couldn't think of a better movie than this one. The acting is very good, the cinematography is top notch, and the special effects are amazing. I highly recommend this movie to anyone interested in seeing a great horror/sci-fi movie.",2.6442654,5.314292337640365
a_7_7,"... and that's saying a lot. The story is pretty well written, and the acting is top-notch. However, there are a few things that make the movie stand out from the crowd. First of all, the storyline is very well told. It has plenty of twists and turns throughout the film, making it one of my all-time favorite movies. I highly recommend this movie to anyone looking for a fast paced action/thriller. A must-see for all fans of action flicks. 10 out of 10.",2.8009348,5.314292337640365
a_7_7,"... in my opinion it is one of the best movies I have ever seen. It is a must see for anyone who likes to watch movies from the 70's and 80's. The music is excellent, the characters are believable and the acting is top notch. Highly recommended. 8 out of 10.",2.911312,5.314292337640365
a_7_7,"... I've seen a lot of good horror movies and this one is by far my favorite. It has some great acting, special effects, suspense, scares, action and gore. The story is well written and the acting is top notch. Highly recommended for all horror fans out there. 9/10.",2.8732455,5.314292337640365
a_7_7,... and there are a few nice touches. I love how the script is written and the acting is top notch. This is a must see for anyone looking for a good movie to watch. 9 out of 10.,2.745787,5.314292337640365
a_7_7,"... that's it. If you enjoyed this, I highly recommend it to anyone looking for a good movie to watch. It is one of the best movies I've ever had the pleasure of seeing. The acting is excellent and the cinematography is top notch. This movie is a must see for any Sci-Fi fans out there. 7/10.",2.8626883,5.314292337640365
a_7_7,"... the movie is about a guy who tries to find out more about his past and how he came to be. He has lost his girlfriend, his father, friends, and everything in between. The movie takes place in a time when all of this was happening and the people around him were all either dead or dying. There are also some scenes that are really disturbing (e.g. the car crash in the middle of the film) and there are some really funny moments. This is definitely one of my favorite movies I have ever seen. I highly recommend it to anyone interested in horror, sci-fi, thrillers, comedy, horror flicks, action, romance, suspense, mystery, thriller, sex, violence, blood, gore, crime, drama, martial arts, etc. It is a must see for all Sci-Fi/Horror fans. 8 out of 10.",2.7158751,5.314292337640365
a_7_7,".... If you have seen the film, I highly recommend it to anyone interested in the world of film making. It's one of the best movies I've ever seen. I can't wait to see it again.",2.7577195,5.314292337640365
a_7_7,"... and this is the first movie I've ever seen. I don't think it's as good as the others, but it is definitely worth seeing. If you haven't seen it yet, see it if you want to see a different take on the theme.<b><span style=""color:red; font-family:""Times New Roman"", sans-serif; letter-spacing:1.5pt; line-height: 1.75pt;""position:relative; text-shadow:none; padding-bottom:2pt auto;""font-weight:bold; background-color:#fff; border-radius:3pt!important; color:rgba(0,0,.7,.",2.0575707,5.314292337640365
a_7_7,"..., and this is by far the worst movie I've ever seen. It's a horrible movie. The acting is awful, the special effects are terrible, it takes place in New York City, there aren't very many good actors, some of the action scenes are so bad that you don't want to see them again, they look like they were shot in the 60's. I highly recommend this movie to anyone who has not seen it. If you like bad movies with bad special effect effects, then watch this one. You'll be glad you did. 8 out of 10.",-2.5653682,5.314292337640365
a_7_7,".... <b>A couple of days ago I saw this movie and I was very excited to see that it would be a sequel to the original film, but at the same time it didn't really make much sense. The acting wasn't as good as the first film and the special effects weren't very good either. But for the most part it was a great movie. It had a lot going for it and it reminded me a little bit of one of my favorite sci-fi movies of all time.",1.1126229,5.314292337640365
a_7_7,".... I highly recommend it to anyone who is looking for a great low-budget horror/thriller movie. The acting is top-notch, and the special effects are very impressive. This is one of the best movies I've seen in a long time.",2.8324468,5.314292337640365
a_7_7,.... I have to say it is one of the best movies i have ever seen. One of my all time favorites.,2.8495436,5.314292337640365
a_7_7,"... I had no idea what this film was going to be about, but it turned out to have a lot of heart. I highly recommend this movie to anyone interested in having a good time. It is well worth your time and money. 9 out of 10.",2.7196891,5.314292337640365
a_7_7,"..., and a lot of the movie is really fun. The special effects are amazing, the music is top notch, as well as the acting is great too. I highly recommend this movie to any fan of science fiction or fantasy movies! 8 out of 10. Recommended for anyone looking for a good Sci-Fi/Fantasy movie with lots of action, sci-fi, adventure, romance, humor, mystery, horror, comedy, drama, etc. 10/10.",2.7562788,5.314292337640365
a_7_7,"... a real pain in the butt to sit through. This is definitely one of the funniest movies I've ever seen. It's very funny and has lots of laughs. The acting is top notch, the story is well written, and the special effects are great. I highly recommend this movie to anyone looking for a laugh out of a movie. 10/10.",2.848007,5.314292337640365
a_7_7,"... and I'm sure you have heard of it. It is one of my all-time favorites!!<BR /><B />2 out of 4 stars for the story, acting, direction, special effects, and music.",2.6041617,5.314292337640365
a_7_7,"... and the movie is definitely one of the best I've ever seen. If you haven't seen it yet, don't miss it. I highly recommend it to anyone interested in horror movies and Sci-Fi. It's a must see for all Sci Fi fans out there. Highly recommended. 4 out of 10.",2.8818724,5.314292337640365
a_7_7,".... It has all the ingredients to be a classic, but you have to see it for yourself if you want to watch it. All in all, I highly recommend this movie to anyone who enjoys movies like this one. The acting is top notch, the special effects are superb, and the story is very well told. This movie is definitely one of my all-time favorite movies. Highly recommended.",2.8829613,5.314292337640365
