experiment,sample,reward,diversity
a_9_0,"... and the acting is excellent.<b><span style=""vertical-align:right;"" text-decoration:none; font-weight:normal; line-height:1.75; background-color:transparent; padding:0.5em; border:2px solid #ccccc; transition:all.",1.4551402,5.516766054802824
a_9_0,"... The acting was top-notch, and the characters were fun to look at. I highly recommend this film to anyone interested in learning about the history of African-Americans in the United States.",2.7260423,5.516766054802824
a_9_0,"... and this is the kind of movie where you have to give it your all. The acting is top-notch, the story is interesting, and the script is well written. All in all, this movie is a must-see for any fan of sci-fi.",2.7473342,5.516766054802824
a_9_0,"... I think this is one of the funniest movies I have ever seen. It has a lot going for it and the acting is top-notch. There is also plenty of humor in some scenes, especially the ending. This movie is definitely worth checking out if you haven't seen it already.",2.7924566,5.516766054802824
a_9_0,"... that's for sure. If you are looking for a good sci-fi movie, this one is for you.<BR /><BR />7 out of 10.",1.2289007,5.516766054802824
a_9_0,"... The script is good, the acting is decent, and the story is interesting. I recommend this movie to anyone interested in exploring the lives of the characters.",2.1077266,5.516766054802824
a_9_0,"... and I don't know if this is a good thing or not, but it's definitely a pretty good movie. The acting was great and the special effects were well done. One of my all-time favorite movies, and one of the best sci-fi movies I've ever seen.",2.851408,5.516766054802824
a_9_0,"... It was a shame that the director didn't do a better job with his work. The dialog was very good and the acting was top-notch. I highly recommend this movie to anyone looking for a great, well thought-out action movie. A must-see for any horror fan.",2.6980562,5.516766054802824
a_9_0,"... this movie has a lot going for it. the acting is top notch, the writing is good, and the direction is pretty good. all in all, I highly recommend this film to anyone interested in sci-fi, fantasy, horror, comedy, action, drama, romance, suspense, mystery, adventure, or anything else Sci-Fi, Fantasy, Horror, Comedy, Action, Romance, Adventure, Thriller, Sci Fi, Drama, Mystery, Suspense, Spoilers, etc.",2.6986623,5.516766054802824
a_9_0,"... and it has a nice twist to it. It's about a group of people who live in a small town. Unfortunately, the town is haunted by the ghosts of the past. The ghost of an old man who died in the early 1800's is responsible for all the problems that have plagued this town ever since. There are many unanswered questions and there are a lot of interesting characters in this movie. However, there is one character that stands out as the most important character in each of these movies. His name is Dr. Loomis. He is the son of a real estate agent who lived with his father when he was young. In fact, he is still alive today thanks to the efforts of his family. Although he may not be the best actor in his own right, his performance in ""Loomi"" is outstanding. I highly recommend this film to anyone who is looking for a good laugh. Overall, this is a must see for any horror fan.",2.6968017,5.516766054802824
a_9_0,"... I will give this film 10 out of 10 stars because it has such a good story, and the acting is outstanding. The acting isn't bad at all, but it is very hard to believe that so many people would be interested in this movie. This movie is a must see for anyone who wants to see a great love story between a boy and a girl. I highly recommend it to anyone looking for a romance/romance with an amazing cast of characters. It is definitely one of the best romantic comedies I have ever seen. If you are looking to watch a romantic comedy, or if you want to get into romance, this is the movie for you.",2.7687898,5.516766054802824
a_9_0,".... I saw this film at the Tribeca Film Festival in New York City and I loved it. The acting was good, the story was interesting, and the special effects were well done. All in all, I highly recommend this movie to anyone looking to see a good sci-fi action flick. This is definitely one of the best Sci-Fi films I have ever seen. If you are looking for a great Sci Fi action film, then this is the film for you.",2.8271532,5.516766054802824
a_9_0,"... the movie was good and the acting was great. I would recommend this movie to anyone who is looking for something a little more serious than comedy. It has some really funny moments, and a lot of fun to be had. If you're looking to have a good time, don't miss this one. 4/10. 1 out of 10.",2.4671597,5.516766054802824
a_9_0,"... and the way this movie is set-up, it's very well done. If you've never heard of it, I highly recommend it. It's a must-see for fans of sci-fi, drama, fantasy, comedy, horror, romance, action, adventure, mystery, suspense, and so many more. Highly recommended. 4 out of 10.",2.9071336,5.516766054802824
a_9_0,"... and I have to admit, I thought it was a really good movie. The acting was good, the story was interesting, and the music was very good. Overall, a great movie for all ages. Highly recommended. 5 out of 10.",2.824331,5.516766054802824
a_9_0,".... A lot of the dialogue in this film is terrible, and the actors are not very good. The movie starts out pretty bad, but as it goes along it gets better and better. It's a fun little comedy with lots of laughs. I give it a 9/10 from beginning to end. If you're into comedy, this is a must-see for you. You won't regret it. This is one of my all-time favorite comedies. 8 out of 10.",1.5681099,5.516766054802824
a_9_0,"... the acting is great, the story is well told, and the characters are believable. I highly recommend this film to anyone looking for a good old fashioned horror/thriller.",2.8559854,5.516766054802824
a_9_0,"... I don't know what it is about this film that made me believe it, but it certainly doesn't hurt. The actors are good, the acting is good and the story is well told. If you haven't seen it yet, you'll probably love it. However, if you're a fan of the original, then you won't be disappointed. But if not, I recommend you to check it out.",2.26871,5.516766054802824
a_9_0,"... that's about it. There is a very real sense of desperation and despair in this film. The acting is great, the cinematography is excellent, and the special effects are top-notch. However, if you want to see a good look at the life of a young man, watch this movie. It is not for everyone, but if your interested in learning more about some of the characters, check it out. I highly recommend this to anyone who has never heard of any of their favorite characters. A must-see for fans of all ages.",2.7061372,5.516766054802824
a_9_0,"...
The acting is very good, the camera work is top-notch, and the story line is well thought out. I highly recommend this film to anyone interested in learning more about the Japanese culture and history.",2.7347033,5.516766054802824
a_9_0,... I think this movie is the best I have ever seen. It has a wonderful story and some of the characters are very likable. The acting is good and the special effects are superb. This movie should not be missed. I highly recommend it. Highly recommended. 10/10.,2.8994973,5.516766054802824
a_9_0,"..., but it's still a good movie. The acting is top-notch and the characters are well developed. In fact, one of the main reasons why I like this movie so much is because of its storyline. This movie takes itself very seriously, which makes it even more enjoyable than other movies in the series. Overall, I highly recommend this film to anyone interested in sci-fi or fantasy. <span style=""vertical"" data-width=""100%;""><img class=""styles__noscript__2rw2y"" src=""https://dsx.weather.com//util/image/widescreen/bg_bg.jpg?v=at&w=485&h=273&api=7db9fe61-7414-47b5-9871-e17d87b8b6a0"" width=""425"" height=""315"" frameborder=""0""></iframe><script async src = ""//platform.",2.533442,5.516766054802824
a_9_0,"... the only thing that bothered me was that it didn't feature a couple of actors who I hadn't seen in a long time, and they couldn't seem to fit in with the rest of the cast.<b /><strong><span style=""vertical-align: right;"" width=""1.5"" height=""0.75"" align=""center"" scrolling=""no""></span><div style=3 type=""text/html; charset=utf-8""></div><ul><li><a href=4=""http://www.youtube.com/watch?v=jT7RX2ZDhQ&feature=youtu.",-1.6270833,5.516766054802824
a_9_0,"..., this is one of the worst movies I've ever seen. The acting is atrocious and the story is contrived at best. There aren't any redeeming qualities to this movie, and there isn't a whole lot of character development beyond that. All in all, if you want to see a good action flick, do yourself a favor and skip this one.",-2.998814,5.516766054802824
a_9_0,"... The acting was fine, the plot was well thought out, and the special effects were top-notch.<b><span class=""separator"" style=""color: rgb(255, 255, 0), sepia(0,0) font-weight: bold; text-align: center; background-image: url(http://i.ytimg.com/vi/2h7u8a.jpg), no-repeat-background-color; border-bottom: 2px solid #ccc; padding-top: 10px; box-shadow: none; color: #ff0000; -webkit-linear-gradient(transparent: rgba(1,1,-1.5, 1.3),transition: 1ms,linear: 0.",1.1046737,5.516766054802824
a_9_0,".... I can't believe that this film was made in such a short amount of time. This film is about a woman who falls in love with a man she met while he was still in high school. The film takes place in a small town and the main character is a girl who goes by the name of Lizzie. There are a lot of interesting characters in this movie, but the acting is very poor. Most of the scenes in the film take place at night and most of them are set in real places. Overall, this is one of my all-time favorite films. A must see for anyone interested in learning more about the life of a beautiful woman.",1.5666878,5.516766054802824
a_9_0,... of the characters. The acting is excellent and the script is well thought out. This movie was very entertaining and I enjoyed every second of it. I highly recommend this movie to anyone who enjoys Sci-Fi or Horror. 8 out of 10.,2.791579,5.516766054802824
a_9_0,"...
I saw this movie when it first came out and loved it. It's a very dark, suspenseful thriller with lots of action and suspense. The plot is very well developed and the special effects are top-notch. I highly recommend this film to anyone interested in seeing a good suspense thriller. There is a lot of suspense and intrigue going on throughout the movie. However, overall, this is one of my all-time favorite movies of all time.",2.8402565,5.516766054802824
a_9_0,"... and it was fun to see some of the characters interact with each other as well as the director. The story line is solid and the acting is good. I can't wait to pick up a copy of this film, and I look forward to seeing more of it. This is one of my all-time favorite horror films of all time. It's a must see for any horror fan. 4 out of 10.",2.7582693,5.516766054802824
a_9_0,"... the story is very well done and there are a lot of twists and turns. The acting is good and the plot is well written. Overall I highly recommend this movie to anyone interested in being entertained. If you are looking for a good, entertaining and fun movie with lots of laughs, then this may be the movie for you. It is a must see for all fans of sci-fi, horror, comedy, suspense, romance, drama, action, adventure, thrillers, fantasy, science fiction, etc. This movie is an absolute must have for any Sci-Fi fan. Don't miss it. 8 out of 10 stars.",2.798343,5.516766054802824
a_9_0,"... in the very first scene he tries to get away, but just as he is getting out of the car, a man comes up behind him and grabs him by the throat and starts kicking him. When he turns around and runs away from the man, the woman tells him that if he doesn't tell her what happened to him, she will beat him to death with a baseball bat.<citation needed] <brief description of scene: The story of a group of college students who are introduced to a girl who is having an affair with one of their classmates. They find out that the girl has been cheating on them, and they set out to find her. In the course of investigating the case, they come across a young girl, who appears to be in her early thirties, whom they believe to have had an incestuous relationship with.",-0.15998788,5.516766054802824
a_9_0,"... of the movie. The acting is good, the story is well told, and the characters are likable. Overall, this is a great movie that will keep you interested throughout the duration of your viewing. If you haven't seen it yet, check it out. I highly recommend it.",2.8731601,5.516766054802824
a_9_0,"... that's for sure. The cinematography is superb, the acting is excellent, and the special effects are impressive. I highly recommend this movie to anyone interested in any kind of Sci-Fi or Fantasy film. If you're a fan of sci-fi or fantasy, then you'll love this. However, if you aren't, you may want to skip this one. You won't be disappointed.",2.7183073,5.516766054802824
a_9_0,"... the acting was good, the story was funny, and the direction was great. I highly recommend this movie to anyone interested in a good Sci-Fi/Fantasy movie.",2.6847386,5.516766054802824
a_9_0,"... the script is not as good as it could have been and the characters are just plain bad. The acting is terrible, the story is weak, and even the ending is a little too abrupt. If you want to see a film with lots of action, this is probably the film for you. Don't waste your money on this if you're a fan of the original. It's definitely worth a look. 8 out of 10.",-1.8692322,5.516766054802824
a_9_0,"... in a lot of ways this movie is very interesting. There are lots of twists and turns throughout the film, which makes it an interesting watch. The acting is good as well, and the cinematography is excellent. I recommend this to anyone interested in seeing a little bit of science fiction. It's definitely one of the best Sci-Fi movies I've ever seen. If you like sci-fi, you'll love this. However, if you're a Sci Fi fan, or just looking for something fun to watch, this is definitely a must-see for all Sci fi fans out there. Definitely worth checking out.",2.816495,5.516766054802824
a_9_0,".... <span style=""font-size:16px;line-height:1.5em""></span><p class=""flat-list buttons""><div class = ""first"" data-page-url = http://www.netflix.com/browse/genre/2880/series/horror?id=8372275&search_query=Horror&year_start=2000&view_title=Darkness&sort_by=darkness"" target = ""_blank"" title = """" >Horrific Horror Movie.<ul><li><a href=""#"" classname = ""#"" rel = ""-external"" >http://tvtropes.",-1.2422397,5.516766054802824
a_9_0,"... and it's a great movie. The acting is very good, the story is well told, and the characters are likable. I highly recommend this movie to anyone interested in the history of the United States of America.",2.8841429,5.516766054802824
a_9_0,"..., I don't know what the hell is going on in this film. It seems as though the main characters are a bunch of morons. They all seem to be trying to figure out how to get their money back. For example, one of the girls is supposed to have an affair with a guy, but she doesn't want to talk about it until he tells her not to go through with it. All of this makes me wonder why they didn't just make a film about a couple of friends and let them have something to do together. Also, there are scenes where they're being taken care of by a nurse or something. The only positive thing about the film is that it has some good acting. However, if you're looking for a good horror movie, you should definitely check it out. This is probably my favorite horror film of all time. If you've never seen it before, then you'll enjoy it very much.",0.6495831,5.516766054802824
a_9_0,"... of the characters.<hr /><h2><p><table of contents><tr><td><th><totals] 1. The plot follows a group of young women who meet a man by the name of David, who has been living in a small town for the past few years. They decide to go out on a date and are met by a bunch of girls. <brief description of this movie> 2. There is a bit of nudity in the movie but it isn't as bad as you might think. 3. This movie is pretty funny. 4. It has some good acting from the cast and actresses. 5. Overall, a very good movie. 6. 7. 8. 9. 10. 11. 12. 13. 14. 15. 16. 17. 18. 19. 20. 21. 22. 23. 24. 25. 26. 27. 28. 29. 30. 31. 32. 33. 34. 35. 36.",2.0498886,5.516766054802824
a_9_0,"... The movie takes place in a small town, so there's a lot of continuity. However, the acting is atrocious. The only good part is the soundtrack. It's one of the worst movies I've ever seen. There are a couple of moments where the music sounds like it came from a VHS tape, but otherwise it's just plain awful. As for the special effects, they look as though they were made for a TV series. Overall, this is probably the most boring movie I have ever watched. I highly recommend this movie to anyone who enjoys sci-fi, fantasy, horror, or any other kind of action/thriller.",-2.777333,5.516766054802824
a_9_0,"... and it is a great example of the type of movie that I love to watch.<BR />< BR />I highly recommend this film to anyone interested in the subject matter. The acting is top-notch and the story is well told. If you are not familiar with the genre, then this movie is for you!<BR/><BR />If you want to see some good sci-fi action, do yourself a favor and skip this one. It is definitely a must-see for Sci-Fi fans.",2.765022,5.516766054802824
