experiment,sample,reward,diversity
a_9_0,"... the acting was good, the story was well told, and the characters were likable. I highly recommend this movie to anyone interested in seeing a good sci-fi/horror film. This is one of the best Sci-Fi/Horror movies I have ever seen.",2.7708616,5.516766054802824
a_9_0,"... the only reason I watched this movie was because of the way it turned out. The acting was great, the story was well told, and the cinematography was top-notch. This is definitely one of my favorite movies of all time.",2.7891116,5.516766054802824
a_9_0,"... I didn't know what to expect from this movie, so I was pleasantly surprised. The acting is very good, and the story is well told. I highly recommend this film to anyone who wants a good suspense movie. It has a lot going for it, especially in the middle of the night. If you like suspense, you will love this one. Check it out if you're a fan of suspense movies.",2.778442,5.516766054802824
a_9_0,"... in a very good way. It's a wonderful movie with a great story, great acting, and an excellent story line. The acting is superb, the storyline is well told, there are plenty of twists and turns, I highly recommend this movie to anyone who loves suspense, suspenseful movies, action, romance, comedy, sci-fi, horror, drama, etc. All in all, it's one of the best movies I've ever seen. 8 out of 10.",2.9069657,5.516766054802824
a_9_0,"... I was a bit disappointed in this movie. It's not as good as most of the other movies, but it's still very good. If you're looking for a good action movie with some decent action scenes, check this one out. The best part about this film is that it doesn't take itself too seriously, and it has plenty of character development to spice things up. This movie is definitely worth checking out, especially if you are a fan of action movies. I highly recommend this flick to anyone who enjoys action or martial arts.",2.577943,5.516766054802824
a_9_0,"... to be honest, I didn't know what to expect from this movie. The acting was pretty good, and the special effects were top-notch. Overall, this is one of the best movies I've seen in a long time. If you're looking for a good Sci-Fi movie, don't miss this one.",2.480399,5.516766054802824
a_9_0,"... in this movie, there are a lot of things that happen to the characters. For example, the main character is killed by a zombie, so how does he survive? Also, some of the other characters, such as the doctor and the scientist, are portrayed very well. The special effects are top-notch, particularly for the zombies. There is also a little bit of humor in the story, which is one of my favorite parts of this film. This is definitely a good movie to see if you're a fan of Sci-Fi or Horror. Overall, this is a must-see for fans of sci-fi, horror, and comedy. I highly recommend this to all Sci Fi fans. 4 out of 10.",2.7350688,5.516766054802824
a_9_0,"..., but this film is definitely worth a look. The acting is top-notch, and the story is surprisingly touching. It's hard not to love this movie, especially considering it's very close to the heart of the film. This is a good example of a film that is well made, suspenseful, entertaining, interesting, funny, or at the very least entertaining. I highly recommend this flick to anyone who loves suspense, comedy, romance, mystery, thrillers, fantasy, horror, sci-fi, action, thriller, etc.",2.7786891,5.516766054802824
a_9_0,".... If you are looking for a good film, this one is for you. The acting is solid and the story is well told. This is a very well acted film with a great cast. I highly recommend this movie to anyone who enjoys suspense movies.",2.8574853,5.516766054802824
a_9_0,"... and I must say that it is one of the best movies I have ever seen. The acting is top-notch, the story is well thought out, and the special effects are very impressive. This movie is a must-see for any fan of sci-fi, fantasy, horror, martial arts, action, comedy, romance, mystery, drama, thrillers, etc. I highly recommend this movie to anyone interested in sci fi and fantasy. It is recommended to all fans of Sci-Fi, Fantasy, Horror, Thriller, Mystery, Action, Comedy, Romance, Drama, Martial Arts, Sci Fi, Science Fiction, or any other genre you can think of.",2.8208568,5.516766054802824
a_9_0,"... I have no idea what to make of this film, but it is worth checking out. The acting is top-notch, and the story line is very well told. If you are a fan of the series, you'll love this movie. However, if you're not a huge fan, or just don't like the characters, then this may not be your cup of tea. Personally, I found this to be one of my favorites, as it has all the elements of a good mystery/suspense thriller, with lots of twists and turns. Overall, a must-see for fans of Mystery Science Theater 3000.",2.8327432,5.516766054802824
a_9_0,"... The acting was excellent, the story was well told, and the music was great. Overall, I highly recommend this film to anyone who enjoys a good mystery adventure.",2.8282773,5.516766054802824
a_9_0,"... and I loved it. The story was well-written, the characters were believable, and the acting was top-notch.<span class=""spoilers"" title=""SPOILERS AHEAD"" ><p><strong><a href=3D""http://www.youtube.com/watch?v=Zd7I4QyjW8Y&feature=youtu.be"" target=_blank><img src=http%3A%2F%1Fwww.com% 2Fwp-content% 3Fvideo.",2.6657238,5.516766054802824
a_9_0,"..., but I thought the film was pretty good. In fact, it wasn't bad at all. The acting was good, the story was interesting, and the characters were well developed. Overall, this is a must-see for any Sci-Fi fan. If you're looking for a good Sci Fi movie, check out this one. You won't regret it.",2.5057108,5.516766054802824
a_9_0,"... in my humble opinion, it's the funniest movie I've ever seen. There are a lot of funny lines and characters that make you laugh out loud. The acting is good, the script is well written, and the special effects are quite good. I highly recommend this movie to anyone who loves comedy and entertainment.",2.7832904,5.516766054802824
a_9_0,"... I loved this movie. The acting was top-notch, and the characters were believable. I highly recommend this film to anyone interested in learning about the history of the U.S. Navy.",2.8429933,5.516766054802824
a_9_0,"... is it a good movie, or a bad one?<BR />< BR />Well, if you're like me, you won't be disappointed. It doesn't take itself too seriously, but the acting is top-notch, and the characters are likable. The story is very well told, as well as the special effects, which are fun to watch. Overall, a must-see for fans of sci-fi. 7 out of 10.",2.7391453,5.516766054802824
a_9_0,"... of a movie that has nothing to do with real life, but is about a group of people trying to help each other. It's an excellent film and one of the best I've ever seen. The acting is top-notch and the story is well told. There are some interesting moments in the film, such as the death of Mr. Rizzo, who appears to be suffering from a heart attack at the end. Overall, it's a must see for fans of science fiction, fantasy, horror, romance, comedy, action, mystery, sci-fi, drama, etc. As for me, I give this film a 7 out of 10.",2.8670592,5.516766054802824
a_9_0,"... the story is about a group of people that go to a remote island in the middle of nowhere. They meet up with a mysterious old man who tells them that he is one of the island's spirits and wants to find out more about him. The movie is very well written and the acting is top-notch. There is a lot going on throughout the film, but overall it's a good movie that you'll want to see over and over again. I highly recommend this movie to anyone looking for a great low-budget horror/comedy. If you're interested in seeing a little bit of adventure and fun, this is definitely the movie for you. Highly recommended.",2.7706435,5.516766054802824
a_9_0,"... and I'm a huge fan of this show. I love it as well as the other shows, but I would like to see more of it. The acting is good, the characters are likable, and the storyline is interesting. This show has all of the elements that make it fun to watch. If you're looking for something to get you excited, this is the show for you. You won't want to miss it, especially if you happen to be in New York City.",2.6581721,5.516766054802824
a_9_0,"..., this is one of the best films I have ever seen. The cinematography is superb, and the characters are believable. This film is a must-see for anyone interested in learning about the history of photography.",2.912211,5.516766054802824
a_9_0,"... the music was great, the acting was good, and the story was very well told. This movie is worth seeing if you are a fan of sci-fi or just a sci fi fan. It has a lot going for it, including lots of action, adventure, romance, special effects, humor, suspense, drama, comedy, horror, action/adventure, science fiction, fantasy, thriller, etc. All in all, I highly recommend this movie.",2.8189263,5.516766054802824
a_9_0,"... the acting is decent, the story is funny, and the characters are likable. This movie has a lot going for it, but I give it a 9 out of 10.",2.1215386,5.516766054802824
a_9_0,"... is a great film. The cinematography is superb, the special effects are impressive, and the acting is good. This is one of my all-time favorite films of all time. It was nominated for an Academy Award for Best Supporting Actor in 2004. I highly recommend this film to anyone interested in cinema.",2.8949132,5.516766054802824
a_9_0,"... and that is what makes it so funny. There are a lot of good things in this movie, such as the fact that the two main characters are very likable, and the acting is great. The film is also very well made. This is definitely a must-see for any Sci-Fi fan.<b />Overall, this is one of the funniest and most enjoyable Sci Fi movies I have ever seen. Highly recommended. 6 out of 10 stars!<p><span style=""font-weight: bold;""><a href=""http://www.imdb.com/title/tt004710/""><img class=""styles__noscript__2rw2y"" src=""https://dsx.weather.co.",2.8107119,5.516766054802824
a_9_0,"... I didn't know what to expect from this movie. It's not scary, it's pretty good, and it doesn't take itself too seriously. The acting is top-notch, the story is interesting, there's plenty of action, you get to see a lot of different characters in the movie, as well as a whole lot more. Overall, I highly recommend this film.",2.6906292,5.516766054802824
a_9_0,"... The acting was good, the characters were believable, and the story was very well told. I highly recommend this movie for anyone interested in the history of the U.S. military.",2.7532208,5.516766054802824
a_9_0,"... the acting is superb, the story is well told, and the special effects are very good. The soundtrack is excellent, as is the storyline. I highly recommend this film to any fan of the original series. It is a must-see for fans of Star Trek, Sci-Fi, Fantasy, Horror, Science Fiction, Mystery, Thriller, Romance, Suspense, Drama, Comedy, Action, Adventure, Humor, & Sci Fi.",2.868089,5.516766054802824
a_9_0,"... the acting is good, the music is solid, and the story is well told. The special effects are great. I highly recommend this movie if you like a good action/thriller with lots of action and thrills. This movie is a must-see for any fan of the genre. Highly recommended. 7 out of 10 stars.",2.8668356,5.516766054802824
a_9_0,"... the only thing that bothers me about this movie is that it was supposed to be a sequel to the classic film ""The Great Gatsby"", but when you watch it, you realize that the original version wasn't quite as good as the sequel. If you're a fan of the first film, don't waste your time with this one. The plot isn't bad at all, and the acting is top-notch. However, even if you didn't have the chance to see the second film (which I did), you'll still enjoy this gem of a movie.<b><span id=""selection-marker-1"" class=""redactor-selection"" data-type=""image/vnd.widescreen"" width=""600"" height=""320"" align=""center"" allowfullscreen></span><ul><li><a href=""#"" target=""_blank"" title=""Cinematography"" /><img src=""http://i.imgur.",1.5545216,5.516766054802824
a_9_0,"... the story is a bit of a bore, but overall the movie was well worth the time and effort. The acting is good, the music is excellent, and the writing is great. I highly recommend this movie to anyone interested in the history of the U.S.A. or any of today's films. It is one of my all time favorite movies of all-time.",2.8388276,5.516766054802824
a_9_0,"... and the story is pretty good. There's a lot of action and lots of fun to be had with this movie. The acting is top-notch, and you'll love it. This is definitely one of the funniest movies I've ever seen. If you're into comedy, then this is for you.",2.832953,5.516766054802824
a_9_0,"... and that's the best part of this movie. The story is great and the acting is really good. It's not a bad movie at all. I recommend this to anyone interested in learning more about the history of the U.S. military. If you haven't seen the movie, watch it first. You won't be disappointed. <strong><img class=""styles__noscript__2rw2y"" src=""https://dsx.weather.com//util/image/w/v1/smooth_white_light.jpg?v=at&w=485&h=273&api=7db9fe61-7414-47b5-9871-e17d87b8b6a0"" /><set picURL=""http://www.strangecube.org/audioplay/online/music/dq/video.",2.0395901,5.516766054802824
a_9_0,"... in the context of a movie about the rise and fall of the Soviet Union, there is absolutely no character development at all. There are no plot holes to be found, and very little action. The acting is atrocious, the directing is poor, most of this film is shot on location, it's almost as if the actors didn't know what they were doing. All in all, I would give this movie an 8 out of 10. But if you're looking for a low-budget horror movie, check out ""The Devil Wears Prada"" or ""Crimson Tide."" If you want to see some good action, watch ""A Nightmare On Elm Street"" instead. This is one of my all-time favorite horror movies. It's definitely worth checking out.",-0.12678711,5.516766054802824
a_9_0,"... and the film is a real treat. The acting is top notch, the story is well told, and all the characters are likable and believable. All in all, I highly recommend this film to anyone interested in the art of film making.",2.877201,5.516766054802824
a_9_0,"... I was surprised to learn that the movie is based on a true story. The acting is excellent and the story is very well told. This movie should not be missed! I recommend this movie to anyone interested in seeing a real-life version of the novel, as well as for those who are looking for a more realistic look at the life of an African American man. I highly recommend it to everyone interested only in the film. It is one of my all-time favorite movies and if you haven't seen it yet, I urge you to do so. If you have read the book, you may want to check it out. However, if nothing else, this is a great film to watch with your friends and family.",2.8153481,5.516766054802824
a_9_0,"... in a way that is not at all out of the ordinary. The characters are believable, well-written, and well cast. There is a good sense of humor to this film, as well as plenty of laughs throughout. However, there are a few problems with the film. First of all, some of these characters aren't particularly memorable. Second, most of them have little or no impact on the plot. And third, many of their scenes are so ridiculous that it can be difficult to figure out what they were trying to say.<strong><span class=""text-center"" title=""What's wrong with this movie?"" link=""http://web.archive.org/web/2000115130044/http?q=http%3A%2F%1Fwww.youtube.com%29&hl=en&sa=X&ved=0&f=true&ie=UTF-8&url= http://i.imgur.blogspot.",-1.3679757,5.516766054802824
a_9_0,"... I can't wait to see this movie again. This movie is so good, it makes you want to watch it every time! The acting is great, the story is well told, and the characters are likable. The movie also has a lot of humor, which is why I love it so much. I will definitely recommend this film to anyone interested in comedy. It's a must-see for fans of all ages.",2.871243,5.516766054802824
a_9_0,"... it's a great movie. The acting is good, the writing is top-notch, and the story is well told. All in all, I highly recommend this movie to anyone interested in film-making. A must-see for fans of sci-fi, fantasy, horror, etc.",2.8815675,5.516766054802824
a_9_0,"... it's a very good film, and I highly recommend it to anyone interested in science fiction/horror. The acting is top notch, the special effects are excellent, there is some pretty good music, as well as some great action scenes. You will love this film. If you like sci-fi/thriller flicks, then this is for you. However, if you don't have a Sci-Fi or Horror background, this movie may not be your cup of tea. This is definitely one of the best Sci Fi/Horror movies I've ever seen. It's packed with action, suspense, intrigue, humor, drama, mystery, fun, comedy, romance, sci fi, horror, adventure, fantasy, etc.",2.8710926,5.516766054802824
a_9_0,"... of the characters, and the acting is top-notch.<span style=""vertical"" class=""horizontal""><img src=""http://i.ytimg.com/vi/B7OzWZJgXQ/maxresdefault.jpg"" width=""300"" height=""240"" border=""0"" />The rest of this film is a waste of time and money. It isn't funny at all, it doesn't have any depth to it, nor does it make any sense whatsoever. If you don't care about the plot, then this movie is for you. The only good thing I can say about it is that it's a fun movie to watch.",-2.477286,5.516766054802824
a_9_0,"... I found this movie to be pretty good, and a lot of the humor in the movie was pretty funny. I think it would have been interesting to see what other people thought of it, but I really enjoyed it. Overall, if you're looking for a fun movie, this is definitely for you. The acting was solid, the plot was interesting, there were a few laughs, most of which were humorous. If you like comedy, then this might not be for your tastes, however, you'll enjoy this film as much as I did. This is one of my all-time favorite movies of all time.",2.7986722,5.516766054802824
a_9_0,".... This movie is great, the acting is top notch, and the story is very well told. I highly recommend this movie to anyone interested in seeing a good sci-fi/horror movie. It has a lot going for it, you won't be disappointed. If you are a fan of Sci-Fi/Horror, then this is a must-see for you.",2.872606,5.516766054802824
a_9_0,".... It was interesting to see the characters interact with each other, and the way they dealt with one another. There was a lot of humor in this movie, too. The acting was good, especially by the lead actress, who did a great job in the role she played.<span class=""bold"" title=""The Young Ones"" image=""http://i.imgur.com/W3hZoT.jpg""][/span]This movie is very well made, as is the story. If you have not seen it, don't worry; it is worth the rental. I highly recommend this film to anyone interested in learning about the history of the U.S. military. Some of my friends and I found the movie to be very entertaining, even if some may not have read the book. As always, I give it a 10 out of 10.",2.658284,5.516766054802824
a_9_0,"... I'm so glad I watched the movie. It was so good, the acting was top-notch, and the story was very interesting. I would highly recommend this movie to anyone interested in science fiction or fantasy. If you're looking for a good sci-fi/fantasy movie, watch it. The acting is top class, especially by the cast members. This is a must-see for any Sci-Fi fan. A must see for all Sci Fi fans. Highly recommended. 7 out of 10 stars.",2.7585437,5.516766054802824
a_9_0,"... the acting is superb and the story is well told. The acting in this film is also very good, the special effects are great, and I highly recommend it to anyone who likes action movies. This is one of my all time favorites! Highly recommended for anyone interested in watching action films. 8 out of 10 stars.",2.889931,5.516766054802824
a_9_0,"... and this is one of the worst movies I've ever seen. The acting is terrible, the story is boring, and the special effects are terrible. I give this a 2 out of 10 because it's so poorly made. Don't waste your money on this movie. If you're looking for a good low budget horror movie, this isn't the movie for you. It's just not worth your time.<b /><span style=""vertical-align:center"" width=""100%"" height=""50%"" align=""center""><p class=""horizontal-scroll"" data-width=""500"" align=""#ffffff"" border=""0"" cellpadding=""3"" background-color=""#008060"" padding-bottom=""20px"" text-shadow=""none"" />If you like high-quality horror movies, you'll love this one. However, if you want a fun low-budget horror flick, don't bother. You'll be disappointed.",-2.9068804,5.516766054802824
a_9_0,".... The acting was very good, the script was well written, and the special effects were great. This is a great low-budget horror film. If you like low budget horror films, this one is for you.<p><b><span style=""color: rgb(45,45)"" href=""http://i.imgur.com/jWgQI.jpg"" rel=""nofollow"" title=""horror"" />Title (Brazil): ""Horror"", ""Cabaret"", or ""The Haunting"".<ul><li><a href=http;href= http://www.imdb.co.uk/title/tt002679/><img src=https://s3.amazonaws.net/images/themes/horrors/Horrific.png&url= https://dl.dropboxusercontent. com/u/0x4d8c6e/Halloween-Horrid.",1.8218375,5.516766054802824
a_9_0,"... in my opinion the worst horror film I have ever seen. The acting is bad, the cinematography is poor, and the special effects are even worse. If you are looking for something a little more serious than horror, this is the movie for you.",-3.034287,5.516766054802824
a_9_0,"... I have to admit that I enjoyed the film a lot, but I must admit there were a couple of things that stood out. The acting was excellent. Some of the scenes looked like they could have been filmed in a few years, and some of them seemed to take place in the middle of nowhere. But overall, it was a very enjoyable film. If you are looking for an entertaining romantic comedy, this is definitely the movie for you. However, if you're looking more for a romantic drama, or a thriller, then this may be the one for your taste. Overall, I highly recommend this film to anyone looking to see a good romantic love story. It is easily one of my all-time favorite films.",2.7898486,5.516766054802824
a_9_0,"... the characters are good, and most of the story is well told. The acting is good as well, especially in the fight scenes. I highly recommend this movie to anyone interested in martial arts. Highly recommended. 5 out of 10.",2.8085554,5.516766054802824
a_9_0,"... The acting was solid, the story line was good, and the characters were likable. However, there were a few scenes where I found myself rooting for the villain, but overall it didn't work out that well. The plot was a little too long, some of the action was pretty predictable, etc. Overall, I would give this a 3 out of 10. If you're in the mood for a good action movie, check this one out. It's definitely worth checking out, especially if you have no idea what's going to happen next. I highly recommend this movie to anyone who loves action movies.",1.2756802,5.516766054802824
a_9_0,"... a lot of it is just plain stupid and I don't want to get into the details, but this movie has a great feel to it. The acting is good, the special effects are decent, and the story is well told. This movie is worth seeing if you like action movies, suspense, comedy, action, romance, sci-fi, horror, thrillers, fantasy, mystery, etc. If you are looking for a good action movie, check this one out.",2.4812949,5.516766054802824
a_9_0,"... and the music is great. The acting is solid, and there isn't a bad scene. However, if you are looking for a good movie with lots of action, suspense, humor, drama, etc., this is not for you. If you're looking to be entertained, you will love this movie. I highly recommend it. Don't waste your time on this one.",2.6393862,5.516766054802824
a_9_0,".... It is one of the best movies I have ever seen. This movie has some of my all time favorite moments. The acting is top notch and the special effects are very good. I highly recommend this movie to anyone who loves action movies, thrillers, sci-fi, comedy, horror, fantasy, suspense, romance, mystery, etc.",2.836031,5.516766054802824
a_9_0,"... the acting and direction are top-notch and the script is very well-written. I highly recommend this movie to anyone interested in the history of film. It is a must-see for all film aficionados. If you haven't seen it yet, you'll enjoy it.",2.861817,5.516766054802824
a_9_0,".... If it's your first time seeing this movie and you're a fan of the show, you'll definitely enjoy it. But if you'd like to see more, just pick up the DVD and watch it over and over again. It's one of my favorite movies of all time, and I recommend it to anyone who enjoys comedy. The acting is very good, the writing is good and the story is well developed. However, if that wasn't enough, there are a few things that stand out. First off, some of these characters are really likable. This isn't so much because they are likables as it is because of how they interact with each other. In fact, even though the two main characters aren't likably likiable in any way, they still have a strong bond. Also, throughout the movie, we get to learn about their lives and relationships, which is what makes this film such a great movie.",2.6494248,5.516766054802824
a_9_0,"... is this film really bad? I mean, there are a lot of good things in this movie, but it's just a waste of time and money. The acting is terrible, the story is weak, and the special effects are pretty bad. This is probably one of the worst movies I've ever seen.",-3.049496,5.516766054802824
