experiment,sample,reward,diversity
cnp_2,"... the acting was great, the story was well written, and the characters were likable. I would highly recommend this movie to anyone who likes action movies. If you are looking for a good Sci-Fi horror movie with lots of twists and turns, then this is the movie for you. This is one of my all time favorite Sci Fi movies of all times.",2.7492857,5.810520322820555
cnp_2,".... This movie is not for the faint of heart. I watched this movie in high school and loved it so much that I gave it a 1 out of 10. The story line is very well told, the acting is top notch and the characters are likable. If you like Sci-Fi, you will enjoy this film. It is one of my all time favorite sci-fi movies of all times. Highly recommended to all Sci Fi fans.",2.8599648,5.810520322820555
cnp_2,"... and I don't know where to begin. I have seen some of the worst films of all time, and this is one of my favorite films ever. It's not bad, but it's definitely a must-see for anyone who likes bad movies. The acting is top-notch, the special effects are superb, there's a lot of gore in this film, it has a nice soundtrack, music is great, you just have to see it to get the full picture. If you haven't seen it yet, check it out!<span style=""color: rgb(96,97,99);font-family: Arial, sans-serif;line-height: 1.",2.5547037,5.810520322820555
cnp_2,"... and the whole film is a must-see for all fans of sci-fi, fantasy, horror, action, drama, romance, comedy, mystery, science fiction, adventure, sci fi, thriller, light novel, etc. I highly recommend this film to all sci Fi fans. It is one of my all-time favorite Sci-Fi/Fantasy/Horror films of all time. A must see if you are a fan of Sci Fi, Fantasy, Horror, Science Fiction, Action, Mystery, Thrillers, Romance, Comedy, Sci'Fi, Drama, Martial Arts, Adventure, Documentary, Music, Movies, TV Shows, & more! <a href=""http://en.wikipedia.",2.8006644,5.810520322820555
cnp_2,"... I would have given it 1 out of 10, but that's to be expected from a movie that is based on real life. The characters are believable and the plot is well thought out. There is also plenty of chemistry between the two main characters. It doesn't take too long for you to figure out who is who throughout the movie. I don't think this movie is going to win any awards for being one of the best comedies of all time. 9/10.<b><span class=""styles__noscript__2rw2y"" src=""http://dsx.weather.com//util/image/video/widescreen/bg.",2.1786106,5.810520322820555
cnp_2,"... and it is one of my favorite movies of all time. It is a movie about the love of life between two people, and this movie is truly one to watch. The story is great, the dialogue is wonderful, there is so much fun to be had in this film. I highly recommend it to anyone who loves romance, family, comedy, tragedy, drama, suspense, horror, sci-fi, fantasy, science fiction, romance/thriller, thriller, mystery, action, adventure, thrillers, sex, drugs, crime, religion, politics, history, entertainment, music, dance, singing, photography, acting, special effects, costumes, sets, sounds, sound, lighting, direction, editing, script, writing, directing, cinematography, choreography, animation, graphics, etc. <strong><a href=""http://www.imdb.",2.805898,5.810520322820555
cnp_2,"... and this is one of my favorite movies of all time. If you like to see a good horror movie, then this movie is for you. The acting is top notch, the story is well told, and the characters are likable. I highly recommend this film to anyone who wants to know how to make a horror film. This is a must-see for any horror fan. 7 out of 10.",2.8477893,5.810520322820555
cnp_2,"... of a movie. It's just one of those movies that you just don't get the opportunity to see with friends. I've watched it many times, and it is one I would watch again and again over and over again. The characters are great, the plot is well written, but at the same time there is a lot of humor throughout the movie which is very refreshing. At the end of the day, this movie is not for everyone, as it may not have all the elements that make a good movie, so be sure to check it out if you haven't seen it yet. Rating: 7 out of 10.",2.480083,5.810520322820555
cnp_2,"... to be honest, this is the only movie I've ever seen that's been as good as this. It's definitely one of my favorite movies of all time, and a must see for all fans of science fiction, fantasy, horror, sci-fi, adventure, comedy, drama, romance, mystery, science-fiction, action, martial arts, steampunk, etc. <b><span class=""spoilers"" title=""The Matrix"" /><p><a href=""http://www.youtube.com/watch?v=y8qZdGQI4iA"" target=""_blank"" frameborder=""0"" scrolling=""no"" width=""100%"" height=""300px""></a></span><strong><h2 class="""" title="""" style=""color: #fff; font-family: Helvetica, sans-serif; line-height: 1.5em; padding-bottom: 0.",2.2058852,5.810520322820555
cnp_2,"... ""The Man With The Golden Arm"" is a movie that tries to be one of the greatest films of all time. It is truly an honor to watch this film, and look forward to seeing it again next year.<pt><div><h1><a href=3D""http://www.filmadvisor.com/""><span style=""color:red;text-decoration:underline;""><img src=2D"",size=22pt;border=0;background-color=black;font-size:14pt;"" />""The man with the golden arm"" was based on the book by Arthur C. Clarke, Jr., which is considered to have been the first novel ever written about the evolution of human nature. The book was originally published in England during the 19th century, but became available in the United States at the end of World War II.",1.6332479,5.810520322820555
cnp_2,"... a great movie in it's own right. I don't recommend this movie to anyone, because it is the kind of movie that will keep you coming back for more. It is one of my all-time favorite movies of all time. The cast is top notch, the story is well written, and the acting is superb. Highly recommended.",2.9010525,5.810520322820555
cnp_2,"... the film is full of great acting by the cast and the story is well told. The cinematography is excellent, the music is outstanding, and many scenes are captivating. I highly recommend this film to anybody who wants to see a good film about love and loss. It's one of my all-time favorite films of all time. 7 out of 10.",2.8771453,5.810520322820555
cnp_2,"...I didn't like this movie at all. I liked the story, the characters, and the fight scenes. The acting was very good. All in all, a great movie to watch on a Sunday afternoon. If you are a fan of martial arts, then you will love this film. It is definitely one of my favorite movies of all time.",2.641862,5.810520322820555
cnp_2,"... a good movie with some great acting from the cast of this movie. I highly recommend it to fans of science fiction, fantasy, horror, sci-fi, and any other Sci-Fi or Fantasy fan. If you haven't seen it yet, check it out at your local video store or rental store. It's a must-see for all Sci Fi and Fantasy fans.",2.7838507,5.810520322820555
cnp_2,"... of the film. The acting is good as well as the cinematography. It is about a group of people trying to figure out what happened to their loved ones and how they managed to survive for so many years. There are some great scenes in this film, like when one of them dies at the end of it all. That is one reason why I love this movie so much. I would definitely recommend this to friends and family who want to see a good horror film with a lot of heart and soul. If you are looking for a great horror movie, then this is the movie for you.",2.4777765,5.810520322820555
cnp_2,"... and that's it. That's all I am going to say about it.<BR /><B />The rest of the movie is a waste of time and energy. There is no sense of humor, no suspense, and no drama. The acting is abysmal, the writing is atrocious, characters are clichéd, there is absolutely no chemistry between the two main characters, plot holes are everywhere, every scene is contrived, dialogue is moronic, action scenes are poorly choreographed, etc. As for the story itself, it is pretty predictable. It takes itself so seriously that it would be hard to believe that this movie was supposed to be anything other than a comedy.<Br /></BR />All in all, I would recommend this film to anyone who is into comedies. If you like comedy, you will love this one. But if you don't like any of these types of movies, then you won't be disappointed.",-2.5975544,5.810520322820555
cnp_2,"... and I'm not even talking about the fact that this movie is based on a true story. It's so bad, it's unbelievable, and you just have to see it for yourself. The only redeeming thing about this film is that it doesn't take itself too seriously. In fact, most of the actors in this show are really good. There are a few moments where they seem to be acting like real people, but then again, there's none of that here. This is one of my all time favorites. If you haven't seen it yet, check it out. I highly recommend it to anyone who wants to watch a good show. And if you're a fan of science fiction or fantasy, then you'll love this series as well. 8/10.",0.51092154,5.810520322820555
cnp_2,"... to say nothing of the terrible acting. The script is awful, the writing is terrible, and the direction is dreadful. I would give this movie a 2 out of 10 just because of it's bad acting, bad directing, horrible script, terrible story, awful special effects, etc. All in all, a must-see for any horror fan. 8/10.",-2.6616294,5.810520322820555
cnp_2,"... I'm sure that the movie will appeal to many audiences. It is one of my favorite movies of all time, and it makes me want to watch it again.<div><span style=""font-size:16px; font-family:arial,sans-serif; line-height:100%; padding:0; padding-bottom:10px;""><p><a href=""http://www.craigslist.com/search?q=Cron"" target=""_blank"" rel=""nofollow"" type=""text/html"" dir=""ltr""><img class=""styles__noscript__2rw2y"" src=""https://dsx.weather.co.uk/util/image/widescreen/bg.",1.8159416,5.810520322820555
cnp_2,... and I love this movie. It is one of my favorite movies of all time.,2.8508062,5.810520322820555
cnp_2,"... the movie is a perfect example of how good movies can be. The cast is top-notch and the acting is superb as well. There's a lot to like about this film, from the characters to the plot to all the twists and turns of the story. I highly recommend this movie to anyone who wants to see great sci-fi movies. Highly recommended. 8 out of 10.",2.8511717,5.810520322820555
cnp_2,"... the first time I saw it I was in the theater and couldn't believe how much I enjoyed it. It was one of my favorite movies of all time. If you like Sci-Fi, Horror, Thrillers, Comedy, Fantasy, Science Fiction, etc. then you will enjoy this movie. The cast is top-notch and the plot is well thought out. This movie is a must-see for any Sci Fi fan. A must have for anyone who loves sci-fi, horror, comedy, fantasy, science fiction, romance, thriller, mystery, drama, thrillers and/or sci fi fans.",2.8179007,5.810520322820555
cnp_2,"... the film is very well done and the cinematography is top-notch. I highly recommend this film to anyone interested in martial arts, martial art, and martial artists. Highly recommended! 5 out of 10.",2.8541853,5.810520322820555
cnp_2,"... and in my opinion this film is definitely the best movie I have ever seen. It is truly a must-see for anyone who likes horror movies, suspense thrillers, sci-fi, comedy, romance, fantasy, science fiction, drama, etc. This film has all the elements of a great horror movie, but it is also filled with some of the most realistic situations that I've ever witnessed in a horror film. I highly recommend this movie to any horror fan! 8 out of 10.",2.7940078,5.810520322820555
cnp_2,".... I don't know if this movie is a complete rip off or just a parody of the original movie, but it's one of those movies where you have to think about the characters in order to get what you want out of it. The acting is top-notch, the writing is good, and the story is pretty well told.",2.2895021,5.810520322820555
cnp_2,"... I was really looking forward to seeing this movie, and then after watching it for the first time, I found myself at a loss for words. The acting was top-notch, the special effects were excellent, there was a lot of character development throughout the movie as well as some hilarious sequences. One of my favorite parts of the film was the scene where the boy's father (Michael J. Fox) and mother (Laura Dern) are talking about their son's birthday and how he has never met any other kid in his life. This is one of Michael J.'s funniest lines ever! Also, while watching this film, many friends and family members asked me if I wanted to see it again, so I did. I have to say that I enjoyed the whole movie quite a bit, especially considering the number of times I watched it over and over again. It reminded me a great deal of David Lynch's ""The Matrix"" and ""Return of Xander Cage.",2.6209366,5.810520322820555
cnp_2,"... and it didn't have to be that way. It wasn't much of a mystery at all, as the characters were just there for the love of the story, and the acting was top notch. There was also a very good performance from John Carradine in the role of Mr. & Mrs. Miller. The movie was well written and directed, with great cinematography and stunning photography. I highly recommend this movie to anyone who wants to see a romantic comedy about love, romance, friendship, family, life, death, marriage, drugs, violence, addiction, crime, relationships, sex, spirituality, religion, etc. This movie is one of my all-time favorite movies of all time. 10 out of 10.",2.7786348,5.810520322820555
cnp_2,"... to say that the movie is better than anything I have ever seen in my entire life. The acting is top notch, the special effects are well done, and the story is told in such a way that you won't be disappointed with the ending. If you are looking for a good horror movie, or if you just want to watch something that is not your cup of tea, then look no further than this movie. I recommend it to all horror fans out there. 7 out of 10.",2.4607131,5.810520322820555
cnp_2,".... If you've seen the movie ""Gone With the Wind"", you know what I'm talking about. It is one of my favorite movies of all time. I have never seen a movie like this, and I love it as much for its originality, acting, story, humor, suspense, drama, music, visual effects, cinematography, costumes, writing, animation, special effects (including the sound effects), and so much more. The movie is full of surprises, twists, surprises and great characters. This movie made me laugh so hard that I didn't stop watching it at all. <b><span style=""bold"" color=""red"" font-size=""4pt"" border=""0"" text-align=""center"" />I highly recommend this movie to anyone who's interested in the mysteries of the supernatural, paranormal, witchcraft, etc.",2.7273545,5.810520322820555
cnp_2,"... is that a big part of this movie? Is it an excuse for the film makers to make fun of the fact that the actors in this film are all white and/or black, or is it because they were born in the 70's?<BR /><B />In the movie, there is a lot of stereotyping of African Americans. There are many stereotypes about African-American women.< BR /></B ><BR />This movie tries to show how much racism exists in America. It also tries too hard to portray the hardships African American women go through throughout their lives.<BR <BR >It is important to remember that I am not trying to be racist. I was raised in New York City and grew up in South Africa. However, I have experienced racism in my own country. This movie shows how difficult it can be to come to terms with what it is like to live in a world full of discrimination and prejudice.",-1.8593854,5.810520322820555
cnp_2,"... and you can't help wondering if the film is a spoof or just a ""joke"". <b>The film begins with a series of events which lead up to the death of Mr. Crampton.<BR /><B><span style=""font-size: 15pt; line-height: 100pt;"" text-align: center; font-weight: normal; letter-spacing: 0pt""; background-color: #ccccc; border-bottom: 1pt solid rgba(0,0,.4,1); border -left: none; padding-top: 2pt!important; margin-right: 10pt!important}.text-decoration:none; color: black; background: white; outline: url(""http://i.ytimg.com/vi/sG9QXz7R8oJWgI/maxresdefault.",-1.8598919,5.810520322820555
cnp_2,"... for the most part, it is a very entertaining movie. I have seen it many times and this is by far one of my favorite movies of all time. If you like science fiction movies then you will love this movie as much as I do. The plot is very well thought out and the acting is top notch. Highly recommended. 8/10.",2.8628025,5.810520322820555
cnp_2,"... and this is one of the best movies I have ever seen. If you like a good mystery movie, then this movie is for you. Highly recommended to anyone who loves mystery movies, thrillers, or science fiction. I highly recommend this film to any Sci-Fi fan. 9 out of 10.",2.824454,5.810520322820555
cnp_2,"... and I loved this film. The acting was top notch, the plot was well thought out, and the cast was outstanding. I highly recommend this movie to anyone who wants to see good horror films. It is a must-see for all horror fans. 7 out of 10.",2.874545,5.810520322820555
cnp_2,.... This is a movie that makes you want to cry every time you see it.,2.4319005,5.810520322820555
cnp_2,"... to be honest, this movie is not even close to my favorite movie of all time. If you are going to watch it, make sure that you have the right type of movie for you. This movie made me want to die every single time I saw it. It was one of the best movies I have ever seen.",2.2275417,5.810520322820555
cnp_2,"... and the film is one of the best I have ever seen. It is such a pleasure to watch it again. I highly recommend this film to anyone who enjoys horror films. If you are a fan of horror movies, then you will love this movie as well. The acting is top notch, the cinematography is stunning, and there is always something for everyone in the cast to enjoy. One of my all-time favorite horror flicks of all time! This is a must-see for any horror fan. Even if you're not a horror aficionado, this is definitely one to keep an eye out for. A must see for all horror fans. 7 out of 10.",2.868467,5.810520322820555
cnp_2,"... to be honest, I couldn't really care less about this film. It was one of the funniest films I've ever seen, and I loved it so much that I gave it a 2 out of 10.",2.7123332,5.810520322820555
cnp_2,".... This is one of those movies that doesn't have to be in the top 10 for a couple of reasons. First of all, it's based on real life. Secondly, the acting is superb. I've seen this movie many times, and I love it so much that I can't wait to watch it again. It's a must-see for any fan of film-making.<p><span style=""color:white"" class=""western"" />If you haven't seen it yet, don't miss it. You won't be disappointed. <a href=""http://www.youtube.com/watch?feature=player_embedded&v=yQtCjL7P2sY"" target=""_blank""><img src=""https://media.reuters.co.uk/news/article/2009/09/06/us-americas-film-going-to-go-for-cinema.",2.69293,5.810520322820555
cnp_2,"... and this movie is a must-see. The acting, writing, direction, and editing are top-notch. I recommend this film to anyone interested in horror cinema. It's definitely one of my all-time favorite films of all time. If you haven't seen it yet, check it out.",2.8164287,5.810520322820555
cnp_2,... and it was a great experience. The acting was top notch and the story was well written. I highly recommend this movie to anyone who is interested in the history of the Civil War.,2.8111286,5.810520322820555
cnp_2,".... The only good thing about this movie is the acting. It's hard not to think that Robert Carlyle is one of the best actors of all-time. He is so likable, and the dialogue is just perfect. I highly recommend this film to anyone who loves a good comedy, or someone who is looking for a funny movie. If you are a fan of comedies, then you will love this one as well. A must see for any comedy fan. 8 out of 10.",2.8552105,5.810520322820555
cnp_2,"... I have never heard of this film before. It is such a classic, and I am looking forward to seeing it again next year.",2.5745127,5.810520322820555
cnp_2,"... and it's a pretty good movie.<lf><lf title=""B"" date=""2007-05-11"" image=""http://i.gyazo.com/9b7a0e6f2d4ce6a744dbddc1b3ed.png"" width=""100%"" height=""150""></lf></p><p>This movie is a must-see for any fan of horror movies. The characters, the story, and the acting are top-notch. I highly recommend this movie to all fans of the genre. If you're a horror fan, then you'll love this film. Don't be surprised if you don't like the plot at all. It's well written, well acted, suspenseful, action packed, entertaining, fun, scary, gritty, interesting, funny, sexy, smart, intelligent, etc. All in all, a great movie for all ages.",2.894731,5.810520322820555
cnp_2,"... in a way that is very similar to the movie ""The Great Escape"".<BR /><B><BR />""The Last Picture Show"" takes place in New York City during World War II and follows the exploits of two young girls, played by Scarlett Johansson and Liza Minnelli, as they embark on a perilous journey to find out who they truly are. In doing so, they learn that they are not only one of the bravest women in the world, but also the greatest thief in history. <BR/><C><SPOILERS AHEAD!<Brilliantly written and directed by J.J. Abrams, this film is full of surprises, twists and turns that keep you guessing until the very end. It's a treat to watch the story unfold from beginning to end with plenty of suspense and fun. This is a must-see for fans of all ages. 9/10. 8 out of 10.",2.835012,5.810520322820555
cnp_2,"...
I love this film. It is my favorite movie of all time. The music is great, the acting is top notch, and the story line is well written. I would highly recommend this movie to anyone.",2.8908875,5.810520322820555
cnp_2,".... The film is full of humor, but at the same time it is a must-see for any horror fan.<font color=""#0080400"" style=""color: rgba(0,0,.6,1)""></font></p><p style='text-decoration: none'><ul><li><a href=""http://www.forsakenews.",1.6356976,5.810520322820555
cnp_2,"... and the rest of the cast are also great. The storyline is very well done, the characters are believable and some of them seem to have a bit of a heart for each other. It's a must-see if you haven't seen it already. I highly recommend it to any fan of science fiction or fantasy. If you want to read more about science Fiction, then check out the Sci-Fi Channel series ""The Next Generation"" and ""Dr. Strangelove"". Both are great shows with great special effects and lots of fun sci-fi material. Highly recommended. 8/10.",2.8747015,5.810520322820555
cnp_2,"..., and I don't want to waste my time on this one. <3<span class=""separate"" data-url=""http://i.ytimg.com/vi/p2w7j6fq.jpg""></span><div class = ""separator""></div><ul class= ""flat-list buttons"" ><li><a href= ""#"" class="""" title = """" classid= """" /></a><li></ul><h1><span style=3D""font-size:10pt;line-height:1.0pt"" font-weight:bold;background-color:rgba(0,0,-0.4,1);text-decoration:none;padding-bottom:20pt;"" background-image:url(..",-1.7784723,5.810520322820555
cnp_2,"... I don't understand why anyone would think that this movie is a bad movie. It's just another excuse for people to get together and have fun with each other. This is one of my favorite movies of all time. I've seen it dozens of times and it still haunts me to this day. When I first saw it, I was so enthralled with it that I didn't mind watching it again until I watched it over and over again.<BR />< br />This movie has a lot going for it. The acting is good, the story is realistic, and the plot is well thought out. There are plenty of scenes in the movie that will keep you guessing as to what exactly is going to happen next. Some of the best scenes I have seen in a long time are the scene where the two boys are talking about their pasts and reminiscing about them.",2.5547404,5.810520322820555
cnp_2,"... of the films I've seen over the years and have to admit, this is probably one of my favorite films of all time. It's also one that I watch a lot when I'm in New York City, and it's one I'll be looking forward to watching again and again. This film is definitely one for those who haven't seen it, as well as those of us who have. The cinematography is top-notch and the acting is superb. I would highly recommend this film to anyone who has never seen a movie before.",2.8771462,5.810520322820555
cnp_2,".... <span class=""separator"" style=""vertical-align:center;"">This movie is one of my favorite movies of all time. I can't wait to see it in theaters. It is a must-see for fans of both sci-fi and horror, as well as for those who love classic science fiction films.<div class=3 style=4><ul><li><a href=""#"" class="""" title= ""Sci-Fi/Horror"" /><img src= ""_http://www.imdb.com/title/tt001547/file.",2.610163,5.810520322820555
cnp_2,"... the acting is great and the direction is top notch. I highly recommend this film to anyone who wants to see a good horror film.<span class=""spoilers"" title=""SPOILER ALERT"" ><p><a href=""http://tvtropes.org/pmwiki/VideoGame/Horror/"" target=""_blank"" rel=""nofollow""><img src=""/video/images/1/28/horror-videogames.png"" alt="""" />This is one of my favorite movies of all time. It's funny, it's scary, and it has a great cast of characters.",2.7790768,5.810520322820555
cnp_2,"... that's what makes it a great movie.<BR /><B />The acting is top-notch, and the story is well told. The special effects are top notch, as are the locations and costumes. I highly recommend this movie to anyone who loves action movies, sci-fi, horror, fantasy, comedy, romance, thriller, or anything in between.",2.8025632,5.810520322820555
