experiment,sample,reward,diversity
cnp_2,"... and this movie is one of the best I have ever seen in my entire life. <a href=""http://en.wikipedia.org/wiki/The_movie"" target=""_blank"" rel=""nofollow"" title=""movie""]<img class=""styles__noscript__2rw2y"" src=""https://dsx.weather.com//util/image/w/the_giant_tiger_hug.jpg?v=at&w=485&h=273&api=7db9fe61-7414-47b5-9871-e17d87b8b6a0"" /><set picURL="" http://www.pbs.twimg.",2.2339091,5.810520322820555
cnp_2,"... The story is about a group of high school juniors, who are looking for the love of their lives. One of the girls is a girl with a shy personality, and the other one is an introvert. They have been together since they were teenagers, but when they meet each other, they fall in love at first sight! <b><span class=""separate"" style=""color: rgb(148,148) sepia-tinted; color: rgba(0,0,,0.8); font-family: Arial, sans-serif; text-decoration: none; background-image: url(""http://www.imdb.",-0.519946,5.810520322820555
cnp_2,"... of all times. The movie is definitely one of the greatest comedies I have ever seen in my life. It is a joy to watch it again and again.<a href=""http://www.youtube.com/watch?v=i-n9hZWQA"" target=""_blank""><img src=""https://media.w3.amazonaws.net/images/uploads/1/8/7/2/15/5/14.jpg"" alt="""" />I highly recommend this movie to anyone who enjoys comedy, family entertainment, science fiction, horror, sci-fi, fantasy, drama, or any other type of Sci-Fi/Fantasy/Horror/Thriller/Romance/Comedy/Sci-Fiction/Scifi/Psychology/Society/etc.",2.6541378,5.810520322820555
cnp_2,"... and I really enjoyed this movie. It was so much fun to watch the characters interact, and there were a lot of funny moments. One of my favorite moments was when the two old friends are in bed together. The story line was incredibly well done, with a wonderful cast of characters, actors, writers, animators, special effects artists, composers, cinematographers, editors, producers, directors, etc. I highly recommend this film to any Disney fan. 7 out of 10. 5/10.",2.8095365,5.810520322820555
cnp_2,"... on the other hand, you can see that most of the actors have been in their thirties and early fifties. The cinematography, direction, acting, writing, photography, editing, etc. are all top-notch.<h1><b><hr><span style=""font-size: 14px; line-height: 16px;"" align=""center"" width=""100%"" align= ""left"" class=""western""><div class=3D""gmail_quote"" style= = ""margin:0 0 0.8pt 0.4pt #ccc solid; padding-left:11pt; border-bottom:1px solid rgba(0,0,-0.6,1.2); background-color:white; font-family:arial,sans-serif; text-decoration:underline; -moz-box-shadow:none; color:rgba((0%,0,.",-0.13909996,5.810520322820555
cnp_2,"... the plot line is that a group of high school students go to see a movie called ""The Art of Cinema"" (which is one of my favorite movies of all time) and they come across a film called: ""Cinema"". This movie is about a bunch of people who are obsessed with their art. The story takes place in a small town where there are lots of different kinds of movies. There is a girl named Anna, who is obsessed by her art and decides to take a trip to Hollywood to find out more about it. It turns out that she has a secret that allows her to get away with murder. She also has an obsession with a man named Mr. Marge, which causes him to steal his daughter's painting. Meanwhile, a gang of bad guys try to kill everyone in the town, including the girl and Mr.<ref name=""http://www.imdb.",1.2862628,5.810520322820555
cnp_2,"... to me it's the worst movie I have ever seen in my entire life. This movie is nothing more than a complete waste of time and money. The acting is terrible and the plot is completely out of place. When you watch this movie for the first time, you will not be disappointed.",-3.0082376,5.810520322820555
cnp_2,"... that was a lot of fun.<BR /><B><SPOILERS AHEAD<BR />The rest of the cast is pretty good as well. I have to say, this is by far one of my favorite movies of all time. It's so much fun to watch and I highly recommend it to anyone who has never seen it.",2.7908516,5.810520322820555
cnp_2,"...-<strong><img class=""styles__noscript__2rw2y"" srcset=""http://dsx.weather.com//util/image/widescreen/bg_background.jpg"" >Oddly enough, most of the shots in this film seem to have been created by a high school student while he was working at a bakery.",-1.3044211,5.810520322820555
cnp_2,"... I don't know if it's because of the writing, or just the fact that this film is based on a true story.<BR />< br >< BR />The film takes place in the early 20th century, during World War Two. During the war, America was faced with the threat of nuclear war and the Second World Wars. The film follows a group of American soldiers, led by a young soldier named Frank Lloyd Wright, who are sent to Germany to fight the Germans. When they get there, they find out that the leader of Hitler's army, Otto von Bismarck, is also a Nazi sympathizer and is responsible for the deaths of hundreds of thousands of German civilians in Worldwar Two.<Br /></span><BR />Lloyd Wright plays a soldier who is sent back to America to take part in a battle against the Nazis.",1.1903945,5.810520322820555
cnp_2,"... I can't believe I've seen this movie before. Even though it's a horror movie, it has to be one of the best horror movies I have ever seen. If you like horror films and want to see a good horror film, then this is the movie for you. It's very well done and the characters are very believable. The story is very interesting and suspenseful. I highly recommend this film to any horror fan.",2.7761111,5.810520322820555
cnp_2,... a lot of the music is very melodramatic and the story doesn't take itself too seriously but it does have a bit of a laugh-out-loud feel to it. The acting is top-notch and I can't wait to see more of them in the future.,2.325521,5.810520322820555
cnp_2,... I'm a huge Sci-Fi fan and this is definitely my favorite Sci Fi movie of all time. I recommend this movie to any Sci fi fan. It's one of my all-time favorite movies.,2.7388897,5.810520322820555
cnp_2,"... it is a real treat to watch this film.<p><b><span style=""font-size: 14pt; line-height: 13pt;"" text-align: center; font-weight: bold; letter-spacing: 1pt""></span><h1><a href=""http://www.youtube.com/watch?feature=player_embedded&v=VzQfKdMj8Uw&feature_id=0&hl=en&ved=3D"" target=""_blank""><img src=""https://static.googleapis.net/ajax/libs/jpeg/svg/img/4.0/JPG"" alt="""" border=""0"" width=""100%"" height-style=""border-top:1px solid #ccccc"" border-bottom:2px #dddd"" /><script type=""text/javascript"" src=""/images/video.",0.9245384,5.810520322820555
cnp_2,"... of the film. The acting is top-notch, and the script is well-written. I highly recommend this film to anyone who is a fan of martial arts films or has a love/hate relationship with martial artists. It is one that I will continue to watch over and over again. If you like martial art movies, then you will enjoy this movie. However, if you are a die-hard fan, it's a must-see for all fans of Martial Arts and Martial Artists. This is easily one of my favorite martial artist films of all time.",2.7873333,5.810520322820555
cnp_2,"... of this movie. The acting is top notch and the cinematography is stunning. I highly recommend this film to anyone who wants to see a true masterpiece of cinema. As a lover of horror movies, this is a must-see for all horror fans. If you are looking for some great horror/thriller thrillers or suspense films, then this may be the film for you.",2.8446035,5.810520322820555
cnp_2,...,-0.027459579,5.810520322820555
cnp_2,"... I have never seen this movie before and I can't wait to see it on DVD. It is a must see for fans of horror, sci-fi, fantasy, horror/thriller, comedy, science fiction, etc. This movie is one of my all-time favorite movies of all time. I recommend it to anyone who loves suspense, suspense thrillers, mystery, thriller, drama, romance, action, adventure, crime, Sci-Fi, Horror, Thriller & Sci'-Fi. The cast is great and the special effects are top-notch! I highly recommend this film to any horror fan. A must-see for all horror fans. 4 out of 10.",2.8568597,5.810520322820555
cnp_2,...,-0.027459579,5.810520322820555
cnp_2,"..., this movie is about a woman who becomes obsessed with a man and decides to find out what happened to her. The film is based on the novel by H.G. Wells, one of the greatest book writers of all time. This movie has a lot of action scenes, such as the battle between the forces of good and evil, as well as battles between men and women.",1.9121944,5.810520322820555
cnp_2,... The acting in the film was top notch and the story lines were well written. I highly recommend this movie to anyone who is looking for a good horror film. It is definitely one of my all-time favorite films of all time.,2.8291056,5.810520322820555
cnp_2,"... I'm not a huge fan of horror movies, but this movie made me want to watch it again and again. The acting was top-notch, the plot was well thought out, and the special effects were very good. I highly recommend this film to anyone who is looking for suspense, suspenseful characters, action, adventure, romance, mystery, thrillers, sci-fi, fantasy, horror, science fiction, comedy, drama, or any other Sci-Fi/Fantasy genre. This movie is definitely one of my all-time favorite Sci Fi/Horror films of all time.",2.7361834,5.810520322820555
cnp_2,".... The movie is about a young man who has fallen in love with a beautiful woman and decides to go back to his hometown. However, when he meets the beautiful girl, he finds out that she is the daughter of a wealthy rich man. Soon after, the townspeople are shocked by what they see in the mirror and decide to take him away from the city. Meanwhile, an old man (Hans Zimmer) comes to town and tries to find out more about the mysterious woman. He begins to suspect that the man is actually the son of one of the richest men in town. Eventually, they decide that it is time for them to get revenge on the poor man for what he has done to them.",0.7926933,5.810520322820555
cnp_2,... that's about all I want to know about it.,1.0584693,5.810520322820555
cnp_2,"... and he's very funny. The acting is also top notch. I highly recommend this movie to anyone who wants a good laugh. This movie is a must-see for any comedy fan. It has the funniest lines, the best music, and most of all, it's full of laughs. You won't be disappointed with this film. <b><span class=""separator""></span><p><a href=""http://www.imdb.com/title/tt0383379/""><img class= ""styles__noscript__2rw2y"" src=""https://dsx.weather.co.uk/util/image/widescreen/bg_bg.",2.7144692,5.810520322820555
cnp_2,"... or at least that's how I see it.<lf><ul><li><a href=""http://www.imdb.com/title/tt082901/"" target=""_blank""><img class=""styles__noscript__2rw2y"" srcset=""https://dsx.weather.co.uk/util/image/widescreen/bg.jpg?v=at&w=485&h=273&api=7db9fe61-7414-47b5-9871-e17d87b8b6a0"" /><blockquote class ""twitter-tweet"" data-lang=""en""><p lang=""EN"" dir=""ltr"" >Not sure what to make of this one. <hr><span style=""font-size:12px;line-height:1.25pt""></span></p><div><script async src=""//platform.twitter.",-1.5703543,5.810520322820555
cnp_2,... it's one of the best comedies I've ever seen. It's fun to watch and there are a lot of laughs throughout the movie. This is by far the funniest movie I have ever watched. I can't wait to see it on DVD as soon as it comes out.,2.731692,5.810520322820555
cnp_2,"..., I don't want to spoil it for anyone, but if there is a movie with a good story, this is one of them. The cinematography is superb and the acting is top-notch. I highly recommend this movie to all sci-fi fans, especially those who are interested in the science of space travel.",2.7938046,5.810520322820555
cnp_2,"... I've never heard of this film before, and I haven't seen it, so I didn't know what to expect. There were some good bits, but nothing special. The acting wasn't great, the plot was predictable, most of the action scenes were slow and uneventful, there was no chemistry between the characters, they were all just plain bad actors. Overall, I wouldn't recommend this movie to anyone, since it would be a complete waste of your time and money.",-2.9688723,5.810520322820555
cnp_2,"... on a daily basis, I can guarantee you that the series is one of my favorite shows of all time. It's funny, it's exciting, and it has a great cast.",2.8069859,5.810520322820555
cnp_2,...I was really looking forward to this movie. The story is well told and the characters are likable. It is a great movie to watch for those who love movies. My only complaint is that there is very little nudity in this film. I would love to see more of this type of movie in the future.,2.7172785,5.810520322820555
cnp_2,"... in fact it was a great movie, and the actors were excellent as well. I highly recommend this movie to anyone who wants to see some of the best cinema of all time. A must-see for any horror fan.",2.8536723,5.810520322820555
cnp_2,"... the story is very well developed and the characters are likable and believable. The acting is top notch and it's an excellent film to watch with friends, family, and loved ones. A must-see for any fan of Sci-Fi/Fantasy/Horror/Drama. 8 out of 10. I highly recommend this movie to all Sci Fi fans.",2.90209,5.810520322820555
cnp_2,"... and a lot of the characters are really, really annoying. The animation is so bad that you can almost hear the dialogs in the background. It's hard to tell which character is who, because they all seem to be doing something stupid with their voices. I didn't like the movie at all, but it was fun to watch.",-2.0679705,5.810520322820555
cnp_2,"... and that's it.<span class=""redactor"" data-url=""http://www.myspace.",-0.13990378,5.810520322820555
cnp_2,"... of course, is that the story is based on a real-life story of a young girl who falls in love with her older brother. The film begins innocently enough, with the teenage daughter (played by Jennifer Aniston) having sex with a man she met in high school and then goes to work for a major construction company. As a result, she has a falling out with one of her father's bosses and decides to have an affair with him. However, this is only the beginning of the film's convoluted plot, as the relationship between the two leads becomes increasingly confusing as well.<references removed]The film opens with Ms. Anise, a middle-aged woman, and her boyfriend, William (Michael Cimino), who works at a construction firm. She invites him over to her apartment and shows him some of his old photos of people.",-1.0109853,5.810520322820555
cnp_2,"... I just saw this movie in the theater when I was about nine years old and it really surprised me. It's very funny and fun to watch. The acting is great, the story is well told, and the cinematography is top-notch. All in all, a must-see for any fan of science fiction or sci-fi. This movie is definitely one of my favorite movies of all time. I highly recommend it to anyone who loves Sci-Fi, Science Fiction, Fantasy, Horror, Thriller, Mystery, Suspense, Drama, Comedy, Romance, Sci Fi, Crime, Sports, Humor, Adventure, Film, Music, Poetry, Art, Maths, History, Acting, Photography, Video Games, etc.",2.8580036,5.810520322820555
cnp_2,"... ""The Evil Dead"" isn't exactly one of my favorite movies of all time, but I think it did a good job as a movie. This is the first time that I've watched this movie in a long time. The characters are very likable and the story is well told. Some of the jokes are funny and some of them are great. Overall, this film is a must-see for fans of horror movies and Sci-Fi. If you haven't seen it yet, watch it with your friends and/or family. I highly recommend this to anyone who enjoys watching scary movies or Sci Fi. My rating: 8 out of 10.",2.7560613,5.810520322820555
cnp_2,"... and that's about it.<p><span class=""separator"" align=""right"" text-align=""center""><ul><li><a href=""http://www.youtube.com/watch?feature=player_embedded&v=1ZT7KXz0qg&feature_id=976"" target=""_blank""><img src="" http://i.imgur.blogspot.co.uk/2009/06/14/the_hero_of_the_.",0.100251585,5.810520322820555
cnp_2,"... and if you haven't seen the film, check it out. This is one of my all time favorite films of all times. It is a true classic in cinema history. The acting is top-notch and the story is full of twists and turns that have never been seen before. I highly recommend this film to anyone who wants to see a great film about love, friendship, and family. If you are a fan of classical music then this is for you. Thank you so much for watching this wonderful film.",2.9066792,5.810520322820555
cnp_2,... this is one of the best films I have ever seen. The acting is top notch and the direction is superb. I highly recommend this film to anyone who wants to see a good horror film. It's a must-see for all horror fans.,2.8916836,5.810520322820555
cnp_2,"... and the music is very good. I recommend this film to anyone who is looking for a great movie of the 80's and 90's. A must-see for any fan of rock & roll.<b><span style=""color: rgb(50, 100, 200, 300)"" href=""http://www.youtube.com/watch?v=jTdRXZJg-Q"" target=""_blank""><p><a href=""#"" class=""sw"" rel=""nofollow""><img src=""https://media.video-cdn.",2.577142,5.810520322820555
cnp_2,"... The film begins with the arrival of a group of young women, one of whom is to be their guide. She is introduced to an older woman who has become pregnant and is staying at the house for the evening. One of the younger women introduces her to the old woman and they begin to talk. After a while, the two young men begin dating and the young woman begins to date the older man. Eventually, they are attracted to each other and make love. Soon, it is revealed that the relationship is not only romantic but also extremely incestuous. This makes the film even more shocking when the mother of this young girl discovers that she is pregnant with her own child. The father of both the parents are arrested and charged with murder. However, there is no trial and no guilty verdicts are made. On the way to prison, he is captured by the police and taken to a nearby lake where his wife is held captive.",-0.07000502,5.810520322820555
cnp_2,".... It's also worth noting that this film is based on a novel by the same author, and the screenplay is written and directed by David Boreanaz. I think it's a must-see for anyone who wants to know more about Korean culture and history.",2.4959147,5.810520322820555
cnp_2,".... It's not the best movie that I've ever seen, but it is one of my all-time favorites. If you have any questions about this movie, feel free to email me at scott@globeandmail.com.",2.6424847,5.810520322820555
cnp_2,"... I know that there are lots of people out there who do NOT agree with this film. I have watched it many times, and am amazed by the quality of the acting, direction, writing, cinematography, music, photography, editing, special effects, etc. It is one of my all time favorite films of all-time. The fact that it is nominated for an Academy Award for Best Picture makes it a must-see for anyone who is a fan of horror/thriller/sci-fi/horror/comedy/gothic/mystery/cinematography/art/etc. That is why I love it so much. This movie is definitely one to look forward to watching again and again.",2.8156614,5.810520322820555
