experiment,sample,reward,diversity
js_4,"... the acting is good, the cinematography is great, and the special effects are good. I highly recommend this movie to anyone looking for a fun, family-friendly horror flick. This is one of my all-time favorite films of all time. If you're looking to see if you can make it to Halloween, then this is the film for you.<3/10 from 4 out of 10.",2.6898854,5.342832621038868
js_4,"... I have to wonder what was the purpose of all this. There were some very interesting moments, but it wasn't a great movie. The characters were well-developed and the acting was good. Overall, a very enjoyable movie with lots of laughs and a lot of action. 8 out of 10. 4/10.",2.1332226,5.342832621038868
js_4,"... in the same way that they had done with ""The Sixth Sense"" and ""X-Men: The Last Stand"". <b><a href=3D""http://www.netflix.com/browse/genre/3740"" target=_blank><img src= ""http;"" alt= ""_http%3A%2F%1Fwww.<p><b>This is one of the better movies I have ever seen. The cinematography is superb, the acting is top-notch, and the special effects are top notch. This is a must-see for fans of all ages. <c><span class=4><strong>7 out of 10 stars.",2.6971781,5.342832621038868
js_4,"... a lot of the time it wasn't very good but it didn't detract from the rest of its cast. The acting was good, the special effects were good and the characters were likable. There were a few twists and turns that kept you on your toes. Overall, a must see for fans of sci-fi, fantasy, horror, sci fi, action/adventure, comedy, drama, science fiction, romance, mystery, steampunk, adventure, Sci-Fi, Fantasy, Science Fiction, Horror, Thriller, Action, Adventure, Comedy, Drama, Mystery, Suspense, Humor, Romance, Spoilers, etc.<citation needed] <a href=""http://www.netflix.com/browse/genre/8"" target=""_blank""><img class=""styles__noscript__2rw2y"" src=""https://dsx.weather.co.uk/util/image/widescreen/bg.",2.1915278,5.342832621038868
js_4,"... and there's not much of a plot. It's just a bunch of people living in the same house at the time. This movie tries to be funny, but fails miserably. The script is terrible, the acting is awful, and the special effects are terrible. All in all, a waste of your time and money. Don't waste your money on this movie. If you haven't seen it yet, you'll probably love it. Otherwise, don't bother with it unless you're a fan of Stephen King's books. There are certainly better movies out there than this one. I highly recommend it to anyone who wants to see a good laugh out loud comedy. 8 out of 10. 9/10.",-2.6676948,5.342832621038868
js_4,"... to put it mildly, this film is about a group of people who go to the dentist in hopes of finding a cure for a mysterious disease. Unfortunately, there's no cure at all. The main character is a woman who has lost her husband and is trying to get rid of her abusive husband so she can take care of herself. She eventually decides to take on the role of a doctor, and soon finds out that she hasn't been able to find a solution to her problems. This movie is one of the best I've seen in a long time. It's filled with beautiful cinematography, stunning cinematographic photography, great acting, superb special effects, fantastic special effect design, wonderful music, suspense, action, humor, romance, comedy, horror, sci-fi, fantasy, science-fiction, etc. There aren't a lot of weaknesses in this movie, but it's definitely one worth checking out. 4 out of 10. 8/10.",2.8263426,5.342832621038868
js_4,"... to say the least. This is one of those movies that you should check out if you are new to the genre, but don't expect too much from it. The acting is good, the cinematography is excellent, and the special effects are very good. All in all, this is a must-see for all fans of sci-fi, fantasy, horror, comedy, science fiction, romance, adventure, drama, action, mystery, thriller, thrillers, etc. I highly recommend this movie to anyone who enjoys Sci-Fi, Fantasy, Horror, Science Fiction, Thriller, Adventure, Mystery, Suspense, Comedy, Drama, Romance, Sci Fi, Dramatica, Action/Adventure, Martial Arts, Kung Fu, Wrestling, Football, Basketball, Gymnastics, Math, Physics, Astronomy, History, Mathematics, Music, & more.",2.7915525,5.342832621038868
js_4,"... I have never heard of this film before, but I was pleasantly surprised at how good it was.<b /><a href=""http://www.imdb.com/title/tt004447/"" target=""_blank""><img class=""styles__noscript__2rw2y"" src=""https://dsx.weather.co.uk/util/image/widescreen/bg.jpeg?v=at&w=485&h=273&api=7db9fe61-7414-47b5-9871-e17d87b8b6a0"" / >I think this is one of the best films ever made. The acting is top-notch and the cinematography is superb. This is a must-see for any horror fan.",2.7445138,5.342832621038868
js_4,"..., it is a beautiful film. I recommend it to anyone interested in the history and culture of the United States. It is one of my all-time favorite movies of all time. If you are looking for a romantic comedy then this is the film for you. The cast is great, the story is well thought out, and the acting is top notch. Highly recommended. 8 out of 10. <p><a href=""http://www.imdb.com/title/tt003906/"" target=""_blank""><img class=""styles__noscript__2rw2y"" src=""https://dsx.weather.co.uk/util/image/widescreen/bg.",2.8737254,5.342832621038868
js_4,"..., but if you want to see a good movie with lots of action, suspense, comedy, romance, drama, mystery, sci-fi, fantasy, science fiction, horror, adventure, etc., then this is the film for you. This is one of the best movies I've ever seen, and I highly recommend it to anyone who loves action/thriller movies or sci fi. The acting is pretty good, the cinematography is good (and the special effects are superb), and the story is well told. It's a must-see for fans of all ages. 4 out of 10. 9/10.",2.8734045,5.342832621038868
js_4,".... There are so many great moments that make this film a must-see for any fan of the genre. The acting is top-notch, the direction is good, and the cinematography is stunning. This is one of those films that will keep you glued to the screen for hours on end. If you haven't seen it yet, check it out.<p><a href=""http://www.youtube.com/watch?v=hVQX2iW4wg"" target=""_blank""><img class=""styles__noscript__2rw2y"" src=""https://dsx.weather.co.uk/util/image/widescreen/bg.jpeg"" alt="""" />A must see for fans of all ages.",2.7548828,5.342832621038868
js_4,"... I don't know why, but it was very good. The acting was good, the story was realistic, and the special effects were very well done. I highly recommend this movie to anyone who enjoys a good sci-fi/horror movie. If you are a fan of Sci-Fi/Horror, then this is the movie for you. This is a must-see for all Sci Fi fans. 10 out of 10.",2.819825,5.342832621038868
js_4,"..., but it does have some nice moments. It's a lot of fun to watch, and the acting is top-notch. Overall, I highly recommend this film to anyone looking for a good romantic comedy with a great storyline. If you're looking to see if your looking at a classic or not, then this is the film for you. Do yourself a favor and check it out. 4 out of 10.",2.7089784,5.342832621038868
js_4,"... for the most part, it's pretty good. The acting is very good, the plot is well written, and the cinematography is top notch. If you're looking for a fun movie that will keep you entertained throughout the day, then this is the movie for you. I highly recommend this movie to everyone. 8 out of 10. 9/10.",2.7969933,5.342832621038868
js_4,"... I don't think there's anything wrong with it. It's fun to watch, and the acting is great. I highly recommend it to anyone who enjoys Sci-Fi. If you're a Sci Fi fan, this is a must-see. You'll love it! 5 out of 10. 8/10.",2.8599744,5.342832621038868
js_4,"... a very good film with lots of action, suspense, comedy, drama, tragedy, romance, horror, adventure, sci-fi, fantasy, science fiction, etc. It is definitely one of my favorite movies of all time. I highly recommend it to anyone who loves action/thriller/sci-fantasy/horror/comedy/drama/mystery/action/suspense/adventure/etc. This is an excellent film for all ages. Highly recommended. 4 out of 10.",2.894398,5.342832621038868
js_4,"..., but it is well worth the price of admission. The acting is top-notch, and the directing is one of the best I've seen in a long time. Overall, a must-see for anyone looking for a good old-fashioned action/thriller. 8 out of 10. 9/10.",2.8191006,5.342832621038868
js_4,"... the movie is very funny, it has a lot of humor and a good cast. I would recommend this movie to anyone who enjoys comedy, drama, sci-fi, horror, comedy or any other genre. It is a must see for fans of all ages. 8 out of 10.",2.755973,5.342832621038868
js_4,"... the acting is excellent, the direction is good, and the cinematography is top-notch. If you are looking for a great romantic comedy, then this movie is for you. <b /><a href=""http://www.imdb.com/title/tt012279"" target=""_blank""><img src=""https://dsx.weather.co.uk/widgets/widescreen/bg.min.jpg?v=at&w=485&h=273&api=7db9fe61-7414-47b5-9871-e17d87b8b6a0"" / >Truly a must see for fans of all ages.",2.701495,5.342832621038868
js_4,"... The acting is superb, the direction is good, and the cinematography is excellent. If you are looking for a fun, action packed sci-fi movie, then this is the movie for you.<4/10 from 1 out of 10.",2.6267853,5.342832621038868
js_4,".... This is the kind of film that has you waiting for the right time to laugh or cry. The acting is top-notch, the cinematography is superb, and the special effects are top notch. If you're looking for a good comedy, this is it. Don't miss it! 4 out of 10. 8/10.",2.6449404,5.342832621038868
js_4,"... the movie is one of the best I have ever seen. It has a very good story, a good cast, and a great ending. I highly recommend this movie to anyone who wants to see something different. If you are looking for a low-budget action/thriller, or just want to get some laughs, then this is the film for you. 7 out of 10. 8/10.",2.8366625,5.342832621038868
js_4,".... The movie is one of the best I have ever seen and it is a must-see for all fans of science fiction, fantasy, horror, sci-fi, drama, comedy, romance, adventure, mystery, thriller, thrillers, etc. If you are a fan of Sci-Fi, Fantasy, Horror, Thriller, Adventure, Mystery, Science Fiction, Romance, Sci Fi, or any other genre, then this is the movie for you. I highly recommend it to all Sci fi fans out there! <b /><a href=""http://www.netflix.com/browse/genre/10"" target=""_blank""><img class=""styles__noscript__2rw2y"" src=""https://dsx.weather.co.uk/util/image/widescreen/bg.",2.730063,5.342832621038868
js_4,"... I think it was a great movie. The acting was top-notch, the cinematography was good, and the special effects were top notch. I highly recommend this movie to anyone who wants to see a good sci-fi movie with action, suspense, humor, romance, science fiction, horror, comedy, fantasy, sci fi, or any other genre. This is one of my all-time favorite movies of all time. 4 out of 10.",2.8141787,5.342832621038868
js_4,"..., but it was pretty good. The cinematography was top-notch, and the acting was very good as well. I recommend this film to anyone who is a fan of any of the films in the genre. If you're looking for a great movie that makes you want to see more movies, then this is the film for you. It has tons of action, comedy, drama, romance, sci-fi, fantasy, horror, science fiction, etc. You'll love it! 4 out of 10. 8/10.",2.705548,5.342832621038868
js_4,"... The story is very well written, the cinematography is excellent, and the special effects are very good. The acting is top-notch as well, as is the direction. I highly recommend this film to anyone looking for a great sci-fi/horror flick. A must-see for fans of Sci-Fi, Horror, Thriller, Fantasy, Sci Fi, Mystery, Science Fiction, Romance, Comedy, Drama, etc. This is a must see for all Sci fi fans out there. 4 out of 10.",2.8525817,5.342832621038868
js_4,"... The movie is very well made and the characters are believable. The story is well written and there are a lot of twists and turns throughout the movie. Overall, a must see for all fans of the series. I highly recommend this movie to any fan of Sci-Fi, Fantasy, Horror, Thriller, Sci Channel, or any other Sci Fi channel. A must-see for any Sci fi fan. 4 out of 10. 9/10.",2.871522,5.342832621038868
js_4,"... of this film. It's a great movie to see if you're a fan of the series or not, but it does have a lot going for it. The cast is good, the acting is top notch, and the special effects are top-notch. I highly recommend this one to anyone who wants to know more about the characters in this series. If you haven't seen it yet, don't miss it! 4 out of 10. 8/10.",2.6126392,5.342832621038868
js_4,"... for the most part.<b /><a href=""http://www.netflix.com/browse/genre/4"" target=""_blank""><img src=""https://media.w3.org/1999/10/22/movies/films/film-of-the-week.svg"" alt=""Movies of the Week"" title=""Films of The Week (1)"" />Directed, Produced, Edited, Directed By, and Directing by:<a rel=""nofollow"" class=""external link"" href=""#"" onclick=""return title=""http%3A%2F%02Fwww.",-0.32737717,5.342832621038868
js_4,"... I don't know if it's because of the movie, but it is one of my all time favorite movies of all-time! It's fun to watch, and has a good cast. The acting is great, the story is well thought out, there are lots of twists and turns, which makes it an enjoyable movie.",2.8690438,5.342832621038868
js_4,"... and there is so much going on in this movie that makes you want to see more of it. The acting is great, the cinematography is superb, and the special effects are very good. This is one of my favorite movies of all-time. It's a must-see for any fan of martial arts, fantasy, horror, sci-fi, comedy, science fiction, romance, or any other genre. If you're looking for a well-acted action movie, then this is the movie for you. I highly recommend it! 9 out of 10.",2.8374314,5.342832621038868
js_4,"... I have to say, this is one of my favorite films of all time. The acting was outstanding, the cinematography was top-notch, and the special effects were superb. This is a must-see for all fans of sci-fi, fantasy, science fiction, horror, action, comedy, drama, romance, mystery, suspense, etc. All in all, an absolute must see for anyone interested in Sci-Fi, Fantasy, Horror, Science Fiction, Thriller, Adventure, Mystery, Action, Comedy, Romance, Sci/Fi.",2.8971667,5.342832621038868
js_4,"... I just saw this movie on DVD and was blown away by it. The acting is top-notch, the cinematography is excellent, and the special effects are superb. I highly recommend this film to anyone who enjoys great action, drama, comedy, romance, thrillers, sci-fi, fantasy, horror, or any other genre. This is a must-see for all Sci-Fi fans. 9 out of 10.",2.8361688,5.342832621038868
js_4,".... This movie is a must-see for fans of all ages. It has everything you need to know about the 70's, 80's and 90's.<b /><a href=""http://www.imdb.com/title/tt003723/"" rel=""nofollow"" title=""movie"" />The acting is top-notch, the story is well thought out, and the cinematography is superb. I highly recommend this movie to anyone looking for a great 1970's horror movie. A must see for any fan of the 60s, 70s and 80s.",2.849062,5.342832621038868
js_4,"... and I think this is one of the best movies I have ever seen. The acting is top-notch, the cinematography is stunning, and the special effects are top notch. This is a must-see for all fans of sci-fi/horror/sci-fantasy/thriller fans. Highly recommended. 4 out of 10.",2.8955986,5.342832621038868
js_4,"... and you know what? It's not even that great.<b /><strong><a href=""http://www.netflix.com/browse/genre/4"" target=""_blank""><img class=""styles__noscript__2rw2y"" src=""https://dsx.weather.co.uk/util/image/widescreen/bg.jpg?v=at&w=485&h=273&api=7db9fe61-7414-47b5-9871-e17d87b8b6a0"" /]<url=http%3A%2F%1Fwww.",-0.6304968,5.342832621038868
js_4,"... for the most part, it's very well done, and the acting is top notch. The special effects are superb, as is the cinematography. I highly recommend this film to anyone interested in seeing a good action film. If you're looking for a great action movie, then this is definitely the film for you. You won't be disappointed. 10 out of 10.",2.8013148,5.342832621038868
js_4,"... and the acting is excellent. However, if you are looking for a film that will leave you with a smile on your face, then this is the film for you! The cinematography is top-notch, the music is good, and there are plenty of memorable moments. If you have never seen a movie before, don't miss this one! It is a must-see for fans of all ages. 7 out of 10. 9/10.",2.7850084,5.342832621038868
js_4,"... the music is OK, the acting is good, and the cinematography is top-notch. Overall, a must-see for all fans of horror flicks. 7 out of 10.",2.6982317,5.342832621038868
js_4,"... in a nutshell. It's a great film, well made and well acted. This is one of the best films I've ever seen. The acting is top notch, the cinematography is excellent and the special effects are superb. I highly recommend this film to anyone looking for a good romantic comedy. Don't miss it. 8 out of 10.",2.8714824,5.342832621038868
js_4,"..., it's definitely worth checking out if you're a fan of the series. The special effects were very good and the characters were well developed. It's easy to see why this was one of my all-time favorites. I highly recommend this series to anyone who enjoys action, adventure, sci-fi, horror, comedy, romance, science fiction, fantasy, mystery, or any other genre. This is a must-see for fans of all ages. 8 out of 10.",2.836211,5.342832621038868
js_4,"... I thought the movie was great and it had a lot going for it. The acting was good, the cinematography was top-notch, and the special effects were fantastic. Overall, I highly recommend this movie to anyone who likes action movies, thrillers, sci-fi, horror, drama, comedy, romance, science fiction, fantasy, or anything in between. If you're looking for an action/thriller that's fun to watch, then this is the film for you. This is a must-see for fans of all ages. 9 out of 10.",2.7937481,5.342832621038868
js_4,"... of course the acting is good, the cinematography is great and the special effects are superb.<b /><a href=""http://www.youtube.com/watch?v=8L-X6i2jQtI"" target=""_blank""><img class=""styles__noscript__2rw2y"" src=""https://dsx.weather.co.uk/util/image/widescreen/bg.",2.2211034,5.342832621038868
js_4,"... in a way that makes you want to scream at the top of your lungs.<b /><strong><a href=""http://www.youtube.com/watch?v=h-o-UwQkCg8"" target=""_blank""><img class=""styles__noscript__2rw2y"" src=""https://dsx.weather.co.uk/util/image/widescreen/bg.",0.09011152,5.342832621038868
js_4,"... I have to say, it was a great movie.<4/10] 10 out of 10. This is one of my all-time favorite movies of all time. It is a must see for all fans of sci-fi, fantasy, horror, comedy, romance, adventure, mystery, drama, science fiction, or anything in between. I highly recommend this movie to all Sci-Fi fans. If you are looking for a good Sci Fi movie, then this is the movie for you. You will not be disappointed.",2.8383198,5.342832621038868
js_4,"..., and that's saying a lot.<citation needed] <cite web]<url=http://www.independent.co.uk/news/uk-middle-east/americas/murders-suspects-kidnapped-in-west-asia/story.",1.2316275,5.342832621038868
js_4,"... and it's so much fun to watch. I'm a huge fan of the show, and have seen it countless times, but this is my favorite show of all time. It's one of my all-time favorite shows, with tons of laughs and hilarious moments. If you haven't seen the series yet, check it out. You'll be laughing so hard you won't forget it! I highly recommend this show to anyone who enjoys humor, drama, comedy, romance, science fiction, horror, sci-fi, fantasy, adventure, or any other genre. Plus, if you've never heard of it before, you'll love it. 9/10. 8 out of 10.",2.8177962,5.342832621038868
js_4,"... I found this movie to be very entertaining. There was a lot of humor in the story and there were some interesting twists and turns. The acting was excellent and the special effects were very good. Overall, a must-see for any fan of sci-fi or fantasy. 8 out of 10.",2.6890466,5.342832621038868
js_4,"... I don't know about you, but I think there are a lot of people out there who would like to see this movie. This is a great movie for kids and adults alike. The acting is top-notch, the cinematography is good, and the special effects are top notch. I highly recommend this film to anyone who wants to get into acting. It is one of my all-time favorite movies of all time. If you're looking for a fun movie to watch on a Saturday afternoon, then this is the movie that you should definitely check out. You won't be disappointed. 8 out of 10.",2.7887282,5.342832621038868
js_4,"... in the middle of a rainstorm. The scenery is beautiful, the cinematography is great, and the story is well thought out. I give this a 9 out of 10. 8 out 10.<a href=""http://www.imdb.com/title/tt173871/"" target=""_blank""><img class=""styles__noscript__2rw2y"" src=""https://dsx.weather.co.uk/util/image/widescreen/bg.jpg?v=at&w=485&h=273&api=7db9fe61-7414-47b5-9871-e17d87b8b6a0"" /><p lang=""en"" dir=""ltr"" >The film is very well acted, with plenty of action scenes, lots of twists and turns along the way. This is definitely one of the best romantic comedies ever made.",2.7484174,5.342832621038868
js_4,".... This movie could be one of the best movies I have seen in a long time. The acting is top-notch, the cinematography is superb, and the special effects are superb. You won't be disappointed with this movie. If you are looking for a great Sci-Fi movie, this is the movie for you. However, if you're looking to see how to make your own sci-fi movie (or TV show), this might be the right movie to check out. 4 out of 10. 9/10.",2.586034,5.342832621038868
js_4,"... in a weird way. I didn't really like it, but it was good. It had some of the best acting I've seen in awhile, and the special effects were pretty good too. The music was quite good, too, as was the acting. Overall, a must-see for fans of all ages. 7 out of 10. 4/10.",2.7575572,5.342832621038868
js_4,".... It's one of those movies that makes you think twice before you sit through it. The acting is good, the cinematography is superb, and the special effects are top-notch. This is a must-see movie for all sci-fi fans. 8 out of 10.",2.8155515,5.342832621038868
js_4,"... and that's about it. The acting is good, the cinematography is top-notch, and the story is very well told. I highly recommend this movie to anyone who enjoys suspenseful thrillers, sci-fi, horror, comedy, fantasy, science fiction, drama, etc. This is a must-see for fans of all genres. 8 out of 10.",2.8571992,5.342832621038868
js_4,"... the acting was good, the direction was OK, and the story was well written. I highly recommend this movie to anyone who enjoys suspense, mystery, action, comedy, romance, horror, sci-fi, fantasy, science fiction, or anything in between. 4 out of 10.",2.5145822,5.342832621038868
js_4,"... and it's one of those movies where you just have to sit back and watch it. It's a very good movie, and I highly recommend it to anyone who enjoys sci-fi, fantasy, horror, comedy, drama, romance, science fiction, or anything in between. Highly recommended. 8 out of 10.",2.854788,5.342832621038868
js_4,"... and I don't think it's a bad movie at all. It has a lot of action, lots of blood, gore, explosions, sex, humor, suspense, romance, comedy, drama, horror, sci-fi, fantasy, science fiction, etc. The acting is pretty good, the special effects are decent, and the cinematography is excellent. Overall, this is one of the best Sci-Fi/Horror movies of all time. 9 out of 10. Recommended for fans of Sci Fi, Horror, Fantasy, Science Fiction, Mystery, Thriller, Action, Adventure, Romance, Sci Channel, TV Show, Movie, Comedy, Drama, Dramatic, Humor, Suspense, Surrealism, Violence, Sex, Language, Religion, Sexuality, Social Class, Genre(s),<p><a href=""http://www.netflix.",2.6785102,5.342832621038868
js_4,"... to be honest, I wasn't expecting much in the way of action, but that doesn't mean I didn't enjoy it. The story is well written, and the cinematography is superb. I highly recommend this movie to anyone interested in martial arts or martial art history. If you are a fan of martial artists, then this is the movie for you. It is a must see for fans of all ages. 8 out of 10.",2.7771811,5.342832621038868
js_4,"... the acting is excellent, and the special effects are superb. I recommend this film to any fan of the original series. If you haven't seen it, don't miss it. It's one of my all-time favorite shows, as well as one that should be on everyone's wish list. Check it out! 9 out of 10.",2.7635849,5.342832621038868
js_4,"... to be honest I'm a big fan of this film. It is one of my all-time favorite movies of all time and it really captures the essence of what it is all about. The acting is good, the cinematography is top-notch, and the special effects are outstanding. If you haven't seen the movie yet, give it a look and you won't be disappointed. I highly recommend this movie to anyone who wants to see a great romantic comedy. This is a must-see for any fans of the genre. 7 out of 10.",2.8604472,5.342832621038868
js_4,"... I saw this movie a year and a half ago, and it still stands up today. The acting is top-notch, the cinematography is stunning, but the special effects are top notch. It's one of my all-time favorite movies of all time. A must see for anyone who enjoys sci-fi, fantasy, action, horror, comedy, romance, drama, mystery, suspense, adventure, thrillers, etc. This is a must-see for any Sci-Fi fan.",2.8330398,5.342832621038868
