experiment,sample,reward,diversity
js_4,"... in addition to being a great film, this is also one of my all-time favorite movies. The acting is top-notch, the cinematography is superb, and the special effects are fantastic. This is a must-see for any fan of the genre. 7 out of 10. 9/10.",2.8793645,5.342832621038868
js_4,".... The story is one of the best I've seen in a long time. There are so many twists and turns throughout the movie that make it worth watching every time you sit through it. If you haven't seen it yet, be sure to check it out. It's a must-see for anyone who enjoys sci-fi and fantasy. 8 out of 10.",2.8419363,5.342832621038868
js_4,"... the acting is good, the writing is very good and some of the characters are likable. There is a lot to like about this film. This is one of my all time favorite movies of all-time. I highly recommend it to any fan of sci-fi, fantasy, horror, comedy, romance, sci fi, science fiction, drama, etc. If you're looking for a good Sci-Fi/Fantasy movie, then this is the movie for you. The special effects are top-notch and the cinematography is top notch.",2.7218952,5.342832621038868
js_4,"... in this film there's a lot of character development and a good deal of humor. The acting is excellent, the cinematography is top-notch, and the special effects are superb. I highly recommend this movie to anyone looking for a great romantic comedy with some of the best camera work I've ever seen. 10 out of 10.",2.8398128,5.342832621038868
js_4,"... the acting was average and the direction was good, the cinematography was excellent, and especially the special effects were very good. Overall I highly recommend this film to anyone looking for a well-acted comedy with a good story, great cinematographic style, suspense, action, comedy, drama, romance, sci-fi, fantasy, science fiction, horror, or any other genre. It is definitely one of my all-time favorite comedies of all time. 8 out of 10.",2.7731116,5.342832621038868
js_4,"... it's so good and the acting is top notch. The story is very well written and with great cinematography. I highly recommend this movie to anyone looking for a fun, action packed movie that will keep you on the edge of your seat all day long. 4 out of 10.",2.8349323,5.342832621038868
js_4,"... and I loved it. The acting was top notch, the special effects were superb, and the cinematography was superb. This is one of my all-time favorites. 8 out of 10.",2.913278,5.342832621038868
js_4,".... This movie is a must see for any fan of the genre. The acting is excellent, the cinematography is top-notch, and the special effects are superb. I highly recommend this movie to anyone who likes action, suspense, comedy, romance, sci-fi, horror, fantasy, science fiction, or anything in between. A must-see for fans of all ages. 7 out of 10.",2.884984,5.342832621038868
js_4,"... the story is very well done and it has a lot of twists and turns. The acting is good, the cinematography is excellent, and the music is great. Overall, a must see for any fan of the genre. I highly recommend this movie to anyone who enjoys action thrillers, sci-fi, horror, comedy, romance, fantasy, science-fiction, or anything in between. 7 out of 10.",2.8456898,5.342832621038868
js_4,".... <b /><span style=""font-size: 12px; line-height: 1.5em; text-align: center; letter-spacing: normal; font-weight: bold; color: #fff; background-image: url(""http://www.w3.org/1999/xhtml2/loose.xls""); border-color: transparent; padding: 2em 4em 3em 2.75em 0pt; border:1px solid #ccc solid rgba(0,0,-0.4,1.",-0.60878867,5.342832621038868
js_4,"... The story is well written, the acting is good, and the characters are likable. I recommend this movie to anyone who enjoys action, adventure, comedy, drama, sci-fi, fantasy, horror, science fiction, romance, suspense, mystery, or any other genre.",2.7003753,5.342832621038868
js_4,".... It's hard not to love this film. The acting is top-notch, the writing is superb, and the special effects are top notch. I highly recommend this movie to anyone who enjoys action movies, sci-fi, fantasy, horror, comedy, romance, or anything in between. 10 out of 10. <p><a href=""http://www.netflix.com/browse/genre/3?search_query=film&view_url=http%3A%2F%22films%21&sort_by_genre&language=en"" target=""_blank""><img class=""styles__noscript__2rw2y"" src=""https://dsx.weather.co.uk/util/image/widescreen/bg.",2.590899,5.342832621038868
js_4,"... I think there are a lot of differences between the two movies. The story is very different, but the cinematography is excellent and the acting is top-notch. There are also some good moments in this movie. Overall, I highly recommend this film to anyone looking for a great romantic comedy. I would definitely recommend it to any fan of the genre. 4 out of 10. 8/10.",2.677709,5.342832621038868
js_4,"... and it was very well done. The acting was excellent and the cinematography was superb. I highly recommend this movie to anyone who is looking for a good, suspenseful thriller. If you haven't seen it yet, check it out. It has some of the best action scenes I've seen in a long time. This movie is one of my all-time favorite movies of all time, and I give it 8/10. You won't be disappointed. 4 out of 10.",2.8595567,5.342832621038868
js_4,"... of course it's a remake of the original film and is much better. The cinematography is excellent and the special effects are quite good. This is one of my all-time favorite movies of all time. I highly recommend this movie to anyone looking for a great movie that will make you want to see more of your favorite characters. If you haven't seen it yet, check it out. It's worth a look if you like action, horror, comedy, sci-fi, fantasy, romance, suspense, mystery, science fiction, or anything in between. 4 out of 10.",2.6863914,5.342832621038868
js_4,"... of the original. I have to say that this movie is one of my all-time favorite movies, and I highly recommend it to anyone who loves action movies. The acting is top-notch, the cinematography is excellent, especially the special effects are superb. Overall, a must-see for fans of action flicks. 9 out of 10. 8/10.",2.8814933,5.342832621038868
js_4,"... I was a huge fan of the original, and this is one of my all-time favorites. The acting is top-notch, the cinematography is superb, along with the music.",2.8677897,5.342832621038868
js_4,"... on the other hand, this movie is nothing more than a pile of crap. The acting is atrocious, the cinematography is terrible, and the direction is horrid at best. Overall, it's a complete waste of your time and money. Don't waste your hard earned money on this one. If you're looking for a low-budget sci-fi movie that's worth seeing, go ahead and check it out. This is a must-see for anyone interested in sci fi.",-2.4280922,5.342832621038868
js_4,"... the movie has a lot going for it, the acting is great, and the cinematography is top notch, this is a must-see for anyone who likes to see action movies. The special effects are top-notch, especially the CGI effects, which make this one of the best martial arts movies of all time. A must see for fans of action flicks, thrillers, sci-fi, horror, comedy, drama, fantasy, thriller, romance, mystery, adventure, science fiction, etc. If you haven't seen the film yet, check it out. 8 out of 10. 9/10.",2.8544075,5.342832621038868
js_4,"... and that's about it.<citation needed]<a href=""http://www.imdb.com/title/tt0066981/"" target=""_blank"" title=""movie_id"" style=""width:100%; height:570px;"" ><img class=""styles__noscript__2rw2y"" src=""https://dsx.weather.co.uk/util/image/widescreen/bg.jpg?v=at&w=485&h=273&api=7db9fe61-7414-47b5-9871-e17d87b8b6a0"" /><p lang=""en"" dir=""ltr"" > <a rel=""nofollow"" class = ""tagline"" href = http://forum.xda-developers.org/index.php?topic=339939.",-0.22525574,5.342832621038868
js_4,"...
I watched this movie because I really wanted to like it. It had a lot of laughs and was very funny. The acting was excellent and the special effects were great. Overall, this is one of my all-time favorite movies of all time. If you haven't seen it yet, make sure to check it out. I recommend it to anyone who likes comedy, romance, drama, sci-fi, horror, fantasy, science fiction, or any other genre. You will love it! 7 out of 10. 9/10.",2.763679,5.342832621038868
js_4,"... to say the least...<a href=""http://www.netflix.com/browse/genre/8"" target=""_blank""><img src=""https://static1.akamaihd.net/ajax/libs/movies/master/titles/English/Tales from the Legend of Zelda: Ocarina of Time"" alt="""" /><p><a class=""M"" title=""Tale of Tales"" href=""#"" />The Legend Of Zelda II: A Link to the Past (1999) <a title = ""TBA"" / >http.<a rel=""nofollow"" data-href="" http://archive.org/stream/DragonMagazine2/Accessory - Tales of the Ooze - 2nd Ed.",0.015654279,5.342832621038868
js_4,"... and that is one of the best parts of this movie. This movie is a must-see for any fan of all ages. The acting is good, the cinematography is excellent, and the story is well written. If you are looking for a romantic comedy, then this is the movie for you. You won't be disappointed. I highly recommend this film to anyone who loves romance, comedy or anything in between. 9 out of 10.",2.8516092,5.342832621038868
js_4,"... and this is the worst movie I've ever seen. The acting is terrible, the writing is bad, and the cinematography is atrocious. All in all, this movie is a total waste of your time and money. Don't waste your money on this one. If you're into bad movies, then this should be for you. However, if you are into good movies with good acting, direction, cinematography, special effects, music, story, etc., then don't miss this film.",-3.0186534,5.342832621038868
js_4,".... <b /><span style=""font-size: 12px; line-height: 1.25;"" text-align: center; font-weight: normal; letter-spacing: 2.5em; padding: 0.4em 3.0em}<a href=""http://en.wikipedia.org/wiki/Wiley_and_Kramer"" target=""_blank""><img class=""styles__noscript__2rw2y"" src=""https://dsx.weather.co.uk/util/image/widescreen?v=at&w=485&h=273&api=7db9fe61-7414-47b5-9871-e17d87b8b6a0"" frameborder=0 scrolling=no></iframe><embed src = ""httpswww.youtube.",-0.9380946,5.342832621038868
js_4,"... I really wanted to love this film, and I loved the characters and the way the story was told. I highly recommend this movie to anyone looking for a great family film. It is one of my all-time favorites! 4 out of 10. 8/10.",2.7543511,5.342832621038868
js_4,"... a very good film about a group of middle-aged men who meet up at a bar and start making fun of each other. The acting is good, the cinematography is excellent, and the special effects are quite good. This is one of my all-time favorite films of all time. I highly recommend it to anyone looking for a movie that will make you laugh, cry, be sad, or just have a good time.<citation needed] 7 out of 10.",2.80802,5.342832621038868
js_4,".... The acting is top-notch, and the special effects are excellent. Overall, I recommend this movie to anyone who likes action movies, thrillers, drama, sci-fi, horror, comedy, romance, fantasy, science fiction, or any other genre. It's a must-see for fans of Sci-Fi, Fantasy, Horror, Thriller, Action, Adventure, Sci Fi, Mystery, Science Fiction, etc.",2.7741632,5.342832621038868
js_4,"... I don't think it's going to be one of the best films of all time. The cinematography is top-notch, the acting is great, and the special effects are superb. This film is a must-see for anyone who wants to see a good sci-fi film. If you're a fan of science fiction, then this is the film for you. I highly recommend this film to anyone looking for a sci fi film that will satisfy fans of sci flicks. 8 out of 10. 9/10.",2.816554,5.342832621038868
js_4,"..., this movie is very funny. The acting is good and the cinematography is great. This is one of my all-time favorite movies. If you're looking for a laugh, then this is the movie for you. I highly recommend this film to anyone who enjoys comedy, drama, romance, sci-fi, fantasy, horror, comedy/thriller, special effects, action/adventure, adventure, science fiction, or any other genre. <b /><a href=""http://www.netflix.com/browse/genre/2"" target=""_blank""><img class=""styles__noscript__2rw2y"" src=""https://dsx.weather.co.uk/util/image/widescreen/bg.",2.68559,5.342832621038868
js_4,"..., this is definitely one of the better comedies i have seen in a long time. The jokes are very funny and the acting is very good. I highly recommend this show to anyone who wants to see a great comedy. If you haven't seen it yet, don't miss it. You won't regret it! 8 out of 10.",2.791229,5.342832621038868
js_4,"... of which the film is a masterpiece. The cinematography is superb, the acting is good, and the special effects are excellent. A must see for any fan of the genre. 4 out of 10.",2.870161,5.342832621038868
js_4,"... this is one of the best movies I have seen in a while. the acting is top notch and the cinematography is superb. it is a must see for anyone looking for a great movie to watch. you won't be disappointed with this movie. I highly recommend this film to anyone who is looking to find out what it's all about. if you are looking forward to seeing more than one movie at a time, don't miss this one.",2.8559127,5.342832621038868
js_4,"... in the beginning, it was a pretty good movie. The acting is top-notch, and the cinematography is excellent. Overall, a very good film. 10 out of 10. 9/10.",2.8021202,5.342832621038868
js_4,"... and it's a must see for all fans of the genre. The acting is top-notch, the cinematography is excellent, and the special effects are top notch. This is one of my all-time favorites of all time! I highly recommend this film to anyone looking for a great sci-fi action flick that will keep you watching over and over again. A must have for any Sci-Fi fan. 7 out of 10. 9/10.",2.8880258,5.342832621038868
js_4,"... to be honest, this movie wasn't that bad. The acting was excellent, the story was well thought out, and the special effects were very good. Overall, a must see for anyone who enjoys action thrillers. 8 out of 10.",2.55707,5.342832621038868
js_4,"... I thought it was very good. The acting was excellent, the direction was good, and the story was well told. I recommend this movie to anyone looking for a good romantic comedy. 4 out of 10.",2.6522648,5.342832621038868
js_4,"... and it's hilarious.<b /><a href=""http://www.netflix.com/browse/genre/11"" target=""_id"" title=""movie.m4v"" />It's a must see for all fans of the 80's, as well as anyone who grew up in the 90's or early 2000's.<citation needed] <a rel=""nofollow"" href=""#"" class=""external link"" type=""image/jpeg"" width=""100%"" height=""240px""></a><span style=""font-size:12px; line-height:1.5""><p class=3 align=center><img class = ""styles__noscript__2rw2y"" srcset= ""https://dsx.weather.co.uk/util/imageboard/widescreen/bg.",2.3388772,5.342832621038868
js_4,"...-<a href=""http://www.cbsnews.com"" target=""_blank""><img src=""//platform.twitter.net/widgets.head"" alt="""" />- <a style=""font-size:smaller;"" /><img class=""styles__noscript__2rw2y"" srcset=""https://dsx.weather.co.uk/util/image/widescreen/bg.jpg?v=at&w=485&h=273&api=7db9fe61-7414-47b5-9871-e17d87b8b6a0"" / >- [url=http%3A%2F%1Fwww.",-0.68016195,5.342832621038868
