experiment,sample,reward,diversity
js_9,"... a lot of it is about the characters and how they interact with each other. It's a good movie to see in a movie theater, especially if you haven't seen it yet. I highly recommend this movie for anyone looking for a great film to watch over and over again. The acting is top-notch, the special effects are superb, and the story is well told. This is one of my all-time favorite movies of all time. 7 out of 10.",2.856214,5.410453195001353
js_9,"... The acting was top-notch, the cinematography was superb, and the story line was well thought-out. I highly recommend this film to anyone interested in seeing some of Hollywood's best films. If you have never seen anything like it before, then you're in for a treat. 8 out of 10.",2.828029,5.410453195001353
js_9,".... The script is good, the acting is top-notch, and the special effects are outstanding. I highly recommend this film to anyone interested in seeing what it's like to be a teenager in the 1980s. If you haven't seen it yet, don't worry; you won't be disappointed.<p><span style=""color: rgb(216,216)"" src=""http://www.imdb.com/title/tt004439/""></span><div class=""swatch""><a href=""https://plus.google.co.uk/u/0/communities/1028485908369930"" target=""_blank"" width=""100%"" height=""240px""></a></div><script async srcset=""//platform.twitter.net/widgets.",2.2793512,5.410453195001353
js_9,".... The acting was excellent, the direction was good, and the special effects were very impressive. I highly recommend this movie to anyone looking for a great horror/thriller. If you're looking to see if you can make it to the big screen, then this is the movie for you. This is definitely one of my all-time favorite horror films. 9 out of 10.",2.7841735,5.410453195001353
js_9,"... in order to get the job done, you have to be a bit of a masochist. In this film, we see a lot of things that aren't supposed to happen, but are very realistic. For example, there's a woman who has an affair with another man, and she finds out that she is cheating on her boyfriend. Later, when she goes to find out what's going on, she falls in love with a man who is married to one of her friends, even though she doesn't know his name. Then there are the men who are involved in the affair. These men are portrayed as having some kind of relationship with each other, or at least trying to do so. There's also a scene where a young girl gets into an argument with one guy, while the other guy is sleeping with her. All in all, this is a very good film. I highly recommend this movie to anyone who likes to see realistic sex and relationships between men and women.",2.768702,5.410453195001353
js_9,"... the movie was very well made and the acting was superb. I highly recommend this movie to anyone looking for a good sci-fi horror movie. If you haven't seen it yet, you're in for one heck of a treat. 8 out of 10.",2.7625422,5.410453195001353
js_9,"... it's fun to watch. The acting is top-notch, the cinematography is outstanding, and the special effects are very well done. I highly recommend this film to anyone looking for a good horror flick. If you're looking to see if you can make it to the big screen, then this is the film for you. It's one of my all-time favorite horror films of all time. 10 out of 10.",2.7889411,5.410453195001353
js_9,"... the animation is very good and the story is well told. The acting is top-notch, the characters are likable, and some of the special effects are impressive. Overall, I highly recommend this film to anyone looking for a great sci-fi/horror/sci-fantasy movie. If you haven't seen it yet, check it out. It's definitely one of my all-time favorite movies of all time. 8 out of 10.",2.8072133,5.410453195001353
js_9,"... to be honest, I didn't expect much from this film at all. Sure, it's not a great film, but it does have a lot going for it. The acting is top-notch, the cinematography is well-done, and the special effects are top notch. All in all, this is one of my all-time favorite films of all time.",2.6323154,5.410453195001353
js_9,"... with the exception of the very first scene where it is revealed that the characters are actually going to be fighting each other in the future. Of course, this doesn't necessarily mean that there won't be some sort of fight, but it would probably be a good idea to have some kind of ""fight"" at some point along the way. The fight scenes are pretty well done, and the cinematography is also very good. Overall, if you haven't seen this film yet, you're in for a treat. I highly recommend this one to anyone interested in watching martial arts movies. It's definitely one of my all-time favorite movies of all time. If you've never seen it before, then you should definitely check it out. You'll be glad you did.",2.6690085,5.410453195001353
js_9,"... to me it is the best movie i have ever seen. If you are looking for a good movie to watch then this one is for you. The acting is top-notch, the cinematography is superb, and the script is well written. I highly recommend this film to anyone looking to see if they can make a great movie. It is definitely one of my all-time favorite movies of all time. 5 out of 10.",2.8579667,5.410453195001353
js_9,"... I don't know whether to believe it or not, but this movie is one of my all-time favorite movies of all time. The acting is top-notch, the story is well-told, and the characters are well developed. This is a must-see for any fan of horror, comedy, fantasy, sci-fi, action, adventure, mystery, thrillers, horror/thriller fans, or anyone looking for a great Sci-Fi/Horror movie.",2.8743346,5.410453195001353
js_9,"... for example, in one scene, I was thinking to myself, ""wow, what a great idea!"" Then the next day, my wife and I watched it again and again, and we all laughed out loud. This is one of my all-time favorite movies of all time. It's one that makes you laugh so hard that you can't help but think, wow, this could've been a very good movie.<a href=""http://www.imdb.com/title/tt003398"" target=""_blank""><img class=""styles__noscript__2rw2y"" srcset=""https://dsx.weather.co.uk/util/image/widescreen/background-image.",2.1361132,5.410453195001353
js_9,"... to give this movie a try. The acting is very good, the script is well written, and the cinematography is top-notch. It's definitely one of my all-time favorite movies of all time. 9 out of 10.",2.6715999,5.410453195001353
js_9,"... the movie is very well written and the acting is excellent. I would definitely recommend this movie to anyone who is looking for a good film to watch over and over again. If you have not seen it yet, then you will love it. This is one of my all time favorite movies of all-time.",2.834351,5.410453195001353
js_9,"... and I have to say that it's one of the funniest movies I've ever seen. It has a lot going for it, from the acting to the music to some of my favorite moments in the film. The story is very well told, with lots of twists and turns throughout the movie. There are a few moments where I found myself laughing out loud, like when they decide to take off all their clothes and go back to their room, or when the girls are trying to get away from a stranger. All in all, this is a must-see for anyone who enjoys comedy, romance, drama, action, horror, sci-fi, comedy/horror, thrillers, mystery/thriller, etc.",2.842008,5.410453195001353
js_9,".... This is one of my all-time favorite movies of all time. It has everything you would expect from a good sci-fi movie: suspense, action, comedy, romance, adventure, mystery, intrigue, fun, humor, drama, horror, thrillers, fantasy, sci fi, and more. I highly recommend this movie to anyone who loves Sci-Fi or Fantasy. <a href=""http://www.youtube.com/watch?v=i7Rn9k3wX2"" target=""_blank""><img class=""styles__noscript__2rw2y"" srcset=""https://dsx.weather.co.uk/util/image/w/f/d/e/snowglow-overlooks-at-the-star-of-thrill.",2.7153957,5.410453195001353
js_9,"... in fact, this is one of the best films I have ever seen.<p><b]Rating: *** out of ****<p>10/10<a href=""http://www.youtube.com/watch?v=Q3-w1iZqY8&feature=youtu.be"" target=""_blank""><img class=""styles__noscript__2rw2y"" srcset=""https://dsx.weather.co.uk/util/image/widescreen/background-image.jpg"" width=""100%"" height=""240px""></a><span class="""" style=""font-size:smaller;"" ><a rel=""nofollow"" class = ""external link"" href = ""#"" onclick=""window.open(this.href)"">Close</a></span><script type = 'text/javascript' src = ""'//platform.twitter.net/widgets.",1.8494606,5.410453195001353
js_9,".... The acting is very good and the script is well written. I highly recommend this movie to anyone interested in film making. If you haven't seen it yet, check it out. You won't be disappointed. 10/10.",2.6314769,5.410453195001353
js_9,"... to be honest, I didn't expect too much from this movie. The acting is good, the special effects are good and the story is very well told. All in all, a great film to watch for any fan of sci-fi or fantasy films. I highly recommend it to anyone looking for a good sci fi/horror movie to keep an eye out for. You won't be disappointed. 9 out of 10.",2.7788987,5.410453195001353
js_9,".... The acting was pretty good, and the story line was well thought out. However, if you're looking for something a little more dramatic than some of the other reviews I've read, then this is for you. There are a lot of things going on in this movie that make you want to watch it over and over again. For example, the cinematography is very good. It has a nice feel to it, with lots of colors and effects. Overall, this one is a must-see for all fans of horror movies. If you haven't seen it yet, check it out! I highly recommend this film to anyone interested in any kind of Sci-Fi/Horror movie. You won't be disappointed. 4 out of 10.",2.683278,5.410453195001353
js_9,".... The acting is top-notch, and the cinematography is superb. A must-see for anyone interested in film-making.<a href=""http://www.bbc.co.uk/news/uk-politics-in-south-africa-19530033"" target=""_blank""><img class=""styles__noscript__2rw2y"" srcset=""https://dsx.weather.com//util/image/w/moody-tide-overcast.",2.7024941,5.410453195001353
js_9,"... for the time being. It's a great movie, with a lot going for it. The acting is top-notch, and the special effects are breathtaking. I highly recommend this movie to anyone looking for a good sci-fi/horror flick. This is one of my all-time favorite movies of all time. If you haven't seen it yet, don't worry, you won't be disappointed. A must-see for fans of Sci-Fi, Fantasy, Horror, Thrillers, Action, Adventure, Comedy, Mystery, Romance, Sci Fi, Science Fiction, D&D, Role-Playing, RPG, etc. <a href=""http://www.netflix.com/browse/genre/1137"" target=""_blank""><img class=""styles__noscript__2rw2y"" srcset=""https://dsx.weather.co.uk/util/image/widescreen/background-image.",2.7628734,5.410453195001353
js_9,".... If you have never heard of this movie before, I highly recommend you do. The acting is top-notch, the cinematography is superb, and the special effects are superb. This is one of my all-time favorite movies of all time.",2.8957279,5.410453195001353
js_9,"... a lot of people seem to like this movie, I don't know if it's because of the acting, the cinematography, or just the fact that it has so much going for it. The acting is good, there are moments where I found myself laughing out loud, and the special effects were top-notch. There's also a good amount of humor to be found throughout the movie. Overall, this is one of my all-time favorite movies of all time. 9/10.",2.5747104,5.410453195001353
js_9,"..., I don't know what to say about this film. It is one of those films that you just want to sit back and enjoy. The acting is top-notch and the cinematography is superb. If you haven't seen it yet, check it out. This is a must-see for any fan of cinema.",2.7662573,5.410453195001353
js_9,"... in my opinion, one of the best films I have ever seen. It is a must see for anyone who enjoys suspense and suspenseful action sequences.",2.882161,5.410453195001353
js_9,"..., and that's exactly what I was expecting from this film.<p><b]The cinematography is top-notch at times, with a number of stunningly beautiful shots capturing the atmosphere of New York City during the height of the Cold War. The cinematographic techniques are also well suited to the mood of this story, as well as the subject matter. There is no shortage of eye-popping special effects throughout the film, such as explosions, exploding buildings, moving cars, etc. Some of these effects are particularly impressive for a sci-fi film like this, which is perfect for anyone who likes to show off their work. Overall, this is one of my all-time favorite sci fi films of all time. If you haven't seen it yet, check it out, if you want to see some of its best moments, then you'll have a great time.<c]All in all, a highly recommended film for any fan of sci flicks.",2.8301058,5.410453195001353
js_9,"... the story is well told and the acting is top notch. All in all, I highly recommend this movie to anyone interested in film making or any other kind of film-making endeavor.<a href=""http://www.imdb.com/title/tt002279"" style=""width:100%;height:200px;background-color:white"" />I highly encourage anyone looking for a good film to check it out. The acting, photography, special effects, etc. are all top-notch. This is one of the best films I've ever seen. Highly recommended.",2.823279,5.410453195001353
js_9,"... and I am so glad that I had the chance to see this movie. It is truly one of my all time favorites. I highly recommend this film to anyone interested in any kind of sci-fi or fantasy/horror movie, whether it be a horror movie or a comedy. If you are looking for some great Sci-Fi/Fantasy/Horror Movies, then this is definitely the movie for you. This is certainly one to keep an eye out for.<p><a href=""http://www.youtube.com/watch?v=4h7TgQZqkDw"" target=""_blank""><img class=""styles__noscript__2rw2y"" srcset=""https://dsx.weather.co.uk/util/image/widescreen/background-image.jpg"" width=""600"" height=""240"" alt="""" />The acting is top-notch as well, as is the cinematography.",2.6355872,5.410453195001353
js_9,"... The acting was good and the story was well told. The special effects were good too. I highly recommend this movie to anyone who is looking for a great sci-fi/horror movie that will keep you glued to the screen for an extended period of time. If you are looking to see if you have what it takes to become a Sci-Fi/Horror fan then this is the movie for you. It has everything you would expect from a sci fi/noir movie with plenty of action, suspense, humor, and a lot of fun to be had. This is definitely one of the best Sci Fi/Noir movies I have ever seen. 9 out of 10.",2.7545705,5.410453195001353
js_9,"... ""It's a Wonderful Life"" is one of my all-time favorite movies of all time. The acting is top-notch, and the special effects are stunning. I highly recommend this movie to anyone who enjoys family entertainment. If you haven't seen it yet, you're in for a treat. It's worth every penny.<a href=""http://www.youtube.com/watch?feature=player_embedded&v=yUZrLQJd0I"" target=""_blank""><img class=""styles__noscript__2rw2y"" srcset=""https://dsx.weather.co.uk/util/image/widescreen/background-image.jpg?vformat=VHS&width=900&height=500&wid=300&hei=150&scl=14.83333333333333"" width=""600"" height=""240"" alt="""" />You won't be disappointed with this film.",2.6464076,5.410453195001353
js_9,"... the story is very interesting, the acting is good, and the cinematography is fantastic. I highly recommend this film to anyone who enjoys sci-fi, fantasy, horror, comedy, sci fi, action, adventure, romance, mystery, suspense, humor, drama, thrillers, special effects, etc.",2.7957034,5.410453195001353
js_9,"... I didn't expect much from this film. The acting was good and the cinematography was superb. This is one of those films that makes you want to go see it over and over again. If you have never seen it before, you'll love it. I highly recommend this movie to anyone who enjoys horror/thriller films. It's a must see for any horror fan. 9/10. 8 out of 10.",2.7799091,5.410453195001353
js_9,"... the music is great, and the acting is top-notch. The special effects are fantastic, the cinematography is superb, as well as the special FX. This is one of my all-time favorite movies of all time. I highly recommend this movie to anyone who enjoys a good Sci-Fi/Horror movie. It's a must-see for any Sci Fi fan. 9 out of 10.",2.8762367,5.410453195001353
js_9,"... I didn't like it at all, but I loved it. The acting was top-notch, and the cinematography was superb. Overall, this is a must-see for anyone interested in sci-fi, fantasy, horror, sci fi, action, adventure, romance, comedy, drama, suspense, mystery, thrillers, etc. I highly recommend this movie to anyone who enjoys Sci-Fi, Fantasy, Thriller, Horror, Sci Fi, Action, Adventure, Mystery, Science-Fiction, Suspense, Drama, Comedy, Romance, Dramatic, Documentary, Poetry, Fiction, & Thrillers. <a href=""http://amzn.to/2wj1pQ"" target=""_blank""><img src=""https://static.photobucket.",2.819905,5.410453195001353
js_9,"... to be honest the first time I saw this movie I thought it would be a great film. I wasn't expecting much from it, but I was very pleasantly surprised with how well it turned out. This is one of the best films I have ever seen and I highly recommend it to anyone looking for a good film to watch over and over again. If you haven't seen it yet, don't worry, you won't want to miss it either. The acting was excellent, the special effects were superb, and the cinematography was stunning. Overall, this is a must-see for any fan of cinema, no matter where you are or what you see on the big screen. 8/10.",2.8561165,5.410453195001353
js_9,... of the film. The acting is superb and the cinematography is outstanding. One of my all-time favorite films of all time.,2.8842006,5.410453195001353
js_9,"... of course.<b><h1><a href=""http://www.youtube.com/watch?v=VqQ7Rr3d8wI"" target=""_blank"" frameborder=""0"" width=""100%"" height=""240px""></a><span style=""font-size:smaller;""><hr />This is one of the funniest films I have ever seen. The acting is top-notch, the special effects are superb, and the cinematography is breathtaking. This is definitely one to see again and again. If you haven't seen it yet, then you may want to check it out.",2.6579666,5.410453195001353
js_9,"... and I loved it. It was one of my all-time favorites. The characters were believable, the plot was well thought out, and the acting was top-notch. I highly recommend this movie to anyone who enjoys Sci-Fi, Fantasy, Horror, Sci Fi, Thriller, Action, Comedy, Romance, Mystery, Science-Fiction, Adventure, Drama, etc. All in all, a must-see for fans of Sci fi, horror, sci-fi, fantasy, action, comedy, romance, mystery, science-fiction, adventure, drama, thriller, suspense, thrills, thrillers, romances, fandoms, comedies, dramas, & more.",2.8959315,5.410453195001353
js_9,"... for the love of God.<b><a href=""http://www.imdb.co.uk/title/tt00294215/"" target=""_blank""><img class=""styles__noscript__2rw2y"" srcset=""https://dsx.weather.com//util/image/w/smooth-sky-trees-in-the-middle-of-central-america.jpg?v=at&w=485&h=273&api=7db9fe61-7414-47b5-9871-e17d87b8b6a0"" width=""425"" height=""240"" alt="""" />This is one of the best movies I have ever seen. The acting is top-notch, and the cinematography is stunning. You won't be disappointed with this one.",2.600554,5.410453195001353
js_9,"... and I loved it! The acting was top-notch, the cinematography was superb, and the special effects were amazing. Overall, this is one of my all-time favorite films of all time. This is a must-see for anyone who enjoys sci-fi, fantasy, horror, action, suspense, comedy, drama, romance, mystery, adventure, thrillers, etc. You won't be disappointed. 9 out of 10.",2.899631,5.410453195001353
js_9,"... and that is the only reason I gave this film a 10. The acting is very good, and the special effects are superb. Overall, this is one of my all-time favorite movies of all time. It's definitely one to keep an eye out for if you haven't seen it yet. If you do, be sure to check it out. You won't be disappointed.<a href=""http://www.imdb.com/title/tt009829/""><img class=""styles__noscript__2rw2y"" src=""https://dsx.weather.co.uk/util/image/widescreen/background-image-01.",2.6706495,5.410453195001353
js_9,".... This film has it all. The cinematography is top-notch, the acting is great, and the story is well thought out. All in all, this is a must-see for anyone interested in film-making. Highly recommended.",2.924724,5.410453195001353
