experiment,sample,reward,diversity
tvd_3,"... in my humble opinion, the movie was better than it could ever have been. This is not to say that the acting was bad, but the story was just plain terrible. I don't know if it was due to lack of talent, poor direction, or some combination of all the above. There were lots of other things going on, such as the fact that this was supposed to be a horror/sci-fi film, and there was a lot of nudity at times. Overall, I give this movie one out of 10. 7/10.",-2.7049675,5.634268837240404
tvd_3,"... the movie is a little bit of a bore, but if you want to watch it, don't waste your time on it.<p><briefly, this movie has nothing to do with the original series. It is simply a sequel to the previous series, and one that doesn't have any relevance whatsoever to any of the other movies in the series.<citation needed)<h/t: http://www.youtube.com/watch?v=8j3yQi9-Iw&feature=youtu.",-2.2785788,5.634268837240404
tvd_3,"... the only thing that bothered me about this movie was the lack of character development. This is not a good movie, but I don't think it's as bad as some of the other movies out there.<b>The acting isn't bad at all, and the story lines are pretty good, even though they don`t have anything to do with the plot. The only redeeming feature of this film is the ending.",-1.5443132,5.634268837240404
tvd_3,"..., even though he doesn't know what he's talking about.<b><strong>It's not nearly as bad as some people make it out to be, but it's a lot worse than some of the other movies that I've seen. <b>If you're looking for a movie that isn't so bad that you want to watch it, this one is for you.",-1.6330901,5.634268837240404
tvd_3,"... and that's why I don't like it too much. It doesn't make for a good movie at all.<b>8 out of 10<p><span style=""font-size: 12pt; line-height: 16pt""; background-color: white; text-decoration: none; font-family: ""Helvetica Neue"", sans-serif; border: 1px solid #ccccc; color: #fff; padding: 0.5em; margin-bottom: 15em!important; box-shadow: rgba(0,0,-0.4,1.",-2.0582793,5.634268837240404
tvd_3,".... If I could, I would give this movie a 4 out of 10.<p><briefly, the plot is very good and the characters are likable. This film is one of my all-time favorite movies of all time. It's definitely not for everyone, but if you like action and suspense, then this is for you.",2.4844847,5.634268837240404
tvd_3,"... the movie is an example of how you can put a lot of thought into what you are trying to do with your film. If you want to make a good movie, you need to have a director who knows what he is doing. That said, if you don't know what to expect from a movie like this, then you probably won't like it at all.<b>10 out of 10.",0.54726195,5.634268837240404
tvd_3,"... I don't know if it's just me, but I had to watch this film in order to find out what it was all about. The acting was terrible, the plot was weak, and there was a lot of bad dialog. This film should not be seen as a horror film. If you want to see a good horror movie, avoid this one. It is a waste of money and time. Avoid it at all costs. 7 out of 10.",-2.9617376,5.634268837240404
tvd_3,"... I don't know what to say about this, but it's a very entertaining film. If you're looking for a great sci-fi horror movie, look elsewhere. There are a lot of good horror movies out there, and if you like Sci-Fi Horror, then you'll like this one. However, if your looking to watch a good Sci Fi Horror movie that doesn't fall into the category of ""bad"" movies, go ahead and skip this movie. It's not worth your time or money to waste your hard earned money on this piece of crap.",-1.793387,5.634268837240404
tvd_3,"... I found this to be a very entertaining movie. There is a lot going on in it, and you can see it through the eyes of the characters. This is one of those movies that will keep you entertained throughout the entire movie even if you are not a fan of American Horror Story. If you would like to see this movie over and over again, don't miss it. Don't waste your money on this one.",2.3346195,5.634268837240404
tvd_3,"... the only thing you can say about this film is that it's not worth your time and money to see it. If you want to watch it, don't waste your money on it.",-2.15902,5.634268837240404
tvd_3,"... to be honest with you, there were a few moments where the movie didn't work as it should have. But overall, if you're looking for a good comedy/horror flick, this is the one for you. If you are looking to see a film that will make you laugh out loud, don't miss this one. It's not as good as some of the other comedies out there, but at least it has a little something to it.",-0.4218537,5.634268837240404
tvd_3,"..., this is one of the best movies I have ever seen. If you want to see a great movie, go for it.",2.6397076,5.634268837240404
tvd_3,"..., it's a very good film. It's definitely not for everyone, but if you're looking for a good romantic comedy, this is the movie for you. Don't get me wrong, I'm not a huge fan of ""Fantastic Four,"" but there are plenty of movies in this genre that are good, even if they aren't great as well as this one. However, if all you want to do is watch this movie, don't bother. You'll be disappointed.",1.5588439,5.634268837240404
tvd_3,"... I found this to be a great addition to my collection. I highly recommend this movie to anyone who has an interest in the history of science fiction, fantasy, horror, and comedy. It is a must see for any sci fi fan.",2.8114305,5.634268837240404
tvd_3,"..., I don't know what this movie is about. It's about a group of people who go on a journey to find a lost treasure and the end result is a completely different story than the one you would expect from a film such as this. There are lots of twists and turns and there is so much more going on in the movie than meets the eye. This movie doesn't take itself too seriously. If you haven't seen it yet, check it out and see for yourself.",1.7335411,5.634268837240404
tvd_3,"... to put it simply, this is a bad movie. It's so bad that I don't want to waste my money on it. The acting is terrible and the story is so stupid that it makes you think about what kind of movie it was meant to be.",-2.9289634,5.634268837240404
tvd_3,".... <brief introduction of the main character in this movie is to be expected, but it's a nice change of pace from the previous two films).< br /><span style=""font-size: 12pt; font-weight: bold; line-height: 10pt;"" />The story takes place in a small town in the middle of nowhere, and there is a huge amount of tension. The characters are all fairly likable, though there are a few things that stand out. For example, they all seem to have an affinity with each other, which is good, because it gives them something to think about.<BR /></span><p><div id=""A"" class=""spoilers"" width=""5pt"" type=""text/html"" />There is also a lot of nudity, too, especially at the beginning, as well as the fact that the whole town is surrounded by trees.",0.7724444,5.634268837240404
tvd_3,"... I have never been a big fan of the original series, but this is one of those movies that made me think about just how bad it really was. The acting was poor, the plot was incoherent, and the special effects were atrocious. If you like Sci-Fi, then this movie is for you. But if you don't like sci-fi, this isn't for your taste.",-2.7785096,5.634268837240404
tvd_3,"... I was really excited when I saw this movie. The cinematography is superb, the acting is top-notch and the production values are solid. It's a shame that so many people don't know what they are getting into. This is one of those movies that you will never get tired of watching. If you are looking for a good film to watch with your friends and family, check this one out.",2.3490367,5.634268837240404
tvd_3,"... of course, it's also the first movie I've ever seen. It's a lot better than what you'd expect from a teen horror flick, and is definitely worth your time.<3/10 for the acting, the story, some of the special effects, as well as the cinematography. The only negative thing I had to mention is the soundtrack, which sounds like it might have been recorded in the 70s.<1/5 out of 10. This is one of my all-time favorite films of all time. I recommend it to anyone looking for a fun, suspenseful film with lots of action, scares, gore, humor, romance, etc. If you don't like teen slasher movies, this may not be for you.",2.7415962,5.634268837240404
tvd_3,"... to be honest, I don't know if the movie is worth watching if you're a big fan of horror movies or if it's just for kids. If you are looking for something that will make you cry out loud at the end of the film, then this is the one for you.",-0.15210222,5.634268837240404
tvd_3,"... a lot of the time they're trying to figure out what to do with the characters. It's hard for me to believe that this movie made it to the box office. If you haven't seen it yet, watch it if you don't want to waste your time.",-1.0822653,5.634268837240404
tvd_3,"... the movie is full of clichés and a lot of things you don't expect to find in a horror movie. I'm not sure if it's because the characters aren't very likable or because there isn't much of a plot. It's just that most of the time, we don`t know what to expect from the main characters. We don´t even get to see many of them. The worst thing about this movie was the fact that it wasn`ts really scary. There`ll be some good scares, but not enough of one. This movie doesn`T have anything to recommend it at all. If you want to watch a movie like this, make sure you check out the other movies on the list. Otherwise, you won`nt be disappointed. 4 out of 10.",-2.6932452,5.634268837240404
tvd_3,"... I don't know what to make of this movie. It doesn't have the same charm and feel as a lot of the other movies I've seen. In fact, it was so bad that I didn't even think about watching it again. However, if you do watch this one, you will be glad you bought it. If you haven't seen it yet, then you won't be disappointed.",-2.2039566,5.634268837240404
tvd_3,"... to be honest I can't see why anyone would do this. It's not a very good story, but it's a decent one. If you're looking for a good romantic comedy, this isn't it. This is just a waste of time and money. Don't waste your time with this movie. At least if you don't like it, you won't watch it again.",-1.9841163,5.634268837240404
tvd_3,"... and the rest is just plain boring.<span class=""separate"" style=""background-color: red; background-image: url(http://i.imgur.com/WjYXtZp.",-3.011769,5.634268837240404
tvd_3,"..., I don't think that's a bad thing. The movie is better than most of my other movies.",1.845844,5.634268837240404
tvd_3,".... But there is so much wrong with this movie that it's really not worth your time. There are lots of things wrong in this one, like the pacing, the acting, and the script. The only reason I gave this a 3/10 is because of the way the characters were portrayed. It would have been nice to have some kind of storyline out of this mess, but it just didn't work for me. If you can't handle any of these things, don't watch this film. Otherwise, you'll be wasting your money. Avoid at all costs.",-2.9077203,5.634268837240404
tvd_3,... that is the kind of thing that you want to see more of in your life.,1.6535103,5.634268837240404
tvd_3,"... I hope to see this movie in the next year or so. You'll be able to find it on VHS, DVD, and/or other digital distribution channels. Thank you for your continued support of the film. If you haven't seen it yet, don't worry. It's available on DVD and can be ordered on IMDb. This is a must see for anyone looking for something good to watch with friends, family, or any other group of friends.",2.5024846,5.634268837240404
tvd_3,"... I don't know if it was meant to be a comedy, but one of the best parts of this movie is when we see the two main characters together in their first scene. It's a really funny scene, and definitely one that will keep you laughing throughout the whole movie. If you're looking for something a little bit different, this is the one for you. I highly recommend this film to anyone who likes comedy.",2.814035,5.634268837240404
tvd_3,"... the only thing that stopped me from seeing it was the fact that I had never seen this movie before. There were a number of times when I thought, ""Wow, this is so stupid!"" and didn't know what else to do. So I went into the theater and sat there and watched it all over again. It wasn't until the end where I realized that the guy in the middle of the movie was really trying to get me to believe that he was going to make some kind of big deal out of this film. I couldn't believe how stupid this was.<b><span style=""border-top: 1px solid #ccc; padding-bottom: 0px; border-left: none; background-color: #fff; text-shadow: rgba(0,0,-0.4,1.",-1.7245235,5.634268837240404
tvd_3,"...I'm sorry, but I don't know what the hell happened to this one.<BR /><B />Don't watch this movie. Don't bother with it. Avoid it at all costs. It's not worth your time or money. Do yourself a favor and stop watching this crap. You'll be glad you did.",-2.9218194,5.634268837240404
tvd_3,"... that's what I was looking for. But, it wasn't enough.<p><b>The worst part of the movie is the scene where the guy who played the lead character dies in a car accident. That's all there is to it. The whole movie seems to be about him falling in love with his best friend, but he doesn't have a girlfriend at this point. And, once again, the plot isn't that great either. All in all, if you don't see it on TV, don`t waste your money on it, and don´t buy it unless you`re a fan of John Cusack or Tom Berenger.",-2.6667416,5.634268837240404
tvd_3,"... I don't know if it was supposed to be an action-comedy or a thriller, but it certainly wasn't. <b>Overall, I give this film 4/10. If you are looking for a low-budget horror movie, look elsewhere.<p><span style=""font-family: Arial; color: gray; font-size: 1.3em; line-height: 0.5em;""><a href=""http://www.youtube.com/watch?v=yTQh6iH1jUY&feature=youtu.",-2.124938,5.634268837240404
tvd_3,"... I think it was the best film I have ever seen. There is no doubt about it, but it is one of the worst movies I've ever had the misfortune to see. It is a terrible movie that should never have been made. I just can't believe that this movie has actually been nominated for an Academy Award! The acting is terrible, the directing is bad, and the special effects are horrible. This movie is so bad that I am ashamed to say that it isn't even worth watching anymore. Don't waste your money on this pile of garbage. Do yourself a favor and rent this one.",-2.9394183,5.634268837240404
tvd_3,"... of a movie. The plot is simple and the acting is wonderful. Don't waste your time watching this film unless you want to see a good, suspenseful movie.<p><brief summary]The story takes place in a small town with a population of about 2,000 people. There are a bunch of bad guys trying to take over the town. However, one of the bad guy's friends decides to kill them off with his gun. Luckily, the police don't have anything to worry about, and he doesn't try to stop them. At first, I thought it was a very funny movie, but then I realized that it wasn't. It didn't make me laugh, it just made me angry. So, for those of you who aren't going to watch this movie because you're afraid of being killed by baddies, avoid at all costs. Otherwise, you'll be disappointed. This movie is not for everyone.",-1.0156511,5.634268837240404
tvd_3,"... that's a lot of fun to watch. But for the most part, it's an entertaining movie. If you're a fan of Sci-Fi, you'll love this movie! It's not just sci-fi, but also horror, romance, comedy and more!<p.s. I'm really looking forward to seeing more of this type of movie when it comes out on DVD. The only reason I haven't seen it yet is because I wasn't able to find it on my local video rental store. So if you are a Sci Fi fan, make sure to check it out! There are plenty of great Sci fi movies out there! <p.",2.4004788,5.634268837240404
tvd_3,"... for those of you that haven't heard of it. It's the story of a young boy who falls in love with a girl he doesn't know, and then decides to get involved with her. However, when he discovers that she is pregnant, he starts thinking more about his life than he thought he was going to. In fact, there's so much more to this film than meets the eye. The characters are so different from one another that it's hard to tell if they're the same person or not. There are a lot of scenes that seem like they've been shot on location, such as the wedding scene where the main character takes off his clothes and goes topless, etc. All in all, this is one of the best films I've seen in a long time. Highly recommended.",2.7804654,5.634268837240404
tvd_3,"... to be honest with you guys, I was hoping for a little more of this kind of stuff. It wasn't too bad, but not much. The music in the movie is pretty good and the acting is great. Also, if you are looking for something a bit more serious, check out the ""Gimme Shelter"" movie. Don't waste your time on this one. You'll have a better time watching it. If you haven't seen it yet, skip it and watch it again.",0.030836282,5.634268837240404
tvd_3,"... the music is great, and the acting is top notch.",2.8056316,5.634268837240404
tvd_3,"..., this film was one of the worst movies I've ever seen in my entire life. It's really hard to believe how many times I have watched this movie and still haven't figured it out. This is a bad movie as far as I am concerned. There are so many good things going on in this world that I don't know whether to laugh or cry. The acting is simply awful. I can't think of a single good thing about this piece of garbage. Don't watch this if you're into bad movies. If you want to see something good, skip this one.",-2.952331,5.634268837240404
