experiment,sample,reward,diversity
tvd_3,"... the acting was so bad I had to watch it again and again. All in all, this film is not a great horror film at all. The acting is good, but if you like scary movies with bad acting, don't bother watching this one. If you are looking for a good horror movie with good acting and lots of scares, stay away from this crap. You won't be disappointed. Don't waste your time or money on this.",-2.711067,5.634268837240404
tvd_3,"... in the case of this movie it was a little bit better than I expected, but that's about it.<p><span style=""color:#f2f1f3; font-family:""Arial"", ""Helvetica Neue"", sans-serif; line-height: 1.5em; color: #ccccc; letter-spacing: 2.4em}<script type=""text/javascript"" src=""http://www.imdb.",-0.78320426,5.634268837240404
tvd_3,"... I can't believe that someone would make such a stupid movie. <brief pause, then the rest of the movie starts to turn into a lot of fun and laughs.<cid>Overall, this is one of those movies that should have been made more than once in the 90's or so. It's a very entertaining movie with lots of great moments. Don't get me wrong, it's not really a bad movie at all, but it just isn't worth seeing if you're like me and don't enjoy watching it every once and awhile. However, if your looking for some good 80's humor, watch this one instead. You won't be disappointed.",1.3940454,5.634268837240404
tvd_3,"... and this is one of the worst movies I have ever seen. The only good thing about this movie is that it doesn't seem like it was made by a bunch of people who didn't know what they were talking about. There are so many bad things in this film that even the most die-hard Sci-Fi fan will want to skip this one. At least if you aren't a Sci Fi fan, you won't be able to give this an 8 out of 10. If you're looking for a good Sci fi movie, don't waste your time on this. Don't get me wrong, this isn't as bad as some other sci fi movies out there, but not by far.",-2.802861,5.634268837240404
tvd_3,"... I would love to see this movie again, but I don't think it will be as good as it could have been. The only thing that made the movie even worse was the ending. It had me thinking about the film and wondering why so many people didn't like it. This movie is a waste of time and money. If you want a bad horror movie, stay away from this one. Don't waste your time or money on this garbage.",-2.8899581,5.634268837240404
tvd_3,"..., but it's not that bad! It's just a really good story, and there's lots of action to be had in it. There's a lot of nudity, too, with some of the girls being played by real women, like Gwyneth Paltrow and Laura Dern. And, of course, there are so many gorgeous women in this movie, I can't even imagine why anyone would want to see them. Most of all, though, this is a movie that will leave you longing for more.<p><span class=""redactor"" style=""color: #ccccca; font-weight: bold; line-height: 1.",1.9731177,5.634268837240404
tvd_3,"..., and that's about it.<h1>As for the film itself, I don't think there is much to recommend it other than that it's a really good movie. It's one of my favorite movies of all time, if not the best in the history of cinema. If you want to see a great movie, watch this one. And if you're a fan of classic horror films, you'll enjoy this movie as well. But if your looking for a good horror film, look no further than this. This is definitely one to watch over and over again.",2.6832857,5.634268837240404
tvd_3,".... The plot is very predictable and the characters aren't particularly interesting. If you don't like this movie, don`t watch it. And if you're looking for a good laugh, avoid it at all costs. There are so many bad movies out there, I can't recommend this one to anyone.",-2.9015505,5.634268837240404
tvd_3,"... it's just one of those films that doesn't really make any sense. The plot is simple enough and the characters are very likable. It's a shame that this film didn't have an Academy Award nomination at the time of making it to the big screen. If you want to see a great story about love, don't bother with this one. But if you're into action thrillers, go ahead and pick up this movie. You'll be sure to enjoy it as much as I did.",1.3513603,5.634268837240404
tvd_3,"..., I was surprised to see that this movie was released in a foreign language. If you want to know what is going on in your life, check this out.",1.4554769,5.634268837240404
tvd_3,".... The animation is stunning, the acting is perfect, and the special effects are all top notch. If you're looking for something to watch on a Saturday afternoon, check this one out. It's a must-see.",2.8499372,5.634268837240404
tvd_3,"... of the film. I don't think I have ever seen a film that made me laugh in my entire life and I'm so glad I did. <SPOILER ALERT: If you're reading this, then you've probably seen this movie before. If not, you may be missing out on a lot of great moments.<BR /><BR />The acting isn't quite as good as it could have been, but it's still pretty damn good. The special effects are top notch, and the characters are very likable.",2.5344152,5.634268837240404
tvd_3,"... The best part about this film is that it doesn't take itself too seriously. It isn't a drama, it's a comedy. This film could have been a good movie, but it just didn't work for me. If you're looking for a great comedy, skip this one. I wouldn't recommend this movie to anyone who hasn't read the book, and you shouldn't watch it if you don't want to waste your time trying to figure out how to make a better movie.",-2.4538913,5.634268837240404
tvd_3,"..., but it's not as bad as you might think. It's a pretty good movie. There are some nice shots of the city, with lots of people walking around. But overall, if you're looking for a good horror movie, don't bother. Don't expect too much from this one.",1.6345015,5.634268837240404
tvd_3,"... and they're not the only ones. The rest of the cast are either miscast, poorly acted, or downright awful. If you haven't seen it yet, check it out. I give it a 2 out of 10. Don't watch it if you don't have the time. It's one of those movies that makes you want to kill yourself.",-2.291708,5.634268837240404
tvd_3,"... I don't know how, but that's what it is. It's one of those movies where you see a bunch of people in front of a computer screen, and the first thing they do is look at each other and say, ""Hey, let's get out of here!"" You know, like, half way through, right? And the second thing is, they just sort of stare at the screen with their mouths closed. Yeah, yeah, there's that one scene where they're looking at me, so I can't tell if it's good or bad, because it just kind of stinks. But then there are a couple of scenes where all of these people are staring at one another for no apparent reason. So, okay, OK, this movie gets a lot of attention, doesn't it? Well, I guess it has to do with the fact that it seems to have a cult following.",-0.76003224,5.634268837240404
tvd_3,"... to be honest. This is one of those films where you just have to sit back and enjoy it for the duration of the film. It's got a lot going for it, but at the same time, there are some great moments. The characters are likable, and the acting is good. I give this a 9 out of 10.<url=http://www.youtube.com/watch?v=7kqD4jh2OoU&feature=youtu.",2.4831324,5.634268837240404
tvd_3,"... and I think that's a shame because if you want to see a movie with good acting, good directing and good script writing, this is the movie for you. If you don't like it, give it a chance. It's one of the best films I have ever seen in my life.",2.3172712,5.634268837240404
tvd_3,... I think this is one of the worst movies I've ever seen.,-2.8247569,5.634268837240404
tvd_3,"... I think that it would be interesting to see what kind of movie he made and who he came up with. It's a shame that they didn't make more movies like this, as they can only do so much with their money.<b /><span class=""spoilers"" title=""A Tale of Two Sisters"" link=""http://www.youtube.com/watch?feature=player_embedded&list=PL-RkLQyPvH1VzCwE"" target=""_blank""><img src=""https://media.xbox.net/images/img/3d/9e/8c/4ee/7a6/2d0/5f8/fdd5/1d90/0000000000000100_i.jpg"" width=""600"" height=""320"" />The movie starts out with two sisters in love, but the film ends with them falling in each other's arms.",-1.5417705,5.634268837240404
tvd_3,"... in my opinion the best movie ever made by a major studio.<span class=""main"" title=""movie_1"" style=""font-size: 12pt; text-align: center; font-weight: normal; line-height: 3pt;"" />If there's one thing I've learned from watching this movie, it's that even though it is a good movie you can't take your eyes off it.",1.7516241,5.634268837240404
tvd_3,"... and I don't know why it's so hard to come up with a good script, but if you want to see this movie, the only way is to watch it. But if your looking for a film that will make you laugh out loud, then check this out. It's not worth the time or money it would take to rent it, unless you have a sense of humor.<BR /><BR />8 out of 10.",-2.518447,5.634268837240404
tvd_3,"... a lot of the actors in the film look like they are from another era. There are so many scenes that make up the whole movie, but I don't think there is one scene that was better than the other ones. Also, the fact that all of this is filmed in a small town makes it difficult to know if the story is true or not. If you watch the entire film, you will be able to figure out which part of it is real and which isn't. The acting is very good, although some of them are too predictable. Overall, I recommend this film to anyone who likes to watch old movies, especially if they don´t want to spend money on expensive special effects. Do yourself a favor and rent this movie. It´s worth it.",2.0994768,5.634268837240404
tvd_3,"... I didn't expect much from this movie, and that's saying a lot. The story itself isn't great, but it does have its moments. There are plenty of memorable scenes, like when the girl tries to escape from the clutches of an old man, who was trying to get her out of the house. But most of all, the acting is very good. If you haven't seen this film yet, don't miss it if you're a die-hard fan of bad movies. Otherwise, stay away.",1.5668234,5.634268837240404
tvd_3,"... (I have no idea why the guy who wrote the script didn't write it, but I think he was trying too hard to be funny.)<span style=""font-size: 12pt; line-height: 6pt"" font-weight: 300; color: red; background-color: gray; padding-bottom: 7pt;""><span class=""separator"" target=""_blank"" align=""center"" tabindex=""0"" cellspacing=""10pt""; border-top: 1pt solid #ccc; border -left: 2pt dashed #ddd; box-shadow: rgba(0,0,-0.2,1.",-1.9041252,5.634268837240404
tvd_3,".... <brief description of the film, edited for IMDb]I don't know if it's because of a lack of money or if there was some kind of budget involved, but I can tell you that this is a very good film. The cinematography has a lot going for it, which is something I had never seen before. There are some scenes where the camera isn't working as well as it should, and the special effects aren't as good as they could have been. But overall, this film is worth checking out even if you don`t know what to expect from it. Watch it if your not a fan of horror films. If you like suspense, then you'll love this one. It`s definitely worth a look. 4 out of 10.",2.6703792,5.634268837240404
tvd_3,"... I think it's one of the best films I have ever seen, and I can't wait to see it again.",2.6262357,5.634268837240404
tvd_3,"... of course, there is the fact that the film was made only a week after the events in ""The Shawshank Redemption"" and not before. I found it hard to believe that such a low-budget film would have been able to garner so much attention from so many people as it did.<references back to earlier comments)<spoiler alert]There is one scene in the movie that makes you wonder whether or not this was meant to be a psychological thriller. It is, however, a very good example of how to make a film that is suspenseful, but at the same time realistic. One of the things that sets this film apart from any other Hitchcock film is that it tries to do something that no other film has tried to accomplish. There is a lot of suspense in this movie, and it doesn't try to get away with it either.",1.2177922,5.634268837240404
tvd_3,... the movie was so bad it scared the hell out of me. The only good thing about this movie is that I don't think it will ever be released on DVD or VHS again.,-2.6571178,5.634268837240404
tvd_3,"... to be honest, I wasn't expecting much. This movie is just plain boring. It's a waste of money and time. The story revolves around a group of people who live in a house with lots of holes in the walls. When one of them dies, he goes to the living room. He wakes up in his bed next to a mirror. One night, when he wakes back up, the mirror is still there, but he doesn't know why. So, instead of going to sleep, they go to his room and watch some movies. Then, after a while, another person comes out of the house, and they find out that this person is a member of a band called ""The Living Dead."" Well, you guessed it, this guy is actually from the band. In fact, we don't even need to see what happens to him. All we have to do is open the door and enter his bedroom.",-3.028904,5.634268837240404
tvd_3,"... and I'm not kidding.<b/c) This movie has no redeeming qualities other than being one of the worst films I have ever seen. The acting is awful, the plot is terrible, and the story is a complete mess. If you're looking for a horror movie that will keep you on the edge of your seat, this is the movie for you. Don't even waste your time with this movie.",-3.0298247,5.634268837240404
tvd_3,"... I had never heard of this movie before, so I wasn't sure what to expect. However, I was pleasantly surprised by the way it turned out. The story is well-written, with plenty of twists and turns to keep you interested. It also has lots of great action sequences, such as a huge explosion at the end of the movie. A lot of characters are very likable and believable. Overall, this is one of my all-time favorite movies of all time.",2.8240056,5.634268837240404
tvd_3,"... to be honest, I didn't think much of the movie at all. I have never seen a movie like this before, and I don't understand how anyone could enjoy it.<citation needed] <brief description of what is supposed to make this movie good would be superfluous, but for the most part, it's a very entertaining film. There are plenty of laughs throughout the film, as well as a lot of violence. The acting is good, too, although it doesn't come across as overly gory or gratuitous. Overall, if you're looking for a good horror movie, this one is definitely not for you.",1.3699945,5.634268837240404
tvd_3,".... If you are a fan of the series then this is for you. But if you haven't seen it yet and don't have time to watch it, go ahead and see it. It is truly one of those films that will keep you glued to your TV until the end. You will laugh, cry, smile and feel good about yourself after watching it.<p.s. Don't waste your time or money on this movie. There are so many better films out there than this one. I highly recommend it to everyone.",2.5022616,5.634268837240404
tvd_3,"... and then there are those who want to see the end of the story. The ending is a bit weird at first, but then it really gets into the point where the movie becomes even more interesting.<span style=""vertical"" width=""600"" height=""250"" title=""The End"")<BR /><p><span class=""bold"" style=color=""#fff"" content=white><hr width=500 height=250><ul class=right><li><a href= ""http://www.youtube.com/watch?v=oJ9hB8Qz-Rw&feature=youtu.",0.980698,5.634268837240404
tvd_3,"... the acting, writing, direction, cinematography, photography, special effects etc etc. are all top notch.",2.4614835,5.634268837240404
tvd_3,"... and it wasn't until the beginning that I realized what was going on. This is not a movie for people who want to watch some sort of drama or drama, but for those who just don't have time for that type of stuff. For me, this movie was nothing more than a vehicle for me to sit back and enjoy my time with my girlfriend. It's also a film that has something to do with the life of a young woman.<BR /><BR />The acting in this film isn't very good at all. The plot is weak at best and predictable at worst. Most of the scenes are cut out so as not to spoil any of your enjoyment of this flick. However, there are some scenes that make you feel sorry for the viewer, and one of them is the scene where the girl gets stabbed to death.",-2.4950535,5.634268837240404
tvd_3,"..., I don't know what kind of movie this is, but it's interesting enough to warrant a look. Well worth watching if you haven't seen it yet. If you just want to see a little bit of the story, then skip this one. It's more of a comedy than anything else, so don`t expect much from it, even if it`s good.<BR />< BR />4 out of 10.",1.2035927,5.634268837240404
tvd_3,"... that was a good movie. I'll give it 10 stars because this movie is so bad. It has all the elements of a bad movie, but if you want to have a fun time, watch this one. You won't be disappointed. 4 out of 10.",-1.8082187,5.634268837240404
tvd_3,"..., this is one of the best films I've ever seen.",2.7798858,5.634268837240404
tvd_3,".... The actors in this film do a very good job, and it's nice to see that they were able to put together a film that could have been more successful than this one. I highly recommend this movie to anyone who is interested in the history of cinema. It is a great introduction to the world of the silent era, as well as a glimpse into the lives of so many people around the same time. A must-see for fans of all ages. 7 out of 10.",2.8461733,5.634268837240404
tvd_3,"... and I can't think of a single word to describe how wonderful this movie is. The acting is good, the special effects are great, and the music is just perfect.",2.8106265,5.634268837240404
tvd_3,"..., the only reason I watched it was to see if there was any sort of connection to the original. It wasn't until after the first half hour or so that I really got the hang of what was going on and how this movie was supposed to be made. So let's just say that it didn't make it to DVD. There are a lot of movies out there that you can rent and enjoy and don't have to worry about being disappointed. This is one of those movies that doesn't really matter because it's pretty good. As far as I'm concerned, this is the best movie I've ever seen. The acting is top-notch and the direction is also top notch. You won't be disappointed with it. I highly recommend it for anyone who likes horror movies.",2.4790623,5.634268837240404
tvd_3,"... and this is the first movie I've ever seen where you get to see the whole thing in one sitting. The acting is excellent, the cinematography is fantastic, and the special effects are superb. It's my favorite movie of all time.",2.8366704,5.634268837240404
tvd_3,"... to be honest, I don't know what to make of it.<b><ul><li><abbreviations:<i.e. ""The Story"", ""Citizen Kane"", etc.)<ii. e.g. <i] ""Honeymooners""<iii. a.k.a. the movie itself<iv. b.o.d.><v. i.c.s)<vi. d.f.t.",-1.869499,5.634268837240404
tvd_3,"... and I couldn't believe it.<lf><lf]I don't know what to say about the other two movies in the same category, but this one is better than the first. It has all the elements you expect from a horror film - suspense, gore, action, special effects, and so on. The acting isn't that great either, which is part of the reason why I like this movie so much.",1.6126418,5.634268837240404
tvd_3,... the film is full of great performances from all kinds of actors and actresses. It is a very enjoyable movie. I recommend it to anyone looking for a good laugh at some of the worst parts of life.,2.7747917,5.634268837240404
tvd_3,"... and it is only a matter of time before the film is destroyed by the evil genius who wants to destroy it. The movie is based on a true story about a man who lost his job as a security guard in order to save his family from a terrorist attack. This movie was so bad that after the death of his wife, he decided to give it a try. However, the director did not pay attention to the fact that all of the actors were dressed like they were supposed to be in the movie. Instead, we get a picture of a girl wearing a bikini and one of her male friends wearing nothing at all. I would also like to point out that there are no references to sex in this movie whatsoever. In fact, if you want to see a movie that doesn't involve sex, go watch the original ""Scream"" instead of this one.",-2.6946166,5.634268837240404
tvd_3,"... to the tune of a half-million dollars. I was hoping for something more than that. At times, I felt like I wanted to see some sort of movie, but just couldn't get it through to my nerves. The best thing about this movie was the soundtrack. It's so well done, you don't have to take yourself too seriously to enjoy it. Most of the characters are likable and interesting, and they all seem to fit together really well. Of course, if you're not in love with them, then you probably won't like this one at all. If you want to watch a romantic comedy, this is the film for you. Don't waste your time on this.",0.0148956785,5.634268837240404
tvd_3,"... to be honest, I couldn't care less about this film either.<div><strong><img class=""styles__noscript__2rw2y"" src=""http://dsx.weather.com//util/image/w/sparks.jpg?v=at&w=485&h=273&api=7db9fe61-7414-47b5-9871-e17d87b8b6a0"" /><body dir=""ltr"" ><p style=""font-size:smaller;"" /></p><hr />The movie starts out promisingly, with a cast of characters who are all very likable, but the story drags on and on.<span class="""" style="""" type=""text/html; charset=utf-8""></span><ul><li><a href=""/path/to/main.",-2.4676278,5.634268837240404
tvd_3,"..., I don't know about you, but if you want to be a good actor, you have to get better than this. There is nothing wrong with that.<b><span style=""bold"" class=""western"" href=""http://www.youtube.com/watch?v=hVqXw2Rj-s&feature=youtu.be&hl=en"" target=""_blank""><img class = ""stylesheets"" src = ""/images/animation/video/1/3/0/8.",-0.44836384,5.634268837240404
tvd_3,"... for example, this is the first time I've ever seen any kind of movie that features a lot of violence and nudity. And then there's the fact that most of the acting in this film is pretty awful. I don't think you can blame them for this one either; they could have done a better job with the lighting and the cinematography. Still, I give it a 9 out of 10.<p><b]Overall, if you're looking for a good night's sleep, avoid this movie at all costs. If you want to see a horror movie with lots of gore, nudity, and violence, skip this trash. It's just not worth your time.<h/t: www.youtube.",-2.8836074,5.634268837240404
tvd_3,"... I found this movie to be one of the worst movies I have ever seen. It was so bad, I couldn't even believe it was a horror movie. The acting was horrible, and the direction was awful. I don't know if that was intentional or not, but it didn't make up for it. This movie sucked. There was no chemistry between the characters, they just seemed to fall in love with each other.<b><span class=""redactor"" style=""color:gray"" />The only reason I watched this was to see how hard it would be to get my head around some of what was going on in the film. But all in all, this is probably the WORST movie I've ever heard of. If you like horror movies, then go see something else. Don't waste your time on this one. You won't regret it, unless you're a huge fan of Wes Craven's work.",-3.020607,5.634268837240404
tvd_3,"... The only thing that kept me watching the movie was the music. The songs were good, but not as good as some of the other movies I've seen. Overall, this movie is a must-see for anyone interested in sci-fi and fantasy. If you have no interest in science fiction and/or fantasy, don't bother with this one. Don't waste your time or money on it.",0.5680937,5.634268837240404
tvd_3,"... I was a little disappointed that this movie didn't have more than two hours of action. As far as the story goes, there isn't a lot going on in it other than the main character and a bunch of guys trying to get out of prison. The plot is all over the place, and if you want to see a bad movie, skip this one. If you're looking for a good laugh, stay away from this film. I don't think I've ever seen so much violence in a movie as I did in my entire life.",-2.237255,5.634268837240404
tvd_3,"... of course, there is also the fact that the film was shot in a very low budget. This means that if you are looking for a low-budget horror film then you won't find this one. However, if your looking to watch a good horror movie then this is definitely not for you. If you really want to see a decent horror flick then go ahead and check it out. Otherwise, avoid this film at all costs.",-2.2652223,5.634268837240404
tvd_3,".... I don't know what else to say, but let me just say that this was one of the worst films I have ever seen. The acting was awful and the cinematography was horrid. It is a shame that so many people were able to view this film. If you're a fan of bad movies, there are better movies out there than this one. However, if you want to see some truly bad cinema, do yourself a favor and rent this movie. You won't regret it. Don't waste your hard earned money on this crap.",-2.994039,5.634268837240404
